,0,1,2,3,4,5,6,7
654,Natalie,8.0,Royaume-Uni,,"Loved the retreat, very peaceful and family friendly. Perfect for our two boys, who are 6 and 3.","It could have been a little bigger with a more updated appearance. Was a bit expensive for the four days, but the facilities were very good.",Mai 2022,Commentaire envoyé le 3 juin 2022
655,Chris,7.0,Royaume-Uni,,"good location, nice and spacious compared to a hotel room for a family","Beds are hard! was a bit surprised when trying to get to sleep how hard they are!  the lodge we stayed in was a bit tired, curtains didn’t really fit well, scuffs etc but it was not awful at all, would consider staying. again hopefully better beds then!",Mai 2022,Commentaire envoyé le 17 mai 2022
656,Jan,8.0,Royaume-Uni,,The privacy of our own cabin,"The distance from the facilities. Even though we were in a Pioneer cabin  we were still too far to walk from the facilities, after a full day in the park. Some sort of payable shuttle would be welcome",Mai 2022,Commentaire envoyé le 17 mai 2022
657,Eva,8.0,Pays-Bas,,great location and surroundings. very convenient for Disneyland but still peaceful. love the pool,the safe was broken,Mai 2022,Commentaire envoyé le 17 mai 2022
658,Nuno,9.0,Espagne,,piscina e toda a envolvente florestal e ambiente country,,Mai 2022,Commentaire envoyé le 16 mai 2022
659,Natasha,9.0,Royaume-Uni,,"As a family of 4 travelling, we liked that we had more space than just staying in a hotel.  It has 2 bathrooms and toilets. Beds were comfy. space for parking outside your cabin.  The pool is amazing and our son absolutely loved it,  there is also a restaurant and a shop on-site which we used to purchase breakfast items to have in the cabin before a day out at the parks.","I honestly can’t really fault anything- they did tell us at reception that the cabin had a travel cot in but it didn’t so we had to call reception from the phone in the cabin to get one sent over, which only took about 10min for them to deliver.",Mai 2022,Commentaire envoyé le 14 mai 2022
660,Jelena,7.0,Suisse,,"Good location, quiet, in the middle of the forest. Nice change of atmosphere after visit to Disneyland. Swimming pool is nice and quite big.","Breakfast could be more healthy and interesting There were only croissants, compot and nuttella / confiture. Beds were creaking loud.",Mai 2022,Commentaire envoyé le 9 mai 2022
661,Laura,8.0,Royaume-Uni,,Great for Disney downtime. Own space and so much better than a hotel room. The pool is amazing 🤩,The beds could be better.,Mai 2022,Commentaire envoyé le 3 mai 2022
662,P,7.0,Liban,,"you need a car to stay in that location , I didn't the pool but it is clean , the beds are not that comfy and they are a bit small . Cleanliness is average but then again we are in the woods , so you do expect to see some insects .","the beds , and definitely shuttle buses from and to Disney land Paris .",Avril 2022,Commentaire envoyé le 28 avril 2022
663,Laura,7.0,Royaume-Uni,,"Lovely setting in woodland area and great location 10mins drive from Disneyland. Really friendly and welcoming staff, so lovely with our children. Swimming pool was amazing just cold so couldn’t stay in for long. Good kids play area and mini golf on site. Good kitchen facilities and equipment. Shower was nice and warm and good water pressure.",Bed not very comfy and cabin in need of a little TLC. Although high chair not ideal for 7 months old baby. Also no space in bedroom for cot for baby. Swimming pool is very cold.,Avril 2022,Commentaire envoyé le 23 avril 2022
664,Brimberg,8.0,Israël,,The swimming pool is big bonus and other facilities were perfect as well. The cabin is well equipted. Location was great.and easy to find.,No cleaning services during the visit but when we asked for towels etc...they arrive fast.,Avril 2022,Commentaire envoyé le 22 avril 2022
665,Jacqui,8.0,Royaume-Uni,,"The swimming pool is awesome!  Plenty of space in the cabin, decent shower. Comfy beds. Lovely setting.",No shuttle to Disney!! So it’s 25 euro each way. Also our cabin was 15 min walk from Reception which isn’t great without a car and very tired small children - but the staff gave us a lift. Brekkie overpriced.,Avril 2022,Commentaire envoyé le 16 avril 2022
666,Peter,7.0,Royaume-Uni,,,"Didn't have cotbed or highchair on arrival, was delivered quickly but highchair was faulty. Took 2 full days to provide a working highchair, despite several requests and promises of urgent attention.",Avril 2022,Commentaire envoyé le 14 avril 2022
667,Michelle,8.0,Royaume-Uni,,Lovely huts. Spaced out. Great pool.,Cold showers in swimming pool and floor in changing rooms very dirty towards the end of the day. Single bed in Children’s room very squeaky.,Avril 2022,Commentaire envoyé le 13 avril 2022
668,Lorena,9.0,Belgique,,"The cabin was very clean, the beds were comfortable and the heating worked perfectly (we had -4 one day during our stay but the cabin was warm and well isolated)","We had dinner twice in the restaurant and the buffet was exactly the same. The quality of the food was good, but it was a bit boring having the same dishes. Wine by glass is overpriced.",Avril 2022,Commentaire envoyé le 10 avril 2022
669,Sean,7.0,Royaume-Uni,,The room was very clean and spacious. Key cards each allowed 4 free coffees per day.,"Products weren't replaced often enough. Coffee, milk, toilet roll - not enough were provided. At check-in we were lied to that our room number would be texted to us after 3pm and we could then go straight to our room, when they knew the key cards still needed programming so this couldn't have happened. After 6pm we had to queue once again in the long check-in queue to do it all again. Not the best start. Plug sockets are at the main desk and are too near the desktop to allow you to push a plug into unless the plug doesn't have a lead coming out of the bottom!",Décembre 2021,Commentaire envoyé le 13 janvier 2022
670,Sandra,8.0,Irlande,,"I like self catering, the location was great, loved the woodland area",,Octobre 2021,Commentaire envoyé le 21 novembre 2021
671,Sara,9.0,Royaume-Uni,,home from home feel as always. loved the Halloween decorations. felt incredibly covid safe,,Octobre 2021,Commentaire envoyé le 7 novembre 2021
672,Parker,7.0,Allemagne,,"It is a very family friendly, clean place. The pool is tons of fun and having an individual cabin with your own kitchen and parking lot are fantastic! If the bathrooms were a bit bigger and the beds a bit more sturdy it would be perfect! Great distance from Disneyland but far enough you do not have to deal with too much business and can have a quiet fun adventure!",The beds were very small and uncomfortable. They would fall apart frequently and barely stayed up when rolling over even for a small child. The bathrooms are incredibly small as well. A small child has difficulty fitting between the wall and the cabinet to use the toilet.,Septembre 2021,Commentaire envoyé le 28 octobre 2021
673,Hearttotravel,7.0,Pays-Bas,,Swimming is excellent.,The place is a bit damp - I guess that's being part of being in the forrest,Octobre 2021,Commentaire envoyé le 26 octobre 2021
674,Tingie,7.0,France,,Great location and friendly staff. Nice bonus to get the magic pass to Disneyland allowing early access and free parking.,The beds were very noisy and the breakfast was quite expensive for the selection.,Octobre 2021,Commentaire envoyé le 24 octobre 2021
675,Jack,8.0,Royaume-Uni,,"Facilities were fantastic, pool facilities the best I've seen at a DLP resort, also shop was very reasonably priced with great staff who were very friendly!","Beds a little squeaky, no bath in cabin which would be nice after a long day at the parks.",Octobre 2021,Commentaire envoyé le 12 octobre 2021
676,Henry,7.0,Allemagne,,The location is perfect for Disney especially if you want a quiet evening after a crazy day in the Disney park. The pool offers a fantastic way to end the day with a relaxing swim.,Make sure you carry insect repellent.,Octobre 2021,Commentaire envoyé le 11 octobre 2021
677,Sarah,7.0,Royaume-Uni,,Property had plenty of beds and heating which warmed it up quickly. Staff moved our family when we checked in so we were next to each other. Very clean and pretty. Swimming pool was really lovely and the two year old with us did not want to get out.,"I know it’s Disney but the food and drink was really expensive in the shop/bars etc. We have been to America and French Disney many times and have never felt so ripped off. 4 euro 35 for a small carton of apple juice for the little one. Also there is no oven, just hob and microwave. Yet they sell oven stuff in the shop?",Octobre 2021,Commentaire envoyé le 11 octobre 2021
678,Rebeca,7.0,Pays-Bas,,"Location, facilities, open space, being able to enjoy the terrace, quite, comfortable, having a kitchen",It’s not that clean unfortunately. I had higher expectations but the bathroom had some dirt on the floor and the shower.,Septembre 2021,Commentaire envoyé le 6 octobre 2021
679,Jolly,8.0,France,,Pool,No accesib’e bus,Septembre 2021,Commentaire envoyé le 30 septembre 2021
680,James,9.0,Malte,,"We really enjoyed the pool, and the individual rooms were great for privacy.",The goods at the store felt a bit overpriced. Sometimes you just needed some snacks or whatever in between trips and the prices for anything didn't seem justified. The arcade room is also a bit pricey considering none of the games give out any tokens or prizes.,Septembre 2021,Commentaire envoyé le 23 septembre 2021
681,Robert,9.0,Allemagne,,Lovely cabin for our family to cook our own food. Separate bedroom for the children. Great woodsy feel.,"Would have been nice to have towels for the kitchen and dish cleaning soap. Parking was it well explained for the park but we figured it out, add about 30 minutes to your time for parking to the gate.",Septembre 2021,Commentaire envoyé le 11 septembre 2021
682,Andrea,9.0,Italie,,Beautifull position in a forest. Very useful for families as the bungalow is equipped also with a kitchen. Best location to go to EuroDisney by car. Staff super helpfull and nice,"Unfortunately Eurodisney park entertainments are very limited due to Covid restrictions, even if I don't understand why all the restaurants are open and theaters and outdoor shows are closed!!",Septembre 2021,Commentaire envoyé le 5 septembre 2021
683,Jonathan,9.0,Royaume-Uni,,Cheerful environment and access to a pool and some small shops.,The room space is slightly limited and a bit of a walk from reception to use the pool.,Août 2021,Commentaire envoyé le 1 septembre 2021
684,Sha_shi,9.0,Allemagne,,Pool was really good but it was bit cold... (and It was closed due to technical problem for some times),"Depends on which house we stayed, but it was too far from restaurant/pool/bar/supermarket (we needed to drive the car all the time) It would be also good if there should be some seasoning (salt, pepper, oil) in each house as standard. otherwise everything have to be prepared(bought) for cooking... even cleaning stuff such as Dishwasher detergent. some devices such as microwave was broken and they promised to change but it was never done...",Août 2021,Commentaire envoyé le 28 août 2021
685,Shell,9.0,Royaume-Uni,,It was very nice to come back to a very warm accommodation. Plenty of space for family. Clean accommodation. Would definitely stay here again.,Only thing i would recommend would be kitchen doesnt have enough lightening.,Février 2020,Commentaire envoyé le 4 mars 2020
686,Bas,8.0,Pays-Bas,,Nice staff and comfortable house.,The pool was closed one day and the beds can use replacement. They are so old that they make creaking noises whenever you move in the bed. Also they don't feel very solid.,Février 2020,Commentaire envoyé le 2 mars 2020
687,Joan,8.0,Royaume-Uni,,LOCATION AND FACILITIES GREAT. BREAKFAST WAS A DISAPPOINTMENT. ALTOGETHER A GREAT DEAL THOUGH AND WE WOULD STAY THERE AGAIN.,BREAKFAST,Février 2020,Commentaire envoyé le 29 février 2020
688,Samantha,8.0,Royaume-Uni,,"The cabin was beautiful and stocked with tea, coffee etc",The pillows were not very comfortable and could of had extra ones. That is only thing that could of had extra pillows,Février 2020,Commentaire envoyé le 21 février 2020
689,Debi,9.2,Royaume-Uni,,Close to park. Pool amazing. Ease of registration and parking. Booked an extra day with bookings after staying for 2 days with magicbreaks and was very smooth they let us stay in lodge we were in.,Check in late and not clear about what we could use. Very cramped with 4 single beds in one room we moved one onto sofa and was much better,Février 2020,Commentaire envoyé le 21 février 2020
690,Jennifer,8.0,Royaume-Uni,,Nice place in general. Cabins lovely. Clean. Very cosy,Not accessible by public transport Very nosey hard beds Everything needs be prepaid i.e breakfast Warm food only avail in evenings,Février 2020,Commentaire envoyé le 11 février 2020
691,Becky,7.0,Royaume-Uni,,"Spacious in the cabin, good swimming pool for the children, clean and tidy","No transport to the parks, had to pay for taxis which we were not made aware of!  No welcome back eith essentials like washing up liquid and toilet rolls",Février 2020,Commentaire envoyé le 10 février 2020
692,Michelle,8.0,Irlande,,,Restaurant not good value for money,Janvier 2020,Commentaire envoyé le 22 janvier 2020
693,Chereen,10.0,Royaume-Uni,,"lovely cwtchy cabin with plenty of room for a family of 5 and nice and warm as it was October we were worried we may be cold .. stayed before but usually in summer ..  have just booked to stay again .. free Disney parking and access to Disney village was included, which was great as we had booked to stay the night before our Disney holiday started, Disney we’re so helpful and added this booking to the one made with them so we had the same cabin all week and wondered in Paris the first day using the train from Disney village",nothing we had no problems at all,Octobre 2022,Commentaire envoyé le 9 janvier 2023
694,Rebecca,10.0,Royaume-Uni,,lodges were perfect and good location,nothing,Décembre 2022,Commentaire envoyé le 8 janvier 2023
695,Sean,6.0,Royaume-Uni,,The setting and the cabin layout,"The en-suite shower was broken, and housekeeping had balanced the showerhead  so it looked normal but despite knowing about it chose not to repair it. The TV digital reception was dreadful, and most channels were unwatchable. The radiator in the main shower room could not be controlled or switched off.",Novembre 2022,Commentaire envoyé le 7 janvier 2023
696,Roger,10.0,Royaume-Uni,,superb setting !,nothing - all excellent,Janvier 2023,Commentaire envoyé le 5 janvier 2023
697,Vicky,10.0,Royaume-Uni,,"Perfect for a whole family to stay, and with kitchen facility to bring own food",no bus to the parks,Décembre 2022,Commentaire envoyé le 1 janvier 2023
698,Akira,1.0,Allemagne,,Location,I have not received an invoice which I had requested  1week ago yet. A receptionist had declined giving me the invoice and told me to ask a financial department of Disneyland Resort for that and they seem to have been ignoring my email,Décembre 2022,Commentaire envoyé le 1 janvier 2023
699,Karen,6.0,Canada,,,"We booked this place specifically for its proximity to Disney, but also for the pool.   We were very disappointed to find out that the pool was closed during our stay with no notice that it would be.",Décembre 2022,Commentaire envoyé le 20 décembre 2022
700,Carl,3.0,Royaume-Uni,,"Friendly staff, close to shops and mall. The location of camp site was excellent. The shop was fully stocked and easy access to all. Pool was excellent with excellent facilities with a lot staff to hand if any issues","The standard of the cabin was shocking, on entry the smell in the cabin was pungent. Burning smell once the radiators were on. The flooring was dangerous with flooring coming up and causing a trip hazard and floors are uneven. The bed was squeaky and felt like we wasn’t safe. And scared to move.",Novembre 2022,Commentaire envoyé le 3 décembre 2022
701,Elizabeth,10.0,Royaume-Uni,,"location, space and facilities are brilliant",bed could be a bit softer,Novembre 2022,Commentaire envoyé le 13 novembre 2022
702,Tina,4.0,Danemark,,The staff was the only good experience. Very nice and helpful.,"The facilities were poor and worn out. The pool was a big disapointment, they turned the heat down to save money ant it was cold to a point that all the guests were standing under showerheads to get some heat, because they were freezing. Even the jacuzzi was cold. At the bungalows the floors were uneven, the furniture was frayed and stained and the single beds were of poor quality. We payed extra breakfest and it was a joke. We were told to pick up the breakfast by the entrance of our bungalow row at a wooden cabin and we received a paper bag with bread and a milk, and the rest of the breakfast was instant powders and small packs of marmalade, cerial and butter. Not much was freshly made. No egs, ham, fresh coffee, fresh fruit og greens.",Octobre 2022,Commentaire envoyé le 24 octobre 2022
703,Rhiannon,10.0,Royaume-Uni,,amazing facilities,the breakfast could be more substantial,Octobre 2022,Commentaire envoyé le 21 octobre 2022
704,Gideon,1.0,Royaume-Uni,,Magic hour in Eurodisney,"Given apartment as far from the centre as possible. Had to pay for towels for use in hotel pool - would have carried those from our room had we been aware. Pool was closed int he mornings so could not use on our last day of our stay. We had emailed in a dance that it was our sons birthday, no response in advance of our stay. No effort by anyone in the hotel to make it special for him - ad to beg just to take a card saying happy birthday from the check-in desk. We had asked for extra beds in our apartment but on arrival they were not there and had to wait until 9pm to have them ready for our young kids",Octobre 2022,Commentaire envoyé le 19 octobre 2022
705,John,10.0,Royaume-Uni,,a beautiful place to stay and pool excellent,,Octobre 2022,Commentaire envoyé le 8 octobre 2022
706,Mark,10.0,Royaume-Uni,,"Staff was amazing, swimming pool area was amazing",Nothing,Octobre 2022,Commentaire envoyé le 5 octobre 2022
707,Filipe,6.0,Allemagne,,,We arrived at the property after a long day at Disneyland and the rooms were ice cold. The heaters were turned off despite the cold temperature outside.,Septembre 2022,Commentaire envoyé le 3 octobre 2022
708,Chloe,10.0,Pays-Bas,,Exactly and more what imagined!,5 minute drive to disney. Everything was made clear to us!,Septembre 2022,Commentaire envoyé le 29 septembre 2022
709,Jade,10.0,Royaume-Uni,,"The facilities were great and the staff couldn’t do enough for you, from the moment we got there the staff were so helpful and friendly.",Nothing!,Septembre 2022,Commentaire envoyé le 25 septembre 2022
710,Zipi,2.0,Israël,,"The only nice thing about this Hotel is its staff (Candis at the reception, the guy who brought us towels in the evening,  the   lady in the minimarket)","We stayed for three nights. The bungalow is old and shabby. The furniture is dated. Everything looks cheap! The Sofa  in the ""living room"" horribly squeaks whenever you use it.  The light in the rooms is weak and yellow. Parent's room is very very small - no room in it for even one trolly. The bunglows are far from the pool/reception/minimarket so you have to use your car whenever you want to get there. Kids cannot just walk to the pool as it is about 30 minutes walk next to the forest without a pavement without street lights .  . There is an ovelrall feeling is of stingyness:  You are ""entitled"" to receive a free set of kitchen cleaning products  (1 small 20cc bottle + 2 dishwasher tablets and kithcen-rags) . In order to get it you have to drive to the minimarket where you are being signed (!!!) that you actually got this ""treasure"". We had to specially ask for soap for the bathrooms, the kithchen-sink was stuck , one single bed was broken (we luckily did not have to use it), no one collects the garbage (you only get one garbage bag) . If you need a hairdryer or   an iron - you have to leave a deposit of 30 to 50 Euros. Due to these experiences we gave up on local breakfasts and dinners . Another annoying thing is that after making the booking - you have no one to turn to if you have a question. No telephone nomber or email address which appear on the reservation,  gets you anywhere.",Septembre 2022,Commentaire envoyé le 11 septembre 2022
711,Natalia,5.0,Allemagne,,"It allowed us to have access to Magic Hours at the park, and free parking at Disney","The room was not very clean. The sinks would not drain, one sink was full of long black hair, and we are a family of blondes and red heads, so it definitely wasn’t ours. It was a lot of money for a mediocre hotel. Our room was also so far from the pool and main desk we had to drive anytime we needed to go down there.",Septembre 2022,Commentaire envoyé le 11 septembre 2022
712,Yvonne,5.0,Royaume-Uni,,near to Disney Paris.  the pool good but the temp wasn’t very high so the dryers in the changing rooms were good the bed linen was clean,"stayed here many times but it is now past its sell by date - the cabins smell of damp, the flooring was damaged, missing cutlery, crockery. there was a water leak from somewhere that reached the main bedroom  the restaurant made us pay adult price for a 12 year old to have dinner - some chicken nuggets and Mickey Mouse pomme de terre 34€",Septembre 2022,Commentaire envoyé le 3 septembre 2022
713,Sven,4.0,Luxembourg,,location in the woods is nice,"- pool changing area was dirty and stinky. - breakfast pick-up service changed location without notice at order. it was not as advertised on our trail, but at the entrance of the very first trail. Breakfast content looked like a sponsored 1980s unhealthy picnic bag. - sleep container was under nut trees, which kept falling down during the night. imagine the noise of nuts falling on a cheap metal roof.",Août 2022,Commentaire envoyé le 2 septembre 2022
714,Onofrio,10.0,Royaume-Uni,,Great location and flexibility to go to the parcs,,Août 2022,Commentaire envoyé le 29 août 2022
715,Michael,4.0,Israël,,Good swimming pool. Reasonable cabin.,reception was unpleasant. Beds uncomfortable. We were not aware that rooms will be so far from pool a car is required.,Août 2022,Commentaire envoyé le 29 août 2022
716,Joanne,4.0,Royaume-Uni,,The woods location was very peaceful,The cabins are really tired and run down. 1970s brown and orange decor. The beds were creaky and very uncomfortable.,Août 2022,Commentaire envoyé le 20 août 2022
717,Amir,4.0,Israël,,"The hotel is close to Disneyland Paris, however you must have a car since there is no shuttle bus between the parks and this specific hotel. The pool is very nice and the grocery store was handy and opens early, which is great.","We were very disappointed by the size and comfort of our cabin. It was very small and crowded for a family of 5 people, not to mention 6 (which is the max capacity). The beds were very uncomfortable and made a lot of noise. There was 1 AC in the main area of the cabin, which was not sufficient to cool the other rooms. We stayed in Disney hotels before and expected more, especially considering the price we paid.",Août 2022,Commentaire envoyé le 13 août 2022
718,Altaf,6.0,Koweït,,"location, wifi , big space, parking , pool","bugs all over the place, dirty , old furniture, no options for food near by , ac",Août 2022,Commentaire envoyé le 5 août 2022
719,Stéphanie,10.0,France,,Ambiance far west,Le checking avec booking était erroné,Juillet 2022,Commentaire envoyé le 12 juillet 2022
720,Lawrence,5.0,Royaume-Uni,,"It met the needs of the family,. It was difficult to find. Did not seem to have much  to do with Disney itself.",A lot of confusion with the allocation of cabins.  Not really log cabins but caravans clad in wood.,Juin 2022,Commentaire envoyé le 11 juillet 2022
721,Allen,10.0,Royaume-Uni,,"Great Self Catering accomodations, was able to use the barbeque to cook the family dinner on the evening we did not feel like take away.","The store on the property has the space but could use more selection of food items. Pool was closed unexpectedly on our final day, which was unfortunate as we had left park early just to go swimming.",Juin 2022,Commentaire envoyé le 9 juillet 2022
722,Noga,5.0,Israël,,the cabines,"not clean, no facilities, no luggage’s room, too far, no transportation. only for people who come with car",Juillet 2022,Commentaire envoyé le 7 juillet 2022
723,Donna,5.0,États-Unis,,The shower in the front bathroom had leaked under shower shell and wood was so rotted under shower shell you were at risk of falling through floor. The shower sprayer in same shower was broken at point where sprayer attached to wall. We had to attach hair ties to it to keep it up in position on wall. AC did not work but windows had no screens. Coffee maker kept turning off before the coffee was fully made. On average u had to turn it back on 3 times to get a full pot. The back bedroom shower must have leak below the flooring because if you sat at picnic table outside while someone was showering you could hear water running under cabin and water pooled out the back corner of cabin on ground. Old coffee left in a drawer. Garbage not taken out after last customers stated and was mounded up under sink and falling all over floor in cabinet under sink.  Door to front bathroom extremely hard to open. Window in front room needed fixing so it would open properly.,,Juillet 2022,Commentaire envoyé le 4 juillet 2022
724,Om,10.0,Koweït,,everything was perfect  great place for family,the bugs,Juin 2022,Commentaire envoyé le 24 juin 2022
