,0,1,2,3,4,5,6,7
356,Maxime,2.0,France,Médiocre,,Le lit était mal nettoyer des poil et autre à l'intérieur vraiment affreux. Aucun moyen de transport de l'hôtel au parc nous avons du prendre le taxi pour un montant s'approchant des 80 euros. Et pour couronné le tous l'hôtel est impossible à annulé car l'annulation coûte le prix du séjour renseigné vous bien avant de réserver !!!,Novembre 2022,Commentaire envoyé le 19 novembre 2022
357,Rizlaine,5.0,France,bien mais on sent que nous a donné un bangalow bas de gamme car réservation booking,le calme et la tranquillité,manque de couverts dans le bungalow,Octobre 2022,Commentaire envoyé le 18 novembre 2022
358,Noëllie,4.0,France,Déception,le calme,"Étant à mon dernier trimestre de grossesse et ayant prévenu bien en amont je ne comprends pas qu’on nous est installé au bungalow le PLUS loin de la réception…… Matelas très très inconfortable…… Odeur très désagréable émanant des toilettes…… Support pommeau de douche cassé…….. 1 seul flacon nettoyant pour 4 nuits, obligés d’aller à la réception pour demander du papier toilette……. Membre du personnel à l’arrivée pas gracieux, heureusement on a été voir une autre personne…. Départ remise des clés, le personnel ne nous a même pas demandé comment s’était passé notre séjour, rien, personnel très distant…….",Novembre 2022,Commentaire envoyé le 17 novembre 2022
359,Fleuriane,10.0,France,génial,la déco tout est bien pensé,rien,Novembre 2022,Commentaire envoyé le 16 novembre 2022
360,Stephane,6.0,France,Agréable,"Endroit agréable,personnel au top gentil et à l'écoute","Bungalow non chauffer en arrivant,nous avons eu froid,la literie n'est pas confortable",Novembre 2022,Commentaire envoyé le 16 novembre 2022
361,Augustin,3.0,France,Piscine très froide et propreté générale à revoir.,Le cadre,- 7h d'attente pour avoir le réhausseur et le lit parapluie. - piscine très froide même dans le jacuzzi. - vestiaire de la piscine dégueulasse avec des couches sales laissé sur place. - draps sales et certaines serviette sales en arrivant. - portes de la salle de bain en mauvais état presque cassé. - et en bonus de vieux sous vêtements rempli de poussière sous le lit en arrivant... Bref je ne suis pas prêt de revenir.,Novembre 2022,Commentaire envoyé le 16 novembre 2022
362,Ophelie,6.0,France,Agréable,,Lieu très sympathique bien dommage que la literie soit plus que mauvaise et le petit déjeuner un peu léger au vu du prix,Novembre 2022,Commentaire envoyé le 16 novembre 2022
363,Meryll,10.0,France,génial,tout,rien,Novembre 2022,Commentaire envoyé le 15 novembre 2022
364,Nathalie,10.0,France,Exceptionnel,La tranquilité,Rien,Novembre 2022,Commentaire envoyé le 15 novembre 2022
365,Séverine,4.0,France,Décevant,le lieu et l’ambiance Disney,un lit qui grince pas et plus de propreté,Novembre 2022,Commentaire envoyé le 15 novembre 2022
366,Cathy,5.0,France,Passable,Malheureusement pas grand choses,Télévision qui fonctionne pas ou mal à cause de la mauvaise réception du wifi Être mis au fond du parc parce qu'on passe par une plate-forme extérieur Et me faire voler 2 thermos à café que j'ai oublier dans le lave vaisselle,Novembre 2022,Commentaire envoyé le 14 novembre 2022
367,Kristel,10.0,Belgique,A refaire,"On a eu un soucis de tv, L’équipe de maintenance est venu 10 min après min appel. Super gentil.",,Novembre 2022,Commentaire envoyé le 14 novembre 2022
368,Sandie,6.0,France,Un peu cher pour ce qu'il y a,"Le bungalow est spacieux celui que nous avions n'etait pas hyper propre, lino abimé et nous avons meme vu passer une petite souris...la piscine est top dommage qu'elle ne soit pas assez chauffée nous avons pris froid mais recommandation de l'Etar oblige, et serviettes de piscine payante!",Le kit menage doit etre recuperer a l'epicerie il vaudrait mieux le mettre dans le bungalow directement.pour ceux qui ne payent pas le petit dejeuner ils pourraient mettre un minimum dans le bungalow comme dans les chambres d'hotels normales.Serviettes pour la piscine non fournies gratuitement au prix de la chambre c'est inadmissible...c'est dommage qu'il n'y ai plus de ferme avec des animaux,Novembre 2022,Commentaire envoyé le 14 novembre 2022
369,Cindy,4.0,Belgique,"Séjour très décevant : manque de confort, équipements défectueux.",Le cadre au cœur de la forêt.,- Les douches rafistolées avec des élastiques. - La table basse rafistolée avec du scotch.  - Le bruit trop fort et dérangeant de la chaudière. - La nourriture qui trainait dans les placards. - Les matelas qui étaient très inconfortables et bruyants quand on se couchait dessus.  - Le verrou de la salle de bains qui était défectueux.  - La paroi de la douche qui ne se fermait pas.,Novembre 2022,Commentaire envoyé le 13 novembre 2022
370,Amandine,5.0,France,Pratique mais sale,Le personnel était très bien,Les draps étaient sale ainsi que les serviettes on a demandé à changer et de nouveau sale,Novembre 2022,Commentaire envoyé le 12 novembre 2022
371,Déborah,10.0,France,exceptionnel à refaire,l’originalité du concept et la propreté et l’accueil chaleureux du personnel,ouverture le 11/11 à 15h de la piscine,Novembre 2022,Commentaire envoyé le 12 novembre 2022
372,Pierre-emmanuel,4.0,France,agréable en été sans aucun doute. manque de vie en hiver,ambiance dans la nature,établissement vieillissant,Octobre 2022,Commentaire envoyé le 11 novembre 2022
373,Virginie,5.0,France,Juste des logements pour remplir le parc !,"La grandeur du bungalow, la piscine","La télé ne fonctionne pas, le wifi capricieux et cerise sur le gâteau fuite d'eau dans la cuisine, prévenu à 7h du matin, toujours pas réparé à 18h. Sympa de passer son séjour à éponger",Novembre 2022,Commentaire envoyé le 11 novembre 2022
374,Cindy,1.0,France,Mauvais,Les équipements étaient bien,Nous avons retrouvé des vêtements dans le mobil-home nous avons retrouvé aussi en dessous du lit de la terre et des feuilles On nous a proposé des fastp pour notre journée d'après ce que nous n'avons pas eu  Quand je suis allé le lendemain à l'accueil pour récupérer ses fameux face parce que nous n'avons pas eu la personne m'a demandé de faire une queue où il y avait plus de 45 minutes de queue sachant que je suis handicapé il n'y avait aucune personne pour s'occuper des personnes à mobilité réduite,Octobre 2022,Commentaire envoyé le 10 novembre 2022
375,Virginie,10.0,France,Exceptionnel,La gentillesse du personnel le cadre les infrastructures,Séjour trop court,Novembre 2022,Commentaire envoyé le 9 novembre 2022
376,Annelise,6.0,France,Agréable,,Literie pas confortable Sommier du lit qui grinçait au moindre mouvement!,Octobre 2022,Commentaire envoyé le 5 novembre 2022
377,Elody,5.0,France,décevant pas a la hauteur de l’image de disney,le côté nature,"piscine non chauffée alors que cela devait être le cas, inacceptable car les enfants étaient glacés ! personnel désagréable au Shop  accueil pas très sympathique à la réception",Novembre 2022,Commentaire envoyé le 2 novembre 2022
378,Angélique,10.0,Chili,super,tout,rien,Octobre 2022,Commentaire envoyé le 2 novembre 2022
379,Bélynda,5.0,France,Passable,La piscine même  si le toboggan était fermé,Personnel peut aimable  Le bungalow très  vieux,Novembre 2022,Commentaire envoyé le 2 novembre 2022
380,Sabrina,10.0,France,Exceptionnel,"un endroit très cosy, on aimerais y passer plusieurs jours.",les bungalow sont quand même très proches les uns des autres.  les rideaux ne sont pa assez grand et laisse donc passer la lumière du matin,Novembre 2022,Commentaire envoyé le 2 novembre 2022
381,Inès,5.0,France,Bungalow ok juste pour une nuit,L'hôtel est bien placé. Nous avons apprécié de pouvoir nous rendre facilement au parc avec un accès gratuit au parking.  Jolie boutique ! Nous avons aussi aimé la piscine. Personnel sympathique,"Bungalow pas propre, lumières trop agressives dans la pièce de vie. Pas de sèche-cheveux alors que c'était noté dans le descriptif de la chambre lors de la réservation. Le bungalow a l'air vieillissant et mériterait un coup de frais. Sac avec draps sales des occupants précédents encore devant le bungalow à notre départ...",Novembre 2022,Commentaire envoyé le 1 novembre 2022
382,Carine,6.0,France,"Séjour sympathique, mais...","Au coeur de la forêt, de joli petit bungalow. Tranquillité assurée, petite boutique avec possibilité d'acheter des aliments également pour limiter les frais.","Malheureusement problème au niveau de la douche avec le bac à douche cassé et le pommeau qui ne tient pas à la barre. Des remontées de mauvaises odeurs dans la salle de bain. La piscine n'ouvre qu'à 15h, c'est décevant surtout pour les enfants. Le point de retrait du petit déjeuner était fermé, obligé d'aller au point de retrait plus loin.",Octobre 2022,Commentaire envoyé le 31 octobre 2022
383,Thierry,1.0,France,séjour gâché à cause d’une annulation ou modification de date impossible !!! censé être un moment magique pour les enfan,le lieu du village : en forêt,"la literie à savoir le matelas beaucoup trop dur de la chambre parentale , manque de vaisselle à l’arrivée, kit vaisselle à aller chercher au lieu d’être fourni à l’arrivée , personnel pas toujours compétent.",Octobre 2022,Commentaire envoyé le 19 octobre 2022
384,Michael,10.0,Belgique,superbe séjour à 5 minutes en voiture  des parcs,hôtel Disney rien à redire,,Octobre 2022,Commentaire envoyé le 17 octobre 2022
385,Celine,10.0,France,Parfait,Comme toujours le ranch de Davy crocket était génial. Les casts aux top très gentils. La piscine est vraiment bien. Mon hôtel préféré quand je viens à Disney.,,Septembre 2022,Commentaire envoyé le 16 octobre 2022
386,Gwenaelle,6.0,France,Hygiene,"Endroit calme, pratique pour se faire des repas ...","Chambre pas disponible avant 16 h, Draps sales remplis de cheveux et d énormes tâches. Nécessaire de toilette gel douche pas disponible. Kit pour le nettoyage a récupéré a l accueil qui nous fait perdre du temps. Lavabo de la chambre bouché. Tapis de bain très sales",Octobre 2022,Commentaire envoyé le 16 octobre 2022
387,Laura,10.0,Belgique,c’était genial,tout était parfait,rien,Octobre 2022,Commentaire envoyé le 14 octobre 2022
388,Angélique,10.0,France,Exceptionnel,L'esprit chaleureux La piscine La nature,Tout était super,Octobre 2022,Commentaire envoyé le 12 octobre 2022
389,Sophie,10.0,France,Exceptionnel,L environnement Le restaurant et la piscine,Le prix,Août 2022,Commentaire envoyé le 12 octobre 2022
390,Antonia,10.0,France,Extraordinaire,J’ai adoré mon séjour et j’y retournerai dès que possible,Par contre les gens qui klaxonnent des 5 heures du matin c’est vraiment pas top il faudrait sensibiliser les gens sur ce comportement car tout le monde ne ce lève pas aux aurores.,Octobre 2022,Commentaire envoyé le 12 octobre 2022
391,Marc,10.0,Belgique,Nous avons passé un séjour dans un endroit préservé en pleine nature à refaire.,"Le calme, la proximité des parcs Disney, le village du domaine avec le petit magasin et le restaurant proposant une formule à volonté d'excellente qualité. La possibilité de pouvoir réserver le petit déjeuner dès 7h du matin",Le saloon pourrait offrir un plus grand créneau dans les heures d'ouverture,Octobre 2022,Commentaire envoyé le 12 octobre 2022
392,Ruzianoa,10.0,France,Hôtels bungalow au top,"Très bien équipée, juste le principal et c'est parfait. Beaucoup de rangement.",L'emplacement très loin de la réception du restaurant et de la piscine,Octobre 2022,Commentaire envoyé le 10 octobre 2022
393,Virginie,10.0,France,Exceptionnel,La piscine,L odeur du logement,Octobre 2022,Commentaire envoyé le 9 octobre 2022
394,Marjorie,6.0,Belgique,Agréable,"L´accueil, la piscine.","La chambre, lit pas confortable et instable. ""Grincement"". 1 cast member du saloon pas très sympathique. On nous a refusé des cocktails a 22h20 et du café car les machines étaient déjà nettoyés. Et on nous a servit du vin  et amaretto dans des gobelets car la vaisselle étaient déjà faite. Réponse de la serveuse. Je finis mon service à 23h30. Ce n´est plus ce que c´était il y a quelques années. Une déception.",Septembre 2022,Commentaire envoyé le 3 octobre 2022
395,Dangreau,6.0,Belgique,trop cher,possibilité d'aller à la piscine calme logements individuels possibilité de cuisiner,piscine très très froide pas de sèche -cheveux dans la chambre rideaux asymétriques et trop courts dans les chambres,Septembre 2022,Commentaire envoyé le 29 septembre 2022
396,Antonella,10.0,Belgique,Exceptionnel,Tout etais parfois.,Le buffet toujours le même mais c était bon,Septembre 2022,Commentaire envoyé le 29 septembre 2022
397,Loris,6.0,Belgique,Prix attractif mais logement basique (et vieillissant) - la piscine et le cadre sauvent la mise,La piscine couverte et son toboggan sont une réelle attraction pour les enfants. Le cadre verdoyant et calme est très agréable.,"Logements au confort spartiate, visiblement vieillissants et d'une autre époque.",Septembre 2022,Commentaire envoyé le 28 septembre 2022
398,Stephanie,10.0,France,Exceptionnel,Tout,,Septembre 2022,Commentaire envoyé le 27 septembre 2022
399,Christine,6.0,France,Séjour agréable mais confort à améliorer.,Le complexe aquatique est top. Les activités ludiques à l'extérieur sont très agréables.,La literie est mauvaise.,Septembre 2022,Commentaire envoyé le 25 septembre 2022
400,Didier,10.0,France,Exceptionnel,L accueil de Mélanie est formidable ! Une personne qui fait son travail à la perfection et avec  un grand sourire merci beaucoup !!!,Rien,Septembre 2022,Commentaire envoyé le 24 septembre 2022
401,Elsa,10.0,France,Un séjour très reposant et agréable.,le cadre dépaysant des bois et la gentillesse du personnel. Le calme est appréciable après la cohue des parcs Disney.,les bungalow manquent un peu d’entretien ce qui est dommage.,Septembre 2022,Commentaire envoyé le 23 septembre 2022
402,Chrystelle,6.0,Royaume-Uni,Agréable,,La chaudière est très bruyante et le placard où elle est installée n est pas suffisamment insonorisé . Ce bruit s entend dans tout le mobilhome,Septembre 2022,Commentaire envoyé le 23 septembre 2022
403,Hardy_hugues,10.0,Belgique,Exceptionnel,Parfait comme toujours,Rien,Septembre 2022,Commentaire envoyé le 20 septembre 2022
404,Yassine,5.0,France,Disney n'est plus ce qu'il était...,"Très belle piscine, bungalow très fonctionnel et en pleine nature (dépaysement total) on ne se croirait pas chez Disney. Barbecue à disposition et superette très pratique (prix un peu élevé...) pour se faire à manger soi-même",". La non réponse de Booking à mes demandes spécifiques (lit bébé etc...) en effet Booking vous envoi simplement des réponses automatiques qui ne correspondent pas à votre demande... exemple : à partir de qu'elle heure pouvons nous nous enregistrer? réponse de Booking : 16h alors que vous pouvez arriver dés le matin pour vous enregistrer (accès au bungalow à 16h). . Le mensonge du personnel : Demande si possible un départ tardif (11h au lieu de 13h) réponse : NON l'établissement est complet, (nous sommes un Lundi et Hors vacances scolaires, il y a le plein de clés à l'accueil et quand vous vous déplacer dans l'établissement (le jour ou la nuit) vous constatez qu'il est loin d'être plein… de plus les réservations sur les différentes plateforme sont toujours possible… (je croyais que vous étiez complet) . La non - information : exemple : kit de nettoyage dispo gratuitement à la superette (je le sais car j'y ai déjà séjourner) mais dommage pour une personne qui ne le sait pas... . La différence du service client : nous avions à l'époque des badges gratuits, une pochette de bienvenue etc... aujourd'hui on vous remet 1 plan + 1 clés et c'est tout…. Bref pour résumer les tarifs augmentent terriblement et le service client s'effondre aussi",Septembre 2022,Commentaire envoyé le 20 septembre 2022
405,Francois,10.0,Belgique,Parfait,"Grand bungalow, au calme dans les bois , atypique, superbe piscine",Rien,Septembre 2022,Commentaire envoyé le 19 septembre 2022
406,Maria,10.0,Luxembourg,Exceptionnel,tout empecable,,Septembre 2022,Commentaire envoyé le 19 septembre 2022
407,Amandine,4.0,Belgique,Décevant,Emplacement très calme.,"Je suis déjà venue en été et c'était très bien, mais en septembre c'est tout autre chose. Quand nous sommes arrivés, le logement sentait très fort le renfermé. L'air était humide ainsi que les literies. Au matin, les vitres étaient recouvertes de condensation. Très inconfortable, surtout pour les enfants",Septembre 2022,Commentaire envoyé le 19 septembre 2022
408,Joseph,5.0,France,hyper cher pour la qualité,"Le concept est pas mal,  La piscine était sympa, ils prêtent des flotteurs pour Bébé ce qui a permis de prendre notre petit de 8 mois.","Les bungalows datent de l'ouverture de disney. Méritent vraiment un raffraichissement. Comme Disney tout coute très cher! on ne pouvait pas profiter de la terrasse du bungalow, il y avait des 100 aines de guepes. Ils mêtent des BBQ partout au niveau des bungalows, mais une fois qu'on a acheté le charbon 5x le prix, impossible de trouver une allumette ou un briquet.",Juillet 2022,Commentaire envoyé le 19 septembre 2022
409,Cosmos_95,5.0,Suisse,Passable,"Bungalow salle, rien n'avait été nettoyé et beaucoup de choses cassé très déçu",La propreté et il fesais froid,Septembre 2022,Commentaire envoyé le 17 septembre 2022
410,Julie,5.0,France,hyper bien situé mais rapport qualité/prix défavorable,"Disney à 6mins en voiture, parking Disney offert et vous profitez d'une heure de 8h30 à 9h30 avant l'ouverture du parc pour optimiser votre journée ( attention option pas valable pour les studios)  le personnel est vraiment agréable l'environnement où sont implantés les hébergements","l’hébergement n'est pas du tout à la hauteur du prix payé, le parc fête ses 30 ans mais les mobilhomes aussi: déco vieillotte, plein de choses cassées à l'intérieur ( hôte hs, évacuation évier sdb, une plinthe arrachée dans la sdb, une partie de la table basse cassée...) pas de kit pour faire la vaisselle, torchon, pastilles lave vaisselle, pas assez de vaisselle pour 2 repas. la piscine est superbe mais problème de propreté (jacuzzi) il y a plein de choses en suspension dans l'eau et hyper visible lorsqu'il n'y a pas de bulles. la température n'est vraiment pas élevée même pour le jacuzzi c'est vraiment dommage car au global déçus",Septembre 2022,Commentaire envoyé le 12 septembre 2022
411,Ornella,10.0,France,Top,Tout top,La piscine pas assez chauffee,Septembre 2022,Commentaire envoyé le 11 septembre 2022
412,Domenico,1.0,Belgique,Acheter des chandelles.,,Nous sommes arrivés vers 22h30. Les disjoncteurs ont sauté. Plus d'électricité à cause du ballon d'eau chaude. Le problème était connu selon le technicien qui était venu voir. Proposition changer de bungalow en pleine nuit ou se laver le matin dans un autre bungalow beaucoup plus loin.,Septembre 2022,Commentaire envoyé le 7 septembre 2022
413,Sandra,10.0,France,Un séjour incroyable dans un lieu fabuleux.,"Nous avons aimé l'agencement très pratique du logement : nous étions 6 et nous avons eu assez d'espace, la double salle de bains était la bienvenue. L'accès à un espace nautique incroyable a ravi toute la famille. Le personnel est à l'écoute et très réactif. Que des points positifs pour nous...","Il n'y a pas de point particulier négatif, peut-être une défaillance dans la VMC du logement, mais cela n'a pas impacté le bon déroulement de notre séjour. Nous en avons fait part à la réception en partant.",Août 2022,Commentaire envoyé le 7 septembre 2022
414,Steeve,10.0,France,Exceptionnel,"spacieux, accueil au top (personnels agréables), cadre parfait au pieds de Disney",,Septembre 2022,Commentaire envoyé le 4 septembre 2022
415,Laetitia,10.0,France,Le paradis,Tout est parfait '. Hâte de revenir.,Rien,Août 2022,Commentaire envoyé le 31 août 2022
416,Dorothée,4.0,Belgique,Décevant,C'est facile pour le Parc Disney (il ne faut pas payer le parking),"Le rapport qualité/Prix n'est pas bon.  Prix beaucoup trop élevé par rapport au confort !!! Le bungalows sont vieillissants et le confort moyen.  La propreté n'était pas au top non plus (traces sur les fenêtres, ustensiles de cuisine, table grasse mais draps ok)  La literie est à revoir !!!",Août 2022,Commentaire envoyé le 30 août 2022
417,Sarah,3.0,France,Assez médiocre,Endroit proche de Disney au calme. Jolie cadre,Pas de lumière dans les toilettes. Poignée et pied de lit moitier casser. Odeur et moisissures. Trouver une chausette pleine de poussière,Août 2022,Commentaire envoyé le 29 août 2022
418,Laure,10.0,France,Exceptionnel,Les mobiles homes très bien équipés situé au calme  Personnel très gentil et à l'écoute Superbe piscine,,Juillet 2022,Commentaire envoyé le 25 août 2022
419,Sonia,10.0,Belgique,,,,Juin 2022,Commentaire envoyé le 21 août 2022
420,Manon,5.0,France,Moyen,Le personnel sympa,.Beaucoup trop de guêpe !! Surtout quand on est allergique. Un enfer...,Août 2022,Commentaire envoyé le 16 août 2022
421,Kevin,10.0,La Réunion,Hotel en pleine nature,Lieu calme et reposant,,Juillet 2022,Commentaire envoyé le 15 août 2022
422,France,10.0,France,super séjour très dépaysant dans la nature très calme dommage qu’on a pu pu manger dehors à cause des guêpes,la piscine  beaucoup d espace dans le mobil home,l’endroit très loin de l’accueil et de la piscine,Août 2022,Commentaire envoyé le 9 août 2022
423,Annick,6.0,Belgique,Mitigé,L'endroit.lespace piscine. Le restaurant buffet à volonté vraiment Bien.le personnelle du restaurant au top du top..,Le confort de la literie vraiment mais alor vraiment mauvais..lit trop petit matelas Super dur et lit de très mauvaise qualité..( peur de le casser...ces juste un bête sommier a lattes .le confort du repos 0/10.. A5 nous n'avons pas dormis de la nuit......je ne pense pas de nouveaux réserver pour cette raison..car au vue des prix on s'attend à un minimum de comfort...,Août 2022,Commentaire envoyé le 7 août 2022
424,Sandra,10.0,France,Exceptionnel,Chalet confortable sur emplacement ombragé. Supérette dans le ranch qui permet de faire les courses pour un repas simple.,,Août 2022,Commentaire envoyé le 4 août 2022
425,Caron,5.0,France,Passable,Le logement était propre calme climatisé,Nous avons été déçus de devoir prendre la voiture pour aller récupérer les petits déjeuners ensuite nous avions réservé ce logement pour la piscine et le toboggan pour les enfants n'était pas accessible vu le prix de la nuit je pense que c'est abusé pour ce fait il y aurait dû y avoir une remise,Juillet 2022,Commentaire envoyé le 4 août 2022
426,Monica,5.0,France,Passable,Dommage que la piscine ne soit pas accessible 24/24. Ressort des lits très très bruyants. Il aurait fallu nous expliquer qu'il fallait chercher les petits-déjeuners et les ramener au bungalow... Beaucoup d'approximation dans les renseignements demandés,Bruit des lits Petit dejeuner à aller chercher et ramener au bungalow sans qu'on nous l'ai dit,Juillet 2022,Commentaire envoyé le 28 juillet 2022
427,Couderc,1.0,France,Mauvais,La piscine,Pas de prise pour recharger les voitures.  Le restaurant buffet a volonté très cher pour ce qu'il y a. Idem pour le panier du petit déjeuner  Très déçu.,Juillet 2022,Commentaire envoyé le 25 juillet 2022
428,Silvio,4.0,Belgique,Décevant,"L'emplacement, les employés très sympathiques.",Bungalow défectueux. Nous avons  eu de très nombreux problèmes. Séjour décevant.,Juillet 2022,Commentaire envoyé le 22 juillet 2022
429,Sophie,10.0,France,Tres bon sejout,La piscine et le restaurant,La qualite du mobil homme. Matelas de tres mauvais qualite,Juillet 2022,Commentaire envoyé le 19 juillet 2022
430,Hatice,10.0,France,Love ranch davy crockett,"J ai aimé le cadre, le bungalow, la piscine, le jaccuzi de la piscine...  la structure de jeu pour enfants...",L emplacement du bungalow... on avait demandé le matin s il était possible d avoir un bungalow pas trop loin ... on  nous a dit qu ils allaient regarder... et on a eu un bungalow le plus éloigné possible...,Juillet 2022,Commentaire envoyé le 17 juillet 2022
431,Marie,1.0,France,Un cauchemar le bungalow,L emplacement en pleine nature,"Pour 718€ les 2 nuit je trouve inadmissible la qualité  dues bungalow  Je suis passer à travers la terrasse,  trou sous un lit et ménage pas fait, donc changement de bungalow avec les excuse du manager mais pour le prix payer inadmissible",Juillet 2022,Commentaire envoyé le 16 juillet 2022
432,Vollet,10.0,France,Très très bien ! On reviendra,"Le calme , la piscine , le resto, la déco, l'ambiance , le personnel de la boutique : adorables","Les lits , trop fragiles et bruyants",Juin 2022,Commentaire envoyé le 13 juillet 2022
433,Momouk78,4.0,France,Décevant,Emplacement et dispo 24/24 de la réception,Équipements lits vétustes . Lits en métal très bruyant ! Tout comme la VMC dans la chambre. Et bruit de la tuyauterie (coffré dans une chambre) État du bungalow un peu ancien . À rénover,Juillet 2022,Commentaire envoyé le 12 juillet 2022
