,0,1,2,3,4,5,6,7
411,Anthony,9.0,France,Fabuleux,"très bien placé, spacieux, tout est très beau dans l’hôtel, malgré la déco des chambres qui devient vieillissante, magasin et service ouvert sur de très large plage horaire.","un peu cher, notamment le petit déjeuner et la boutique qui pratique des prix exorbitant",Décembre 2021,Commentaire envoyé le 18 décembre 2021
412,Celine,10.0,France,Exceptionnel,"superbe hôtel, les décors sont très beaux, le personnel est très chaleureux, emplacement idéal",,Novembre 2021,Commentaire envoyé le 18 décembre 2021
413,Flora,5.0,France,Passable,La situation de l'hôtel et l hôtel. Buffet parfait,vu le prix de la chambre nous aurions aimé que le ménage soit fait au niveau de la moquette et que des bouchons d'eau minérale (bouteilles non renouvelées)laissés dans des verres utilisés soit au moins jetés voire changés pendant les 3 jours.,Décembre 2021,Commentaire envoyé le 17 décembre 2021
414,Julie,4.0,France,bien mais ne vaut pas le prix d’un palace 5 étoiles parisien,l’emplacement,les équipements dépassés. les soucis de communication avec l’hôtel.,Décembre 2021,Commentaire envoyé le 17 décembre 2021
415,Gwenael,10.0,France,Exceptionnel,Chambre très Confortable et calme. La magie Disney!!!,Les femmes de chambre qui frappe à la porte et entre à 9h du matin alors que l’on doit libérer a 11h…,Décembre 2021,Commentaire envoyé le 17 décembre 2021
416,Marine,10.0,France,Parfait,"Cadre magnifique, chambre digne d’une suite avec literie confortable, très propre, déjeuner exceptionnel, nous avons manger comme des ministres , hôtel très proche de Disney, accessible rapidement aux parcs. Merci pour cette agréable séjour",Rien a reprocher,Décembre 2021,Commentaire envoyé le 16 décembre 2021
417,Aurelie,10.0,France,Exceptionnel,"Un cadre magnifique, le chambre très belle et propre. Avec des enfants possibilités de faire des photos avec Mickey et pluto",L'eau de la piscine un peu froide.,Décembre 2021,Commentaire envoyé le 15 décembre 2021
418,Xx,5.0,France,Passable,le bain,qu’on entends les voisins très fort du dessus et d’à côté  l’indication pour aller vers les chambres  le bruit à la réception que nous avons pas comprit les personnes de l’accueil,Décembre 2021,Commentaire envoyé le 14 décembre 2021
419,Morgane,1.0,France,A fuir,Chambre sale et agresser par un réceptionniste mysogine et réveiller par les femmes de ménage à trois reprise,Absolument tout,Novembre 2021,Commentaire envoyé le 14 décembre 2021
420,Sara,1.0,France,Prestation bien en dessous des attentes et de ce qu'affiche l'hôtel,Chambres spacieuses,"Pas de peignoirs ni de pantoufle dans les chambres contrairement à ce qui était indiqué et 45 minutes d'attentes pour en avoir en chambre, au final la piscine était fermée...  Petit-déjeuner vide pour 30€ par personne c'est honteux, il n'y a rien à manger.",Novembre 2021,Commentaire envoyé le 14 décembre 2021
421,Sandrine,5.0,France,Passable,Le personnel de l'hotel,"Le restaurant ""cap code"" tres cher pour ce qu'il y avait à manger. La chambre correct ,mais pour le prix.......",Décembre 2021,Commentaire envoyé le 14 décembre 2021
422,Joseph,4.0,France,ça ne vaut pas son prix,l accueil rien na dire,le confort nul,Novembre 2021,Commentaire envoyé le 13 décembre 2021
423,Stey,9.0,France,sympathique,personnel accueillant et chambres spacieuses,ras,Décembre 2021,Commentaire envoyé le 12 décembre 2021
424,Harmony,10.0,France,magique,Tout est magique et à la hauteur du parc Disneyland  piscine au top  chambre décorée sur le thème de Noël,zéro,Novembre 2021,Commentaire envoyé le 12 décembre 2021
425,Aurelie,9.0,France,Magique,Très beau. personnel agréable,,Décembre 2021,Commentaire envoyé le 11 décembre 2021
426,Laurie,10.0,France,Exceptionnel,"La propreté des lieux, l’amabilité et l’efficacité du personnel, le repas au cape cod ( bien qu’un peu cher pour ma fille de 6 ans ) , les décorations de noël, les personnages dans le hall le soir.","Nous aurions aimé pouvoir être servi un simple café , jus de fruit en chambre sans être obligé de prendre le petit déjeuner à 38€.",Décembre 2021,Commentaire envoyé le 11 décembre 2021
427,Valentin,9.0,France,superbe séjours on y reviendra,"la piscine , le café offert et tout l’hôtel",,Décembre 2021,Commentaire envoyé le 8 décembre 2021
428,Stephane,1.0,France,Frustrant !,,Personnel Compas excellent pour promettre des services haut de gamme… mais quand on a besoin d’eux…. C’est très compliqué,Décembre 2021,Commentaire envoyé le 4 décembre 2021
429,Margaux,5.0,France,Déception,"Nous avons séjourné 2 nuits. Les décors sont beaux. Nous avons eu un bon accueil. La chambre était propre. Toutefois, nous n’y retournerons pas pour plusieurs raisons. La literie n’est pas bonne, on sent les ressorts de matelas. Nous avons très mal dormi. Chambre mal insonorisée. Pas très d’agréable d’entendre son voisin de chambre uriner ou prendre sa douche tard... Ne vaut pas un 4*, la chambre n’a pas été faite le 2e jour. Pas de remplissage du thé, sucre etc le 2e jour. Comparé au Marvel (que nous avons fait le mois dernier) qui est aussi un 4*, les prestations sont nettement en deçà. Pas de bagagiste sauf pour le Compass club. Super quand on a tour l’équipement pour bébé à monter soit même en x allers/retours. Pas de machine à café dans la chambre. Sèche cheveux d’un temps révolu. Distributeur à café dans les parties communes digne des stations services. Chambres moins spacieuses mais cependant nous les avons trouvées agréables et chaleureuses. Ayant réservé 1 nuit via la centrale disney et 1 nuit via booking,j’avais demandé à ce qu’on ne change pas de chambre.3 interlocuteurs, 3 fois on nous confirme pas de problème le nécessaire sera fait. Mais il faudra quand même repasser à la réception le 2e jour pour confirmer. (Donc ça blablate mais on fait ça ne peut pas faire le nécessaire en avance). Finalement, rien n’avait été fait en réalité. Notre clé a été démagnétisée tôt le matin. Impossible de rentrer à la chambre après avoir été chercher un café!! Il était 9h30. Queue interminable à la réception pour récupérer les nouvelles clés, et on nous dit qu’on devrait changer de chambre. Bref que des couacs… Et cerise sur le gâteau: la piscine hors service!!!! Alors que booking annonçait l’indisponibilité de la piscine du 22 au 26 novembre, elle était en réalité fermée du 29 nov au 2 dec! Aucune communication de Disney à ce sujet, j’avais pourtant eu la centrale au téléphone quelques jours avant!Aucune compensation. Déçus de l’hôtel",,Décembre 2021,Commentaire envoyé le 3 décembre 2021
430,Mandy,10.0,France,Super hotel,Tou lhotel ete super et tre joli ressemble a une hotel americaine,,Décembre 2021,Commentaire envoyé le 3 décembre 2021
431,Demy,4.0,Belgique,Mauvais rapport qualité/prix. Pire que dans le reste du monde Disney,- Une majorité du personnel est sympathique. - La literie est très bonne - La qualité de la nourriture dans les 2 restaurants est bonne. - Le parking est spacieux et proche. - La proximité avec les parcs Disneyland.,"- Une partie du personnel est très désagréable. - Les temps d’attentes aux restaurants, réception, conciergerie et ascenseurs sont longs même en semaine hors congés scolaire.  - Les chambres n’étaient toujours pas prêtes à 19h15 (check in à partir de 15h). - Les couloirs pour accéder aux chambres sont trop peu nettoyés.  - Il y a trop peu de personnel à la réception à certains moments.  - Les boissons sont servies dans des verres de 20cl aux restaurants alors que l’on paye (trop cher) pour des boissons de 33cl. Ceci n’était pas un cas isolé et le personnel est au courant—> c’est donc du vol selon moi et une fraude à la tva.  - Le wifi est médiocre. - Il est impossible de régler correctement la température de la douche. Ceci n’est pas un cas isolé.  - Les chambres sont mal agencées: Prises loin des lits et trop peu de place pour les bagages.  - Incertitude quant à savoir si l’eau en bouteilles dans les chambres est gratuite ou non. - Plats chauds au petit déjeuner sont tièdes.",Décembre 2021,Commentaire envoyé le 2 décembre 2021
432,Gulay,4.0,France,chambres beaucoup trop loin et non communicante alors que c été notre demande,pas trop loin de l entrée du parc et la raconter des personnages.,"réservation au restaurant pour 9 et on a voulu nous séparer. Et puis, elle nous a fait fortement sentir son agacement. désolée d être venus en famille et de vouloir manger en famille surtout pour un buffet à ce prix sans rien d exceptionnel",Novembre 2021,Commentaire envoyé le 2 décembre 2021
433,Nicolas,4.0,France,Décevant,Le personnel dans son ensemble et L'emplacement de l'hôtel. Les selfies avec les mascottes disney,La non information de la fermeture de la piscine pendant notre séjour. Le tarifs des petits déjeuners.,Décembre 2021,Commentaire envoyé le 1 décembre 2021
434,Clarisse,10.0,France,Super séjour je recommande vivement !!!,tout était parfait !!!! rien à redire !,ras,Novembre 2021,Commentaire envoyé le 30 novembre 2021
435,Stephane,3.0,France,Plus jamais pour nous...,La literie,"- Planche de salle de bain cassée.... - Pas de glaçon à l étage...a quoi sert le sceau ? - Piscine notée ouverte alors qu elle etait fermée.....très très déçu.. - 55 minutes pour avoir les clés de chambre .......une file d attente est prévue et des rigolos passent au bout .... personne ne dit rien... 3 ème fois que nous allons chez vous et 2 belles déceptions,  sans tenir vos paroles de geste commercial...c'était la derniere fois pour nous.",Novembre 2021,Commentaire envoyé le 30 novembre 2021
436,Claire,9.0,France,A refaire absolument !!,Le restaurant était délicieux !!,,Novembre 2021,Commentaire envoyé le 29 novembre 2021
437,Alexandre,10.0,France,Génial,Hôtel top Jolie petite vue sur le lac,Matelas un peu dur a mon gout,Novembre 2021,Commentaire envoyé le 28 novembre 2021
438,Géromine,10.0,France,Magique,"La vue sur le lac est magnifique,  la proximité avec disney village Le personnel très gentil","La télé fonctionnait mal (traits noir, pas d'image mais seule le son) Il manquait une brosse pour les toilettes Peut être faudrait-il refaire un coup de peinture dans la salle de bain ?",Novembre 2021,Commentaire envoyé le 28 novembre 2021
439,Narcisse,1.0,France,a fuir.,l emplacement de l hôtel à proximité du parc est idéal,le prix de la chambre et du restaurant est disproportionné par rapport à la qualité proposée : on paye plus les royalties que prestation de qualité. les travaux de rénovation de l hôtel se font en 3x8… notre séjour à été agrémenté de bruit de chantier entre 1h et 2h du mat.,Novembre 2021,Commentaire envoyé le 27 novembre 2021
440,Isabelle,10.0,France,Génialissime pour les parents et les enfants ! Je recommande chaleureusement,"Chambre très agréable, avec vue sur le lac et la piscine de l'hôtel, et joliment décorée avec un sapin de Noël Personnel très accueillant et sympathique  Petit déjeuner exceptionnel et vraiment très bon Bar : ambiance chaleureuse et jolie vue",rien,Novembre 2021,Commentaire envoyé le 26 novembre 2021
441,Jessica,4.0,France,Décevant,"Buffet bien garni, avec du choix pour tous",Mettre du jus d'orange pressé et pas en bouteille,Novembre 2021,Commentaire envoyé le 24 novembre 2021
442,Harmony,5.0,France,je m attendez à un établissement rénové que j ai finalement trouvé viellau,le restaurant buffet très agréable,pas très propre le télécommande de la télé était très sale,Novembre 2021,Commentaire envoyé le 23 novembre 2021
443,Oceane,4.0,France,Mal dormi,Facilité du parking- grandeur de la chambre- bon petit déjeuner et personnel au petit déjeuner et dans le hall sympathique- proximité du parc Disneyland,Mauvais accueil de la Reception et aucune explications de l’hôtel en terminant par « vous verrez bien si demain au petit déjeuner ils ont encore de la place ». Lit de très mauvaise qualité et d’une petite dimension! La propreté de la salle de bain laissait franchement à désirer! Bruits importants dans les couloirs; Du coup une nuit plus que moyenne..,Novembre 2021,Commentaire envoyé le 22 novembre 2021
444,Ilona,9.0,France,Excellent !,L’emplacement de la chambre était parfait !,Le petit-déjeuner pas pris car trop chère,Novembre 2021,Commentaire envoyé le 22 novembre 2021
445,Sophie,9.0,France,Séjour impeccable à recommander,"Cadre magnifique, proche du parc.  Prestations attendues et au niveau d’un 4 étoiles.  Nous avons pris la formule compass qui nous permet de bénéficier d’un goûter (boisson offerte et buffet à volonté et petit-déjeuner à part (salle réservée au compass). Petit-déjeuner avec énormément de choix. Chambre spacieuse et calme.  Personnel très agréable et très disponible  Pas pu utiliser la piscine par manque de temps mais nous y retournerons.  Hôtel à conseiller",Bruit dans les parties communes en raison d’un nombre important de clients et de leurs passages notamment pendant le petit déjeuner,Novembre 2021,Commentaire envoyé le 21 novembre 2021
446,Aidi,10.0,France,Exceptionnel,L hôtel est juste magnifique Il y fait bon vivre et le personnel est super sympa et aux petits soins,La télé trop petite et le sèche cheveux pas top pas assez de table de chevet et de prise,Novembre 2021,Commentaire envoyé le 21 novembre 2021
447,Stephane,3.0,France,Je ne recommande pas,,"Les chambres, l’accueil  Service déplorable  La nourriture une horreur  Ce n’est pas un 4 étoiles  Je déconseille  Et éviter les restaurants",Novembre 2021,Commentaire envoyé le 21 novembre 2021
448,Lapin,10.0,France,Exceptionnel,"Arrivés en retard à l'hôtel et donc pour notre réservation au restaurant, l'hôtesse a fait porter nos bagages dans la chambre et nous a accompagné directement au restaurant. Elle nous avait dit aussi qu'ils nous avaient préparé une petite surprise. En effet, quand nous sommes arrivés dans la chambre, elle s'était transformé en suite ! Merci encore pour cette magnifique surprise !",,Novembre 2021,Commentaire envoyé le 20 novembre 2021
449,Caroline,10.0,France,un séjour féerique dans un hôtel merveilleux,"le buffet du petit déjeuner copieux , large choix , le restaurant aussi , chambre très confortable et surtout le personnel adorable et à l'écoute , très professionnel , c'est la cinquième fois que je viens avec mon fils et on reviendra l'année prochaine !",,Novembre 2021,Commentaire envoyé le 19 novembre 2021
450,Valène,9.0,France,Fabuleux,La literie  les serviettes de bain,Pas très bien insonorisé.,Novembre 2021,Commentaire envoyé le 19 novembre 2021
451,Laurie,9.0,France,la magie Disney au rendez-vous,"hôtel très beau, spacieux et cosy. une équipe agréable toujours prête à nous aider ou répondre à nos interrogations. Restaurant de l’hôtel en buffet à volonté, très fin, et un large choix pour tout.","obliger de repasser par la réception empli de monde le soir pour faire activer notre pass comme clé de chambre alors que l’enregistrement de mon arrivée avait été faite le matin.  les distributeurs de boissons chaudes ne sont pas indiquées dans les étages, c’est embêtant.",Novembre 2021,Commentaire envoyé le 18 novembre 2021
452,Ludivine,9.0,France,Fabuleux,La proximité avec le parc disneyland  La gentillesse du personnel  Le service de bagagerie super pratique,L'insonorisation de la chambre Il n'y a pas de brosse pour les toilettes  La pression du pommeau de douche est trop faible,Novembre 2021,Commentaire envoyé le 17 novembre 2021
453,Serbruyns,1.0,Belgique,Mauvais,La deco,"Personnel désagréable, hôtel tres sale, peu de personnel, trop cher pour la qualité",Novembre 2021,Commentaire envoyé le 17 novembre 2021
454,Emeline,9.0,France,Fabuleux,Tout l'ensemble,Les repas un peu trop cher,Novembre 2021,Commentaire envoyé le 15 novembre 2021
455,Mickael,4.0,France,Déception.,L’emplacement par rapport au parc.,Trop de queue et trop cher pour ce que c’est.,Octobre 2021,Commentaire envoyé le 13 novembre 2021
456,Laila,4.0,Royaume-Uni,Gâché par l’hôtel et son absence de service,Le parc Disney land avec les enfants -,Aucun service dans cet hotel - la chambre n’a pas été faite pendant toute la durée du séjour à cause d’une grève du personnel - pour le prix payé c une honte - nous avons demandé des draps pour les enfants - nous ne les avons jamais reçu. La restauration est hors de prix est quasiment immangeable - une honte - a éviter.,Octobre 2021,Commentaire envoyé le 13 novembre 2021
457,Jonathan,10.0,France,magique et exceptionnel,le personnel très agréable avec le sourire.,tout c’est bien passé.,Novembre 2021,Commentaire envoyé le 11 novembre 2021
458,Bernard,9.0,Belgique,Fabuleux,l’infrastructure et la localisation …,,Novembre 2021,Commentaire envoyé le 10 novembre 2021
459,Emmanuelle,3.0,France,Assez médiocre,déçu,"lits petits, salle de bain moisi, hall d’entrée sale. Chambres loins labyrinthe. Télé petite. Pas café dans les chambres cartes crédité machine dans couloir si je ne demande pas personne nous prévient !",Novembre 2021,Commentaire envoyé le 10 novembre 2021
460,Johan,9.0,France,très bon hôtel,piscine et employe,,Novembre 2021,Commentaire envoyé le 10 novembre 2021
461,Maria,10.0,Suisse,Séjour trop petit,Tout me  plais. Service excellent. Personnel excellent.,J'ai été surprise  qu'il n'y avait pas de sachets de café soluble avec la bouilloire et les sachets de thé,Novembre 2021,Commentaire envoyé le 9 novembre 2021
462,Appere,10.0,France,Ce rêve bleu,"La proximité vis à vis des parcs, l'environnement, la piscine","Chaleur dans la chambre, impossible de régler à moins de 19 degrés.",Novembre 2021,Commentaire envoyé le 9 novembre 2021
463,Michael,3.0,France,ne jamais réservé via Booking!!!,la gentillesse du personnel !!!,la propreté de la salle de bain et les poussières pas faites!!,Novembre 2021,Commentaire envoyé le 7 novembre 2021
464,Valette,9.0,France,Satisfait et facile avec des très jeunes enfants,Taille des chambres bonne literie  Emplacement par rapport au parc Organisation générale  Superbe piscine,Le prix du petit-déjeuner pour des enfants de moins de 5 ans très chers,Novembre 2021,Commentaire envoyé le 7 novembre 2021
465,Ophélie,10.0,France,Vive le compass club,Le compass club,Le sauna et hammam fermé et « jaccuzi » sans bulles,Novembre 2021,Commentaire envoyé le 5 novembre 2021
466,Nathalie,3.0,France,ne vaut pas ses 4 étoiles,l’emplacement,salle de bain avec du tartre. pas de café en chambre. personnel qui ne nous a rien expliqué. pas de changement des bouteilles d’eau le deuxième jour.,Novembre 2021,Commentaire envoyé le 3 novembre 2021
467,Monique,5.0,France,"Déçu , mauvais rapport qualité prix",,Impossible de prendre un petit déjeuner sauf à faire 45 minutes de queue,Octobre 2021,Commentaire envoyé le 2 novembre 2021
468,Nathalie,5.0,Suisse,déçue,"j’ai aimé la sécurité , la gentillesse du personnel et l’organisation","la nourriture était de piètre qualité , la baignoire était bouchée , la salle de bain n’était pas propre",Octobre 2021,Commentaire envoyé le 28 octobre 2021
469,Marjorie,10.0,France,Exceptionnel,"L'accueil, les prestations, le lit confortable...",RAS,Octobre 2021,Commentaire envoyé le 25 octobre 2021
470,Claude,10.0,France,Superbe séjour,l’accueil exceptionnel! MERCI Sarah !!!,,Octobre 2021,Commentaire envoyé le 25 octobre 2021
471,Laetitia,4.0,Suisse,Décevant,"L’emplacement, l’aménagement extérieur avec le lac","Le restaurant, nourriture très moyenne et organisation chaotique. Pas assez de personnages Disney. Les chambres n’ont pas été très bien nettoyées (chiffons de nettoyage, laissés dans la chambre pendant deux jours et deux  capsules de café pour les trois jours de séjour) et nous n’avons pas reçu la chambre mentionnée lors de la réservation.  Nous avons été déçu par rapport à notre dernière visite.",Octobre 2021,Commentaire envoyé le 23 octobre 2021
472,Amndine,5.0,Belgique,Passable,On aime tout au newport,"Sauf, les chambres qu ils laissent a booking. En effet,  de la porte d entre de l hotel à notre chambre, nous n etions pas loin du kilometre! Dommage de ne pas etre plus fair play et de laisser des chambrees a l emplacement acceptable. Surtout quand on a un bebe!",Septembre 2021,Commentaire envoyé le 22 octobre 2021
473,James,3.0,France,extrêmement déçue,,"très déçue pour 600€ les 2 nuits : pas de ménage entre les 2 nuits , les serviettes non changées, une bouilloire à disposition mais pas de café/ thé/ sucre ,  les tiroirs de la commode ne ferment pas, pas de klinex dans la boîte à klinex",Octobre 2021,Commentaire envoyé le 21 octobre 2021
474,Nadia,3.0,France,Assez médiocre,La proximité avec le parc,Le manque d’hygiène,Septembre 2021,Commentaire envoyé le 21 octobre 2021
475,Audrey,5.0,France,Rapport qualité prix médiocre,"le contact avec le personnel, ils sont au niveau d’un 4 étoiles.","L’emplacement de la chambre, le ménage (nous avons retrouvé une paire de chaussettes qui ne nous appartenait pas), bruit de canalisation, pas de mini bar",Octobre 2021,Commentaire envoyé le 20 octobre 2021
476,Rossignol,4.0,France,trop chère par rapport au rêve Disney,"la vue et magnifique dans la chambre mes il n’y que ça avec le confort , et la navette toute les 12 min","le prix , 322€ la nuitée pour 2 pour une chambre vue lac sans billet avec un sèche cheveux des années 90 un lit bebe déjà déplié qui n’a rien à faire la … sans petit déjeuné , et à l’arrivé on ne trouve pas ma réservation, 15 20 minute pour avoire un assenceur vraiment sa ne vos pas sont prix ….. la déco et vielle et la télé et minuscule pas de mini bar . en plus lors de notre visite une manifestation a eux lieu très dérangeante car des vigiles étais là en masse , le petit déjeuné a 23 € …. vraiment déçu !",Octobre 2021,Commentaire envoyé le 19 octobre 2021
477,Mc37,5.0,France,Hôtel décevant / il baigne dans son jus !!!,Localisation de l'hôtel,Hôtel vétuste / prix complètement en décalage avec le niveau de prestation,Octobre 2021,Commentaire envoyé le 18 octobre 2021
478,Jonathan,4.0,France,Déçu.,"L’hôtel est beau, le personnel est agréable.","La chambre n’a pas été faite par les femmes de chambres pour les 3 nuits. Honteux. Le manageur nous a seulement suggéré d’écrire un mail de mécontentement. Honteux pour un 4 étoiles. Une manifestation au porte de l’hôtel pendant tout le séjour. Restaurant de l’hôtel décevant. Seul l’un d’entre eux été ouvert, donc surpeuplé. Nous avons été très déçus.",Octobre 2021,Commentaire envoyé le 18 octobre 2021
479,Vanlanden,9.0,Belgique,Bon séjour,Les lits la propreté de la salle de bain et l'accueil très chaleureux du personnel et surtout le calme dans notre chambre.,La chambre n'était pas terminée avant notre arrivée chambre peu aspiré.  Déjeuner assez cher mais pas un scandale non plus. Et surtout le non respect de certains clients pour les mesures sanitaires.,Octobre 2021,Commentaire envoyé le 17 octobre 2021
480,Imbert,4.0,France,Décevant,"Trop attente a la réception alors que nous étions seul, et il on mis 30 minutes à retrouver notre réservation faite via Booking",Calme,Octobre 2021,Commentaire envoyé le 17 octobre 2021
481,Gwendoline,10.0,France,Exceptionnel,"L’hôtel est très joli, un décor qui fait rêver ( en bonus, on avons vu minnie 🤪)",L’hôtel devait m’envoyer un sms pour connaître mon numéro de chambre mais cela n’a pas été fait. Ce qui nous a obligé à rentrer à l’hôtel et nous avons été en retard à notre réservation a un restau.,Octobre 2021,Commentaire envoyé le 15 octobre 2021
482,Fhetin,5.0,France,exagérément onéreux. pas de proximité avec les mascot et pas préciser ! trop d'attente pour le prix,la proximité avec le parc,pas chaleureux,Septembre 2021,Commentaire envoyé le 12 octobre 2021
483,Cécile,1.0,France,Mauvais,Proximité avec le parc,Pas de réactivité si souci dans chambre,Octobre 2021,Commentaire envoyé le 9 octobre 2021
484,Iakimov,10.0,France,Exceptionnel,Nous avons été surclassés vers une chambre Compass Club après l'appréciable et courtoise attention d'un personnel à l'accueil.,,Septembre 2021,Commentaire envoyé le 7 octobre 2021
485,Sebastien,10.0,France,Exceptionnel,Bel établissement,"Chambre Excentrée de l’accueil , des commodités …etc etc ( peut être parce que nous réservons en passant par Booking.com 😞)",Juillet 2021,Commentaire envoyé le 29 septembre 2021
486,José,5.0,France,déçu,un belle établissement avec un personnel super,"c’était notre anniversaire de mariage 10ans, j’avais demandé une chambre avec un lit double avec vu sur lac… on s’est retrouvé dans une chambre avec 2 lits et vu sur des cailloux.. merci a la reception une chambre avec un lit double mais une petite vue sur le lac. Une formule à 800 euro pas de petit déjeuner … le prix par personne est de 28euro.",Septembre 2021,Commentaire envoyé le 26 septembre 2021
487,Fanny,10.0,France,Week-end Disneyland Paris,"Le cadre est magnifique, la façade de l’hôtel est sublime, le personnel est très agréable. Nous avons apprécié la piscine.",La plomberie de la salle de bain portée d’énorme traces de calcaire au niveau du mitigeur et trace de rouille également sur une petite étagère en métal dans la baignoire.,Septembre 2021,Commentaire envoyé le 26 septembre 2021
