,0,1,2,3,4,5,6,7
794,Shenhav,5.0,Israël,,great location. very nice personal.,the room was too small and not clean enough. also it is impossible to contact the hotel prior to the arrival and get some answers about the upcoming staying.,Juin 2022,Commentaire envoyé le 5 juin 2022
795,Julie,9.0,Royaume-Uni,,friendly,not much evening entertainment for adults or children if not wanting to go to Disney also lack of characters around,Mai 2022,Commentaire envoyé le 24 mai 2022
796,Ian,9.0,Irlande,,Staff were amazing and the room was just perfect,The free coffee machine on 5th floor only gave out espresso even if you ask for a tea or latte. We laugh more than anything else 😂,Mai 2022,Commentaire envoyé le 17 mai 2022
797,Yousif,4.0,Émirats arabes unis,,i like the decorations and the staff were nice,"i didn’t like the A/C conditioner its very hot , and they give us the room at 5:00 pm too late , and the breakfast is not good at all",Mai 2022,Commentaire envoyé le 16 mai 2022
798,Gemma,10.0,Royaume-Uni,,everything,,Mars 2022,Commentaire envoyé le 2 mai 2022
799,Judith,3.0,Pays-Bas,,Nice architecture and ambiance near to the Disney parcs.,"Everything is completely overrated. The price is absolutely insane and you’ll get bad service, an outdated room and overcrowded hotel in return.  You will fell like cattle instead of guests.  When we’ve arrives we’ve got a wrong (downgrade) room; not what we’ve paid for. The personnel were very busy and appeared arrogant; if i want a new room, i have to get back in line (and wait again for 30/45 minutes).  Absolutely everthing is crowded… there are people/guests everywhere. The elevators are constantly in use, the breakfast room: full.. you’ll have to wait everywhere.  Precious year we’ve stayed in a hotel near Val d’europe that was great and 3x cheaper and 10x more service and quality. My tip: don’t book this hotel anymore, it is not worth yoyr money!",Avril 2022,Commentaire envoyé le 30 avril 2022
800,Thais,2.0,États-Unis,,the location,the staff and cleaning,Avril 2022,Commentaire envoyé le 29 avril 2022
801,Belén,4.0,Espagne,,The location and the bar. The staff in the bar was very friendly.,"The hotel is not well organised. You have to queue a lot to do the check in, the bathrooms look old. Is too expensive for what you receive.",Avril 2022,Commentaire envoyé le 29 avril 2022
802,Stelios,3.0,Grèce,,this is a huge property with hundreds of people which makes the place a mess. just being close to Disneyland doesn’t mean much… the cost of 600-700euro per night for a 4 star hotel is really not value for money,almost everything. breakfast cost 26 euro per person is overpriced especially when you pay 600euro per night. the hotel is huge so we had to walk a lot 100m in corridor maze to get to the room.,Avril 2022,Commentaire envoyé le 26 avril 2022
803,Georges,2.0,Liban,,A pure mess,The hotel is very dirty!!! We found partially eaten lollipops in the drawers…. Stained bedsheets and leftovers under the bed!!!!,Avril 2022,Commentaire envoyé le 22 avril 2022
804,Maikel,10.0,Belgique,,The thema of the hotel and restaurant where perfect,,Mars 2022,Commentaire envoyé le 18 avril 2022
805,Zlila,2.0,Israël,,close to disney,exept for 1 person all bad attention to client . very expensive for what we got,Avril 2022,Commentaire envoyé le 14 avril 2022
806,Philip,4.0,Royaume-Uni,,How close it was to the park and the friendliness of a handful of staff.,"The room was dirty with dead bugs on the TV stand and windowledge. Bath had debris by the plughole. Attempted to speak with the desk surrounding the issue and found no luck. I was advised to speak to the arrivals who could not seem to help. No one knew what to do. Also, my partner being basically shouted at by the man by the x-ray machines was not appropriate either. Overall, the park was fantastic but for the cost of a premium hotel I would have atleast expected staff who cared about the issues at hand.",Avril 2022,Commentaire envoyé le 13 avril 2022
807,Nigel,1.0,Hong Kong,,This is the worst hotel we have ever stayed at. Expensive for what it is. No service at all. Just a horrible stay. We will never return to Paris Disneyland and this hotel.,Dirty. Small room. Crowded. Bad and horrible food.,Avril 2022,Commentaire envoyé le 8 avril 2022
808,Hallan,4.0,France,,The hotel was rather pretty and close enough to the park . The staff was very nice.,"The beds were very uncomfortable, the pillows were very hard, the furniture was broken and missing parts, the tv was barely working and very laggy, there was a chewing gum glued to my room door (bathroom door) the walls were dusty, I'm expecting more from Disney... Or at least the bare minimum... Won't be coming back.",Avril 2022,Commentaire envoyé le 7 avril 2022
809,Anthea,5.0,Royaume-Uni,,,rooms not that clean,Avril 2022,Commentaire envoyé le 5 avril 2022
810,Navjot,5.0,Royaume-Uni,,close to Disney. The 1 hour access prior to everyone else.,Staff were unfriendly and unhelpful.,Mars 2022,Commentaire envoyé le 31 mars 2022
811,Ibrahim,10.0,Royaume-Uni,,Room was nice and short walk to disney park,Room cleaning service was not thorough enough,Mars 2022,Commentaire envoyé le 31 mars 2022
812,Oisin,9.0,Irlande,,Very close to park. Could walk from hotel into Disney Village. Beautiful view from Back of Hotel.,,Mars 2022,Commentaire envoyé le 26 mars 2022
813,Darren,5.0,Royaume-Uni,,location was good but that’s all I can say about the hotel. everything else was downhill.,"rooms are basic and dated. lifts are terrible, to get from the lobby to the lower ground you have to take a lift if you have a buggy and it only fits a buggy and nothing else in the lift. For a family hotel you would expect better. swimming pool is cold. breakfast was very basic and expensive. didn’t expect this standard from a Disney hotel. Room service was terrible and slow at cleaning our room.",Mars 2022,Commentaire envoyé le 21 mars 2022
814,Mohamed,1.0,Émirats arabes unis,,No thinks bad service bad communcatii,No thinks,Mars 2022,Commentaire envoyé le 19 mars 2022
815,Natalie,10.0,Royaume-Uni,,"The ease of being close to disneyland. Breakfast was pricey as we didn't do a meal plan so possibly worth looking at. Very clean and pool area had everything towels,floats,goggles. Very clean and has great meet and greet opportunities every night",Prices of food but typical for Disneyland.,Mars 2022,Commentaire envoyé le 18 mars 2022
816,Netanël,10.0,Israël,,"the facility is amazing, like Las Vegas hotels.",breakfast is a little expensive and there is not grocery store,Mars 2022,Commentaire envoyé le 8 mars 2022
817,James,4.0,Royaume-Uni,,good location,"very dated, not 4 star standard, average breakfast,pool area quite dirty, house keeping team don’t maintain cleanses in the rooms only get fresh towels and make bed (badly).",Mars 2022,Commentaire envoyé le 6 mars 2022
818,Alshabah,3.0,Koweït,,nothing,everything,Février 2022,Commentaire envoyé le 26 février 2022
819,Maria,3.0,Royaume-Uni,,staff were helpful and location was good.,"over rated and over priced ,  very old rooms not clean and very unorganised on arrival.",Février 2022,Commentaire envoyé le 23 février 2022
820,Mary,5.0,Irlande,,Location is amazing for access to Disney parks & village,Bit tired & shabby. Room very small. Bathrooms really worn & showers miserable.,Février 2022,Commentaire envoyé le 18 février 2022
821,George,10.0,Royaume-Uni,,fix problem with room by moving us to an executive compass club great staff,the room we were originally given bathroom had block drain and it smelled of human excrement the staff were so apologetic and because there was nothing else with wheel chair access we were upgraded to a executive compass club suit   a room meant for vips beds fridge hot tub lounge I mean big vip and I originally paid only £300 for a basic disabled room now that is service thanks to Marvin at the new port bay hotel,Février 2022,Commentaire envoyé le 5 février 2022
822,Paul,1.0,Jersey,,"I made an error in booking the wrong dates. Ok non refundable, but despite more than 10 calls to the hotel to ask to defer the booking until this week, a quiet week in January, we made no progress whatsoever. Hotel would not even answer its calls. Very disappointing. So Ive lost€400 and have not been able to take my familyto DisneyParis.",,Janvier 2022,Commentaire envoyé le 26 janvier 2022
823,Suosuoals,10.0,Koweït,,Everything in the hotel the staff the place the room was perfect and near disneyland and the shuttle take you every 30 min,Nothing,Janvier 2022,Commentaire envoyé le 23 janvier 2022
824,Hanan,10.0,Émirats arabes unis,,Everything,Nil,Janvier 2022,Commentaire envoyé le 15 janvier 2022
825,Ana,9.0,Brésil,,pool,,Janvier 2022,Commentaire envoyé le 9 janvier 2022
826,Niall,10.0,Royaume-Uni,,"Julian on reception was very friendly, gave us a great welcome and was very informative.",Nothing,Décembre 2021,Commentaire envoyé le 7 janvier 2022
827,Zuheir,1.0,Arabie saoudite,,only the location,breakfast was bad  dinner reservations and services was the worst i had to beg to find a table  room wasnt clean and cealing service was bad,Décembre 2021,Commentaire envoyé le 3 janvier 2022
828,Hui,5.0,Singapour,,"Being a Disney hotel, it provides the perk of early entry to Disneyland.","It was a long, long walk to the Disney Village and the Disneyland. There is no convenience store within the hotel that sells light snacks and drinks (unlike the Tokyo Disneyland Hotel). We need to take the very long walk to the Disney Village to buy anything. Given the very isolated location, the hotel will be doing all the guests a great service by having a convenience store within the hotel. We were supposed to be able to get free hot water and hot drinks from the vending machine, which is nice but the vending machine at our floor was not working three out of the four days we stayed there. The hotel was very crowded with long queue at the reception, the baggage storage, the restaurants, etc. Overall, quite a stressful and unpleasant stay.",Décembre 2021,Commentaire envoyé le 28 décembre 2021
829,Fatma,4.0,Qatar,,location,"old furniture, air conditioner is not working properly, the bathroom does not have hot water",Décembre 2021,Commentaire envoyé le 26 décembre 2021
830,Noora,4.0,Émirats arabes unis,,the location,the service was not good and there were no room service which is not stated in my booking,Décembre 2021,Commentaire envoyé le 22 décembre 2021
831,Constantinos,5.0,Chypre,,We liked the breakfast and the staff was very helpful,we didn't like that there was no room service because we were exhausted with the kids and we wanted to eat at the room,Novembre 2021,Commentaire envoyé le 16 décembre 2021
832,Nirnirle,5.0,Israël,,,The room was smelly There was only one electric socket In our second day they forgot to clean our room,Novembre 2021,Commentaire envoyé le 9 décembre 2021
833,Susan,9.0,Royaume-Uni,,Loved the hotel   restaurant buffets excellant  service good knowledgeable staff,Unfortunately request for rooms together not complied with    on same corridor but a long way from each other and water not replenished each day,Décembre 2021,Commentaire envoyé le 7 décembre 2021
834,Shauna,9.0,Malte,,excellent location,for the price we paid the rooms were too small,Novembre 2021,Commentaire envoyé le 4 décembre 2021
835,Jane,10.0,Royaume-Uni,,"Huge room, very clean",,Novembre 2021,Commentaire envoyé le 30 novembre 2021
836,Fatima,1.0,Émirats arabes unis,,i did not like anything,"the staff is rude , the room is not clean and overused it seams like a very old hotel.  not worth my time and money !",Novembre 2021,Commentaire envoyé le 15 novembre 2021
837,Hassan,10.0,Arabie saoudite,,everything,,Septembre 2021,Commentaire envoyé le 12 novembre 2021
838,Noor,10.0,Arabie saoudite,,The room was very nice and quiet. The breakfast was very nice. The location is near Disney land parks.,,Octobre 2021,Commentaire envoyé le 1 novembre 2021
839,Michelle,9.0,Irlande,,The breakfast was excellent,The rooms were extremely small & stuffy!,Octobre 2021,Commentaire envoyé le 30 octobre 2021
840,Barry,3.0,Royaume-Uni,,close to the parks.  15 mins to the park from the hotel,€500 a night. rip off. could not get in our room with the key card one night.  same money go to florida,Octobre 2021,Commentaire envoyé le 29 octobre 2021
841,Thomas,5.0,Royaume-Uni,,Location  Disney shop,"Everyday there was a protest by the cleaners on strike outside the hotel, who made lots of noise Staff not aware what time we could check in because of the cleaners strike No tea/coffee facilities, cardboard cups in the room, no fridge (not 4* standards/facilities) No Disney+, airplay/streaming facilities on the TV (tech is not up to date) Really busy - difficult to park",Octobre 2021,Commentaire envoyé le 19 octobre 2021
842,Valeska,2.0,Suisse,,Location,Property was dirty. Food bad quality. Never delivered the baby bed which has been ordered days before arrival.,Octobre 2021,Commentaire envoyé le 19 octobre 2021
843,Balas,10.0,Roumanie,,"Best breakfast that we ever had. There is no better location than this one for Disneyland Paris. Everything was exceptional, location, staff, people, thematic, restaurant, atmosphere, room, etc. Would recommend to everyone this specific hotel. It deserves 11 stars!!!",-,Octobre 2021,Commentaire envoyé le 15 octobre 2021
844,Arthur,1.0,Royaume-Uni,,,"The room was extremely noisy,surrounded by service elevator and stairs at the end of a basement corridor.Had to request a change of room as no one slept the first night.Really Disney.. guests should not be placed in that room. VERY DISAPPOINTING.",Septembre 2021,Commentaire envoyé le 8 octobre 2021
845,Fatemah,1.0,Koweït,,Nothing,- staff not helpful  - spiders in my room - horrible smell in the room - no room service  - no luggage service,Octobre 2021,Commentaire envoyé le 2 octobre 2021
846,Juliette,2.0,Allemagne,,,That there is no flexibility  Regarding Cancelations and there is no caracteres any more!,Septembre 2021,Commentaire envoyé le 29 septembre 2021
847,Mr,5.0,Pays-Bas,,,"no water in room for drink even on day 1, too much waiting on arrival, room lock stopped working",Septembre 2021,Commentaire envoyé le 25 septembre 2021
848,Sultan,9.0,Arabie saoudite,,everything,nothing,Septembre 2021,Commentaire envoyé le 12 septembre 2021
849,Dean,10.0,Irlande,,"It was just so magical, the staff are amazing. Super friendly and perfect location to Disney. We didn't even bother with the shuttle to the park, the walk was only 10 minutes and was gorgeous.",,Septembre 2021,Commentaire envoyé le 12 septembre 2021
850,Tomas,9.0,Slovaquie,,"Disney atmosphere, close to disney parks and disney village, kind and helpful staff, disney characters in the hotel every evening, disney shop, good swimming pool","Lot of restrictions due to covid, expensive breakfast",Août 2021,Commentaire envoyé le 5 septembre 2021
851,Fasal,1.0,Qatar,,Nothing. The room was thrown with popcorn on floor. The toilet was dirty with brown spots on toilet seat.  Not satisfied at all with the hotel.,Not good management. The service was bad. No room service for any food in the room. Checkout time at 11. Dirty toilet.,Août 2021,Commentaire envoyé le 30 août 2021
852,Yasmina,4.0,Luxembourg,,the style of the hotel,"the breakfast was not as good as expected, served cold asked for an omelette wait too long to get it. organisation for the breakfast not operationnal too long to wait in the morning, some peaple of the staff not nice at all contrary to some other very very good and friendly, ( in the BAR and in the breakfast service and Conciergerie). no peignoir in the room, waiting time for the lift too long etc etc...",Août 2021,Commentaire envoyé le 30 août 2021
853,Afrah,9.0,Koweït,,"Location, clean",Price too high not included breakfast,Août 2021,Commentaire envoyé le 27 août 2021
854,Stacy,4.0,États-Unis,,Convenient to Disneyland Paris; clean room,"Hard, uncomfortable beds  Worn out decor  Unappetizing buffet breakfast",Août 2021,Commentaire envoyé le 8 août 2021
855,Michael,10.0,Allemagne,,The staff was very friendly and super helpful. I was able to have all questions answered and needs fulfilled. The hotel was super clean and well staffed. I would recommend the hotel to all family and friends.,,Août 2021,Commentaire envoyé le 6 août 2021
856,Julie,3.0,Espagne,,swimming pool was great and towels and lockers provided,"Only one restaurant open, no options.  No place to buy a snack or sandwich. Hotel shop really big but ONLY sold disney products! No toiletries, no emery boards and I broke my charger for the iphone and they didn't sell those either - considering they make you download the disney app the minute you get there so you can access things!  In most hotels they would even lend you one, all they did was give me directions to the nearest train station shop or mall!  I was only there for 3 nights!  The bed mattresses were horribly cheap, all the furniture was old and bashed in, there was no tea and coffee facilities - in your room - but a machine 2 corridors away with a credit limit for your room of 4 drinks!  For the whole time we were there the ice machine never worked once.  No room service, just a breakfast service for 38 euros per person or the hotel breakfast for euros 51 for an adult and one child, no flexibility, if your child is over 2 it can eat 2 thirds of an adult amount.  In all of the parks the food outlets are incredibly expensive and all the same offerings, just calling the outlet a different name!  Make the effort and go to Florida!",Août 2021,Commentaire envoyé le 5 août 2021
857,Rayan,3.0,Arabie saoudite,,Location is perfect.,"No Rome service to our room, and also there is no minibar! Or a small fridge in the room.",Août 2021,Commentaire envoyé le 4 août 2021
858,Joecharles,9.0,Allemagne,,"Had to change room because the Air Conditioning unit wasn't working. No big deal, the staff reacted quickly and moved us to another room without hesitation.",N/A,Août 2021,Commentaire envoyé le 1 août 2021
859,P,2.0,Allemagne,,Design ok,"No comfort/ facilities in the room, not even the possibility to make a coffee or tee , no slippers, no mini bar, no laundry bag, the view of the room directly to the construction side , longwhy to reach the room, furniture in the bathroom damaged, no bathrobe, I was not allowed to buy breakfast only for the children,  forced to buy also for me ,even if i don't wanted, really bad this point..for 430 eur really not good",Juillet 2021,Commentaire envoyé le 30 juillet 2021
860,Mano,10.0,Israël,,Everything,Housekeeping they dont clean the room good,Juillet 2021,Commentaire envoyé le 24 juillet 2021
861,Traveling,5.0,États-Unis,,"Other than the location, not worth the cost.","We got stuck in the bathroom bc the door jammed. There was a smell from the toilet. Didn’t like the curtain to enter the bathroom. When you turned the light on, other people staying with you woke up. The cost was outrageous compared to other hotels we stayed at. Just overall a disappointing stay other than the location.",Juillet 2021,Commentaire envoyé le 14 juillet 2021
862,Petra,4.0,Malte,,Hotel is walking distance to the park   .,Staff speak no English.  Poor concierge. No covid swab facilities. Food is not fit for dogs. It's cruelly disgusting. Nothing good to eat in the area. All the restaurants are full.  No lift close to my room. Had to walk a mile to get to it. Toilet was extremely small. No cleaning done through out my stay. When you are paying 400 a night for two people it's expected.,Juin 2021,Commentaire envoyé le 29 juin 2021
863,Muzaffer,1.0,Turquie,,Hotel just so near disneyland and la ville vilage,Everyday fıx menu for dinner You are waiting so much for chechk in and check out.(1 hour) We stay for 3 days they didnt clean are rooms,Juin 2021,Commentaire envoyé le 25 juin 2021
864,Frankiefrie,9.0,Belgique,,Great location for Disneyland Paris. The deco was very fresh and nautical. The staff was friendly and helpful. Beautiful view of the lake. The room was very clean and peaceful.,The water saving shower head kept changing the water temperature from too cold to too hot. And the AC could not be set below 21 degrees so it stayed quite warm in the room. I would have liked to have a top sheet on the bed instead of just a comforter.,Juin 2021,Commentaire envoyé le 22 juin 2021
865,Nele,4.0,Belgique,,-location - disneyland,"- only 4 plugs and no usb - small room cause of a desk taking a lot of space - because of covid no housekeeping but staying three nights two ladies one set of tiny toilletries is just not enough - lounge is worthless: breakfast is the same as in the regular restaurant but you are eating with your knees in your nexk at a small bar table, the teatime was pretty worthless sweet stuff was ok but salty stuff not tasty at all. We were two but would not get even one of each item let alone two so we would always have to ask for more and more making us feel very greedy. Ecening it is just canned softdrinks and hot drinks - after spending the last 20 birthdays in a Disney park this was the very first time no recognition at all: no card, no gift, no balloon, no cupcake I already downgraded my next booking to standard",Octobre 2020,Commentaire envoyé le 18 octobre 2020
866,Vanja,10.0,Pays-Bas,,"We booked hotel for 2 nights, my wife celebrated her B-day during our stay,stuff surprised her with balloons, gift and cookies which was very nice gesture. Stuff was really helpful and friendly. Hotel was very clean and rooms are very cozy. We had free hot drinks during our stay,also very nice. In one sentence,amazing experience and totally worth of the money that you pay!",,Septembre 2020,Commentaire envoyé le 15 septembre 2020
867,Paul,10.0,Royaume-Uni,,"The size and the welcome factor, it did not disappoint. Would stay here again as the hotel has everything you require and is a very short walk to the Disney park",Nothing not to like,Août 2020,Commentaire envoyé le 28 août 2020
868,Nuno,10.0,Portugal,,Location staff quality price,,Juillet 2020,Commentaire envoyé le 30 juillet 2020
869,Lucia,10.0,Italie,,It was a nice experience and I really enjoyed it with my family. I also love going to the park early that was so nice!,I only wish the shuttle service would start earlier but it’s OK. Like at four will be nice for the early flights to come out at seven.,Mars 2020,Commentaire envoyé le 14 mars 2020
870,Anna,5.0,Suisse,,"Very comfortable beds. Quiet, clean room, basically as it should be.","For the fairly expensive rate involved we were 'entitled' to a few drinks from a machine a VERY LONG WAY from our room. It would probably have been better if we had never been told about this lukewarm, so called 'entitlement'. Also, hardly any convenient shelf space in the actual bathroom/toilet. VERY poor selection of TV stations. Wash basin practically blocked - should have been checked by housekeeping. No convenient electric plug near the window bed. Generally inconsistent approach to security. We didn't bother with breakfast as it was clearly overpriced for normal appetites.",Mars 2020,Commentaire envoyé le 13 mars 2020
871,Laura,9.0,Royaume-Uni,,"Good food, loved pool,",I fridge or tea and coffee in room,Mars 2020,Commentaire envoyé le 7 mars 2020
872,Sebastian,4.0,Suisse,,The dinner is fantastic. The room was nice.,The breakfast at 28 euros a head is miserable. There's hot food but it's all cold. The coffee is disgusting and from a machine that looks long outdated. It's in a room that is hot and very noisy.,Mars 2020,Commentaire envoyé le 4 mars 2020
873,Clint,4.0,Royaume-Uni,,How friendly the receptionist staff was.,No hot drinks facilities are in room The restaurant  serves pink chicken and expensive for the quality of food,Février 2020,Commentaire envoyé le 29 février 2020
874,Rihana,5.0,Afrique du Sud,,This hotel is conveniently located for access to the parks.,"This is flat out over priced, the rooms are dated with no amenities, no kettle or even plug points next to the bed. Beyond that, there are 2 restaurants only which are always fully booked and there are no alternatives close by. Absolutely not worth the money.",Février 2020,Commentaire envoyé le 26 février 2020
875,Nikki,10.0,Royaume-Uni,,The location was fab and also the swimming pool was brilliant for the kids!,,Février 2020,Commentaire envoyé le 20 février 2020
876,Dee,9.6,Royaume-Uni,,The staff were lovely and very helpful. Rooms are very clean and food in the Cape Cod was delicious!,Food on the expensive side!,Février 2020,Commentaire envoyé le 16 février 2020
877,Kasey,10.0,Royaume-Uni,,This is the most beautiful Disney hotel in my opinion. Fantastic service and beautiful decor. Highly recommend,Nothing!,Février 2020,Commentaire envoyé le 9 février 2020
878,Michael,9.2,Royaume-Uni,,"The hotel is gorgeous, and though massive, never felt too busy. Compass Club check-in was brilliant, friendly, fast, and efficient. Compass Club Lounge is beautiful, spacious and comfortable, and the food on offer for breakfast and at tea time was outstanding. The pool is excellent, and the grounds are beautiful. The room was spacious and comfortable.",The mattress could have been thicker and less springy.,Janvier 2020,Commentaire envoyé le 28 janvier 2020
879,Abdullah,3.0,Koweït,,The furniture was great  And the atmosphere as well,The room was not provided with any thing even water  No room survive unless you pay 10 euro extra,Janvier 2020,Commentaire envoyé le 15 janvier 2020
880,Anonyme,6.0,États-Unis,,close to Disneyland,"way overpriced, especially food",Mars 2022,Commentaire envoyé le 25 mars 2022
