,0,1,2,3,4,5,6,7
0,Laura,10.0,Belgique,Exceptionnel,Nous avons été surclassés donc c'était une très belle surprise.,Le seul bémol est que la chambre était froide malgré le changement du termostat.,Septembre 2021,Commentaire envoyé le 21 septembre 2021
1,Lucien,8.0,France,A faire,"Hôtel très jolie, personnel agréable, super vue de la chambre.",Chambre pas très propre (chaussette d'autres personnes sous le lit et chips par terre). Manque des joints dans la douche qui fuit de partout. Petit déjeuner vraiment trop chère pour les enfants de 10 et 5 ans (qui ne mange presque rien).,Janvier 2023,Commentaire envoyé le 10 janvier 2023
2,Stella,7.0,France,déçue car j’avais demandé une petite attention car le séjour était pour l’anniversaire de notre fils est : RIEN pas même,l’accueil était parfait  la décoration également,l’emplacement de la chambre. nous étions certes côté lac mais à l’extrémité de l’aile côté piscine derrière des sapins qui nous ne donne aucune vue! pas très cool !,Janvier 2023,Commentaire envoyé le 10 janvier 2023
3,Nathalie,7.0,France,super mais le prix de l hôtel est trop important alors qu il est vieillissant,le buffet. la localisation,propreté,Décembre 2022,Commentaire envoyé le 5 janvier 2023
4,Christelle,8.0,France,Très bien,"Personnel aux petits soins, chambre propre literie super confortable","La longueur des couloirs pour arriver à la chambre versus l'ascenseur le plus proche, avec une personne qui avait du mal à se déplacer c'était compliqué. Pas de dosette de café dans la chambre, pourtant la cafetière était bien présente ainsi que sa notice",Décembre 2022,Commentaire envoyé le 2 janvier 2023
5,Martine,7.0,France,très déçus nous ne reviendrons pas,hotel situé pres du parc lits confortables personnel souriant,personnel parlant limite français qui ne comprennent pas tjrs ce qu on leur dit très cher pour une chambre que l on peut prendre qu à partir de 15h (code de la chambre envoyé qu à 19h30) pour la rendre à 11h le matin il y avait soit disant une bouilloire  pratiquement pas de produits toilettes un vrai labyrinthe pour acceder aux chambres et pareil pour en ressortir contrôle des sacs 5 fois dans dans la journée ce qui gâche la magie du séjour,Décembre 2022,Commentaire envoyé le 26 décembre 2022
6,Julien,8.0,France,Très bien,"Les navettes pour accéder au parc, La taille de la chambre, La personnalisation de la télé.",R.a.s,Décembre 2022,Commentaire envoyé le 15 décembre 2022
7,Celine,6.0,France,Agréable,Û,,Décembre 2022,Commentaire envoyé le 14 décembre 2022
8,Diego,6.0,France,Agréable,la proximité du parc Disneyland Paris,"la qualité de la chambre n’était pas top, vieux équipements, rapport qualité prix n’est pas correct",Novembre 2022,Commentaire envoyé le 30 novembre 2022
9,Fabienne,6.0,Belgique,déçue qualité prix,l emplacement,la propreté,Novembre 2022,Commentaire envoyé le 18 novembre 2022
20,Pierre,6.0,France,très moyen par rapport au prix,très bon personnel dédié mais la sécurité fait du zèle,hôtel très vieillissant et pas de shampoing gel douche,Novembre 2022,Commentaire envoyé le 14 novembre 2022
21,Christine,8.0,France,Très bien,La décoration de la chambre est adorable. On a une bouilloire pour préparer du thé ou du café. On a un large choix au petit déjeuné. La piscine est top. Pas beaucoup de monde. La boutique dans l hôtel est super pratique.,La porte ne marchait pas bien. Quand on met le badge. Il ne s ouvre pas du premier coup. On a du ré essayer pleins de fois. La télé avait beaucoup d option en plus des chaînes normaux. Mais il fallait attendre longtemps pour passer d'un onglet a un autre.,Novembre 2022,Commentaire envoyé le 10 novembre 2022
22,Gilles,8.0,France,Comme une ambiance de croisière Disney,"L'ambiance nautique de l'hôtel et la qualité des infrastructures rendent cette hôtel disney très agréable. Tout est mis en place pour que l'on se sentent bien après une belle journée au parc. Piscine &  salle de sport ( serviettes fournis à discrétion ) , restaurant, bar et même une boutique Disney dans l'hôtel. Dans la chambre, machine à café senseo, thé et eau minéral.",Peut être le fait qu'on ne m'ait pas offert de badge en rapport avec la saison d'halloween :/ Mais sincèrement c'est vraiment pour trouver quelque chose !!,Octobre 2022,Commentaire envoyé le 1 novembre 2022
23,Nino,7.0,Suisse,très bon moment passé en famille,,je pense qu’il serait judicieux afin que l’on fasse un effort collectif concernant nos énergie d’éteindre les lumières à partir de minuit concernant la piscine extérieure et les guirlandes lumineuses,Octobre 2022,Commentaire envoyé le 19 octobre 2022
24,Anne-sophie,7.0,Suisse,"agreable, très couteux",le personnel,"vieux (join, accessoires) et cher  repas beaucoup trop cher pr les enfants",Octobre 2022,Commentaire envoyé le 14 octobre 2022
25,Charline,7.0,Belgique,Avis mitigé,"L'hôtel est très joli, le décor est détaillé.  Le lit double est confortable. Le monsieur qui nous a accueillit à l'accueil était très sympa. Le petit déjeuner était très copieux, il y a beaucoup de choix différents pour les viennoiseries et les pains, chaque région peut se faire le petit-déjeuner qu'il aime.","Lors de l'accueil, nous avons été accueilli par un monsieur très gentil, par contre une dame est venu l'interrompre plusieurs fois parce qu'elle avait fini sa journée et qu'il devait faire quelque chose avec elle... elle n'était pas souriante et a bien fait comprendre que nous étions dérangeant. Nous avions demandé un lit bébé dans la chambre, il y en avait un mais c'est un lit de voyage sans matelas supplémentaire, un lit vraiment pas confortable. Et dans la seconde chambre il y avait un lit très confortable et l'autre pas du tout, matelas très usé.   Dans une des chambres il y avait des mies de pain sur le sol et des mouchoirs par terre.  Il manque un frigo dans les chambres car par exemple nous avions du lait pour notre enfant à conserver au frais après ouverture... nous avons pu le jeter alors que le matin notre enfant devait boire du lait. Je trouve dommage d'avoir des détails comme ceux là négatif alors que c'est actuellement le 2 ème meilleur hôtel de ma chaîne Disneyland Paris",Septembre 2022,Commentaire envoyé le 10 octobre 2022
26,Andre,6.0,France,cher pour les prestations fournis,pas loin du parc Disney,pas conforme à ma réservation et pas à la hauteur d un 4 étoiles,Septembre 2022,Commentaire envoyé le 1 octobre 2022
27,Christophe,6.0,France,Cher et bof !,,"C'était l'usine ! L'hôtel etait noir de monde, la queue à la réception, des groupes bruyants, des couloirs interminables, signalisation insuffisante des ascenseurs, manque de souplesse du personnel appliquant des procédures rigides ...",Septembre 2022,Commentaire envoyé le 29 septembre 2022
28,Severine,6.0,Belgique,déçu de bcp de chose,personnel super gentil bien placer par rapport au parc Disney,"chambre déplorable, matelas TRÈS USÉS ( très mal au dos au réveil) sanitaire à refaire complètement  propreté correcte mais peux mieux faire au vu du prix de la nuitée 530€ sans petit déjeuner pour 4",Septembre 2022,Commentaire envoyé le 25 septembre 2022
29,Francois,8.0,Belgique,Très bien,la situation et les décors le confort,manque d’équipements pour le prix . pas de frigo ds la chambre une cafetière sans café . là contrôleur de la Clim qui ne marche pas très bien,Septembre 2022,Commentaire envoyé le 21 septembre 2022
30,Sylvie,7.0,France,Avis mitigé,Hôtel : magnifique. Très belle décoration. Parties communes et restaurants très agréables,"La chambre : absolument pas la hauteur du prix. Absence de produits de toilettes, de nécessaire à cafe-the-tisane. Les chaînes Disney de la TV étaient indisponibles. Linge de toilette vieillissant. Besoin général d'un rafraichissement. Ne correspond pas à une chambre d'hôtel 4****",Août 2022,Commentaire envoyé le 31 août 2022
31,Fatima,7.0,Belgique,Agréable,La chambre et le déjeuner,,Juillet 2022,Commentaire envoyé le 15 août 2022
32,Jack,7.0,Belgique,Prix élevé mais totalement justifié,"Déjeuner de qualité, service rapide, personnel sympa et disponible.",Pas de frigo dans la chambre dommage.,Août 2022,Commentaire envoyé le 7 août 2022
33,Maëva,8.0,France,excellent,"la déco, la piscine",rien,Août 2022,Commentaire envoyé le 4 août 2022
34,Rosetta,8.0,France,agréable mais manque d animation,le décor la propreté,pas de personnages Disney,Juin 2022,Commentaire envoyé le 15 juillet 2022
35,Jean,6.0,France,très cher sans raison,"pas grand chose, c’est vétuste , les salles de bains sont pitoyables ,le mobilier est dans un état pitoyable . bref pour le prix peu mieux faire …","états du mobiliers dans les chambres , le service",Juillet 2022,Commentaire envoyé le 8 juillet 2022
36,Lionel,7.0,France,Bien mais trop cher,La localisation,Le petit déjeuner est vraiment hors de prix,Juillet 2022,Commentaire envoyé le 8 juillet 2022
37,Brahim,8.0,France,Très bien,Belle hôtel bon emplacement,Les Lits devraient être plus large,Juin 2022,Commentaire envoyé le 26 juin 2022
38,Brice,7.0,France,je ne passerais plus par booking pour mes vacances,Disneyland,nous avons louer une chambre supérieur avec terrasse je cherche toujours la terrasse … ne louer pas de chambre avec terrasse quand celle ci est inexistante,Juin 2022,Commentaire envoyé le 17 juin 2022
39,Jessica,8.0,La Réunion,Super malgré quelques points à améliorer,"Le personnel est extrêmement agréable, tout est fait pour que nous ayons un accueil chaleureux","Plateau de courtoisie des anciens occupants non débarrassé, pas de dosette pour la cafetière, salle de bain vieillissante (distributeur de savon et porte serviettes cassés)",Juin 2022,Commentaire envoyé le 15 juin 2022
40,Emilie,6.0,Suisse,Agréable,"La proximité avec le parc,  les grandes piscines intérieures et extérieures assez chauffée pour les enfants, la gentillesse du personnel du bar.","Le lit bébé pour notre fille de 2ans !  Cet hôtel doit accueillir une multitude d'enfants et pourtant le lit se résumait à un voeux lit parapluie avec un drap blanc trop grand.  Pas de drap Disney sympa,  pas de petit kit d'arrivée, de petit savon ou produit de soin pour les enfants. C'est limite pour un 4*. Le service minimum dans la chambre.  Il fallait toujours réclamer pour avoir du papier toilette,  de l'eau ou même des cotons-tiges. Tout est disponible gratuitement mais rien n'est mis dans la chambre.",Mai 2022,Commentaire envoyé le 14 juin 2022
41,Valène,8.0,France,Très bien,"le décor, le personnel et la proximité avec le parc",Pour le prix déçue de ne pas voir les personnages dans l’hôtel. la TV ne fonctionnait pas le 1er jour et pas de capsule à café à côté de la machine à café.,Juin 2022,Commentaire envoyé le 11 juin 2022
42,Anaïs,8.0,France,Super !,"Chambre très spacieuse, propre Superbe vue sur le lac",Pas de café/thé à disposition dans les chambres  Manque de serviettes et de prises électriques,Mai 2022,Commentaire envoyé le 2 juin 2022
43,Etienne,8.0,Suisse,Nous avons passé un très bon séjour dans l’ensemble!,"• le buffet Cape-Cod, petit-déjeuner et dîner est de bonne qualité, heureusement au prix, certes, mais même les plats de poissons et fruits de mer sont savoureux , rare dans une telle industrie! • les cast members (employés) se donnent énormément de peine pour être avenants et sympathiques (même sur une journée rouge et noire en fréquentation)  • les chambres sont confortables et fonctionnelles  • les flux et infrastructures sont bien pensés","rien de trop significatif à signaler ; • rapport qualité-prix on ne reviendra pas dessus c’est Disney c’est ainsi et on est post-covid soit • mal reçu au desk Concierge pour une demande, pas gravissime, je m’attendais pas à des miracles clé d’or , je voulais juste me renseigner s’il y avait une chance de déplacer une réservation buffet soir de 45 minutes en anticipant , la réponse du monsieur: « c’est ça ou McDo estimez vous heureux de pouvoir dîner avec vos enfants » j’aurais préféré un « désolé rien n’est possible pour ce soir » pour un 4* à ce tarif…",Mai 2022,Commentaire envoyé le 28 mai 2022
44,Emilie-julien,8.0,France,"Un très bel hôtel, un très beau séjour malgré quelques petits problèmes au démarrage.","L'hôtel, sa situation, sa décoration, les équipements qu'il propose correspondent véritablement à nos attentes lors de la réservation. Cela a été une parenthèse magique, enchantée pour notre famille.","Nous n'avons pas eu de chambres adjacentes alors que nous l'avons demandé. Après l'enregistrement, le personnel nous a indiqué qu'un sms nous serait envoyé pour nous prévenir que les chambres étaient prêtes, mais nous ne l'avons jamais reçu. Il y a enfin eu un problème au moment de l'enregistrement des cartes pour accéder aux chambres ; nous nous sommes rendus compte qu'elles n'étaient pas activées, devant la porte de la chambre [...]. Dommage. Malgré ces désagréments dont on pourrait ce passer compte tenu du prix de l'hôtel, le séjour s'est très bien passé.",Mai 2022,Commentaire envoyé le 21 mai 2022
45,Emmanuel,7.0,France,Bien,,la qualité de la restauration,Mai 2022,Commentaire envoyé le 16 mai 2022
46,Romain,6.0,France,Agréable,Disney accueil parfait,La chambre :  Lit 140  matela qui a vecu Robineterie non vice qui tourne sur elle meme Chambre besoin d un coup de jeune Pour 350 euro la nuit ......,Mai 2022,Commentaire envoyé le 7 mai 2022
47,Calot,7.0,France,ULTRA CHER !!!!!!!!!!!!!!!!!!!!!!!!!!!!!!!!!!!!!!!,,Nous allons à l'hotel à coté du Parc Disney donc avec des enfants. Le menu Enfant 30€ et le petit déjeuné 23€ pour un enfant de 4 ans est tout simplement aberrant!!!!!!!!!!! et même pour un enfant de 9 ans.,Avril 2022,Commentaire envoyé le 2 mai 2022
48,Arnaud,7.0,France,.SOS doudous laisse un goût amer...,La chambre est spacieuse et bien équipée. L'hôtel est grandiose est super bien place à côté du parc,"Nous avons oublié les doudous dans la chambre. Nous avons appelé l'hôtel immédiatement après l'avoir quitté pour les prévenir mais rien a été fait... Il est désolant que dans un hôtel à ce prix, qui reçoit des milliers d'enfants chaque jour, dans un parc qui émerveille les enfants, aucun service doudous perdus soit mis en place et que les doudous ne soient pas mieux considérés que cela...",Mars 2022,Commentaire envoyé le 29 avril 2022
49,Laurence,6.0,France,"Site de l'hôtel idéal,  qualité équipements et chambres moyenne",Le personnel a l'écoute . La propreté et le calme.,Chambre familiale exiguë.  Salle de bains vétuste.  Rapport qualité- prix pas adapté du tout.,Avril 2022,Commentaire envoyé le 28 avril 2022
50,Sylvie,8.0,France,"Très bon séjour, dommage que le beau temps n'y était pas.","Super petit déjeuner et le personnel trop gentil ! Par contre notre chambre était un peu vieillotte, je m'attendais à mieux.","La déco faisait vieillotte, télé que nous l'avions connue il y a quelques années.",Mars 2022,Commentaire envoyé le 24 avril 2022
51,Gilles,6.0,France,"Très bel hôtel, bien situé à l'entrée du parc. Mais absolument pas confortable, literie : une cata","La situation de l'hôtel est top, juste à côté du parc. On est directement plongés dans l'ambiance Disney..  Le restaurant est excellent, heureusement car très très cher...","Literie absolument pas au niveau pour le prix demandé... le matelas : une vraie planche, on se réveille avec un mal de dos pas possible. Les oreillers mous.. salle de bain vieillotte. Pour le prix payé ce n'est absolument pas normal de dormir aussi mal...",Mars 2022,Commentaire envoyé le 19 avril 2022
52,Dominique,8.0,France,Très correct prix en rapport avec les prestations,Cadre situation Pdj en chambre,Un p’tit coin repas plus pratique,Mars 2022,Commentaire envoyé le 13 avril 2022
53,Coralie,7.0,France,Bien,L emplacement par rapport au parc,L'impossibilité pour mon fils de prendre une photo avec le personnage car il était trop tard .....,Mars 2022,Commentaire envoyé le 12 avril 2022
54,Corinne,8.0,Israël,Très bien,La cjambre etait grande. Le personnel tres accueillant. La chambre propre. Le lac magnifique et la proximité a disney extra.,La chambre est trop loin de l ascenseur. 323 pas pour y accéder  Il n y a pas de café et de restaurant a part le petit dejeuner. L acclim ne marche pas trop bien.,Avril 2022,Commentaire envoyé le 11 avril 2022
55,Franck,8.0,France,Très bien,Le décor  La réaction pour nous changer de chambre (10min),Je pense qu’il mette au second plan les réservations Booking.com  Heureusement après un appel à la réception on nous a changer de chambre,Avril 2022,Commentaire envoyé le 9 avril 2022
56,Anne-sophie,7.0,Belgique,Bien,"le confort, l’amabilité, le fait qu’on puisse voir des personnages de Disney","le fait qu’on débarrasse la table du déjeuner alors que je n’avais pas fini, 28€ pour un buffet à volonté et qu’on débarrasse la table ça fait cher payé.",Avril 2022,Commentaire envoyé le 9 avril 2022
57,Jennifer,7.0,France,passable,la propreté des lieux,nous devions avoir une baignoire et deux lits doubles. Et nous avons eu un lit double et un lit superposé ainsi qu’une douche… quelle déception,Avril 2022,Commentaire envoyé le 8 avril 2022
58,Marie,8.0,France,Très bien,"La chambre, la rencontré avec Mickey",Le prix du buffet,Avril 2022,Commentaire envoyé le 2 avril 2022
59,Nor,8.0,France,Très bien,,la douche c une catastrophe,Mars 2022,Commentaire envoyé le 1 avril 2022
60,Keitoun,8.0,France,"Très bon séjour,  à renouveler","La situation, le compass club car on est chouchoute","Un seul peignoir pour 2 personnes,  l'absence de gel douche dans la salle de bain",Mars 2022,Commentaire envoyé le 30 mars 2022
61,Marie,6.0,France,tres bon séjour,"La proximité du parc, le décor et thème de l’hôtel. personnel agréable","chambre très loin de l’entrée, j’ai du traverser des couloirs infinis pour y accéder avec ma fibromyalgie c’est très compliqué de marcher autant avec les douleurs chroniques",Mars 2022,Commentaire envoyé le 30 mars 2022
62,Lidia,8.0,France,Hotel classe     personnel souriant    chambre agréable et lit confortable,Tout proche du parc Disney Bel hôtel bien classe,La machine à café complètement à l opposé de la chambre  La lumière et le bruit à côté du sauna  hamam,Mars 2022,Commentaire envoyé le 30 mars 2022
63,Aurélie,7.0,Belgique,sympa,le côté féerique les détails de disney,- longue attente au check in le soir  - lit double 1m40 - le prix du petit déjeuner  - la chambre tout au bout de l’hôtel  - pas de brosse pour les toilettes,Mars 2022,Commentaire envoyé le 29 mars 2022
64,Kahina,8.0,France,Magnifique,Les réceptionnistes étaient top et tout les autres personnels de l’hôtel était top. :-),Certains défauts dans la salle de bain,Mars 2022,Commentaire envoyé le 28 mars 2022
65,Vincent,8.0,France,Très bon séjour détente en famille,"La proximité de l'hôtel par rapport au Parc grace à la navette gratuite. Le restaurant de qualité mais des prix 4* : 38€ le buffet du soir sans les boissons, 28 le petit déjeuner.",Pourquoi nous punir en nous installant dans la chambre la plus loin de la réception ? ( 3394 au fond du couloir aile Est ) Je n'ai jamais vu un couloir aussi long ! ( je pense qu'il y a record ) Est-ce parce que nous avons réservé avec Booking ?,Mars 2022,Commentaire envoyé le 28 mars 2022
66,Jonathan,8.0,France,Parfait.,Propreté et proximité des parcs,,Mars 2022,Commentaire envoyé le 26 mars 2022
67,Daniel,7.0,France,Bien pour les enfants moins pour les adultes,"Les petites attantions, le décor, le personnel. La prestation dans son ensemble était bien surtout pour les enfants qui étaient très contents.","La localisation de la chambre, lorsque j'ai fais la réservation j'avais demandé à ce que les chambres soient à côté mais à mon arrivée l'info n'avait pas été transmise par booking d'après Disney. Néanmoins les cast memebers ont réussi à mettre les chambres côte à côte mais à l'autre bout de l'hôtel ce qui est le point négatif de mon séjour, presque 5 minutes de marche.",Mars 2022,Commentaire envoyé le 26 mars 2022
68,Pascal,7.0,Belgique,Un peu déçu,,"J ai connu l hôtel à ses débuts, la deco etait plus chic",Mars 2022,Commentaire envoyé le 23 mars 2022
69,Aurore,6.0,France,Agréable,il n’y a rien à dire sur le personnel très souriant et accueillant au top,la chambre pas insonorisée il n’y a pas l’équipement de la description type bouilloire la propreté n’était pas à 100% poussière dans la chambre poils au niveau sanitaire  et pour une chambre supérieur je ne vois absolument pas le plus d’une chambre standard,Mars 2022,Commentaire envoyé le 21 mars 2022
70,Marielle,8.0,France,Très bon hôtel pour un séjour à Disneyland,La proximité des parcs La propreté de l'hôtel La prise en charge rapide à l'arrivée Très bon accueil pour les petits déjeuners,La réception à l'étage quand nous arrivons du parc donc nous devons chercher lorsque nous ne connaissons pas l'hôtel Peu de pression dans la douche Le matelas un peu trop dur,Mars 2022,Commentaire envoyé le 19 mars 2022
71,Lauren,7.0,France,Bien,proximité du parc  literie confortable,"douche. Eau trop chaude ou trop froide, pas possible de régler",Mars 2022,Commentaire envoyé le 19 mars 2022
72,Mireille,8.0,France,"bon séjour mais revoir points négatifs, meubles vieillissants","l’ambiance, le personnel, les chambres spacieuses, le service","le chauffage ne fonctionnait pas, la commode tiroirs défectueux,",Mars 2022,Commentaire envoyé le 19 mars 2022
73,Marie,8.0,France,excellent séjours,magnifique hotel  superbe piscine bon accueil,petit déjeuné très chère et moyen pas assez de choix,Mars 2022,Commentaire envoyé le 14 mars 2022
74,Elodie,7.0,France,séjour agréable,l emplacement,l immensité,Mars 2022,Commentaire envoyé le 13 mars 2022
75,Marine,7.0,La Réunion,bien,sa beauté qui fait rêver,"trop type aéroport, pas assez de personnalisation avec les clients, pas assez d’écoute à la conciergerie sachant qu’avant de venir le numéro est toujours injoignable",Mars 2022,Commentaire envoyé le 12 mars 2022
76,Danitza,8.0,Belgique,Embarquez pour une croisière avec Donald,"Le cadre, la gentillesse du personnel, le petit-déjeuner.",Les lits sont petits pour deux adultes. Lit bebe = lit parapluie (prévoir un matelas de voyage en plus).,Mars 2022,Commentaire envoyé le 12 mars 2022
77,Emilie,8.0,Allemagne,Très bien,"La situation avec ma proximité du village Disney, la vue sur le lac, le confort de la literie",Le rapport qualité prix,Mars 2022,Commentaire envoyé le 11 mars 2022
78,Sarah,8.0,France,Très bon séjour,"Le personnel est très adapté et réactif. L’hôtel est joli. Les prestations sont de qualité pour le prix que l’on paye. La vue lac est sublime, je recommande fortement cet hôtel.","Les rideaux de la chambre ne sont pas du tout occultants. Il m’a été très difficile voir impossible de dormir sans le noir complet. J’ai déjà réservé un nouveau séjour en janvier et je conseille de prendre un masque de voyage pour les personnes comme moi.. je me suis endormie d’épuisement à 6h30.  L’eau de la piscine comme tous les hôtels disney mériterait d’être plus chaude. Je vous conseille de prendre votre petit déjeuner au New York, plus calme pour le même prix.",Mars 2022,Commentaire envoyé le 11 mars 2022
79,Demay,8.0,France,"Top, merci. l hôtel est très bien situé par rapport au parc. tout peut se faire à pieds","très bon séjour, tout était bien . Piscine top",les chambres un peu vétustes,Mars 2022,Commentaire envoyé le 10 mars 2022
80,Anne-laure,8.0,France,Très bien,Accueil toujours aussi agréable. Un très très grand plaisir de revenir à chaque fois dans cet hôtel 😊,Le lit inférieur n'avait pas de drap. Donc très compliqué pour dormir dedans. Le fait de voir qu'une prise électrique avait pris feu auparavant n'est pas très rassurant quand nous devons branché une machine pour la nuit.,Mars 2022,Commentaire envoyé le 9 mars 2022
81,Aurélie,8.0,France,Très bel hôtel,"Le cadre, la proximité avec le parc, le thème. Le personnel est particulièrement agréable c'est un plaisir","L'hôtel à beaucoup de qualité, toutefois le tarif est vraiment très élevé. C'est le prix à payer pour la proximité j'imagine, mais tout de même..",Mars 2022,Commentaire envoyé le 8 mars 2022
82,Sarah,8.0,France,très bien,l’ambiance et le personnel,l’emplacement de la chambre,Mars 2022,Commentaire envoyé le 8 mars 2022
83,Cyrille,8.0,France,très bien,"le lit confortable , le calme , la restauration autour","l’emplacement, le manqué d’équipement et aussi la décoration un peu vieille",Mars 2022,Commentaire envoyé le 7 mars 2022
84,Carmen,7.0,France,Bien,La prestation de l'hôtel  L'hôtel n'a pas des chambres abîmées avec des coups partout. Le confort  Le standing de cet hôtel Le bar c'est super La proximité avec le parc,"Les poils ou cheveux trouvés sur la taie d'oreiller  La salle de bain, en prenant un bain, vous voyez toutes les choses non nettoyés. Un moment de détente qui se transforme en un moment je veux Vite sortir de la....",Mars 2022,Commentaire envoyé le 7 mars 2022
