,0,1,2,3,4,5,6,7
1114,Luiz,10.0,Brésil,,"quarto amplo, localização muito boa (da para ir a pé para os parques), além da comodidade dos parques abrirem antes para hóspedes, equipe muito atenciosa.","não tem serviço de quarto de alimentação, para conseguir pedir algo tive que implorar no restaurante e me cobraram um taxa absurda para entrega no quarto.",Mars 2022,Commentaire envoyé le 1 avril 2022
1115,Nijhuis,5.0,Pays-Bas,,Kamer was netjes en schoon.,Het was voorjaars vakantie tijd en dat maakt het overal erg druk.,Mars 2022,Commentaire envoyé le 31 mars 2022
1116,Ahmed,10.0,Émirats arabes unis,,كل شي رائع,التأخير في تسليم الغرف لقد حجزت ثلاث غرف تم تسليمي غرفة في الساعة الثالثة والغرفتين بعد الساعة الخامسة ولكن كنا عائلة مع الاطفال فكل غرفة كانت في مبني مختلف وغرفة بالطابق الاول والاخرى بالدور الخامس مما يسبب مشقة كبيرة لرب الاسرة وعلى العموم شكرا واتمنى ملاحظات هذا الامر,Mars 2022,Commentaire envoyé le 30 mars 2022
1117,Nina,10.0,Allemagne,,Alles war wunderbar- nahe am Disneyland- freundliches Personal - sauber - viele Disney Details im Hotel,,Mars 2022,Commentaire envoyé le 28 mars 2022
1118,Salem,10.0,Émirats arabes unis,,قريب جداً من حديقه ديزني لاند على بعد خطوات فقط  مجرد ان تتخطى البحيره الموجوده في الصوره فقط حتى تصل,و,Mars 2022,Commentaire envoyé le 27 mars 2022
1119,Bruno,10.0,Brésil,,Tudo!!! Mais o que mais me chamou atenção são a dedicação dos funcionários,Nada!!!,Mars 2022,Commentaire envoyé le 21 mars 2022
1120,Muna,10.0,Qatar,,غرفه النوم ، والمطعم (الافطار),لم يكن هناك مساعده من طاقم الفندق ، عند وصولنا للفندق,Mars 2022,Commentaire envoyé le 21 mars 2022
1121,Bruno,10.0,Brésil,,Tudo!!! Principalmente o atendimento. Eles fazem você se sentir um Rei...,Nada!!!,Mars 2022,Commentaire envoyé le 20 mars 2022
1122,Marina,9.0,Allemagne,,"Die Lage war super, dicht an den Parks, wir hatten einen tollen Ausblick nach vorne aufs Wasser und rüber zu den Parks, hatten ein Compass Club Zimmer gebucht, sehr zu empfehlen, wenn man es sich leisten kann, toller Service, sehr nettes Personal, gute Atmosphäre, gerne wieder","Das Zimmer war etwas kalt, irgendwie funktionierte das heizen mit der Klima-Anlage nicht, ansonsten war alles top, auch da, das Personal super nett",Mars 2022,Commentaire envoyé le 19 mars 2022
1123,Ronny,10.0,Belgique,,Hotel was niets op aan te merken..integendeel 😉,Van het park viek me tegen dat veel gesloten was ...incl mijn favoriete...terwijl ze hun 30 jaar vieren ...naar mijn mening in zo één belangrijk jaar moet het park hondert percent draaien ...zeker aangezien je weet dat dit jaar belangrijk is en er aan komt Dus wel een minder gevoel gehad..zekers omdat ik er niet van op de hoogte was 😥,Mars 2022,Commentaire envoyé le 19 mars 2022
1124,Natalija,10.0,Espagne,,todo,desayuno no hay muchas cosas,Mars 2022,Commentaire envoyé le 17 mars 2022
1125,Cristina,5.0,Brésil,,Facilidade de entrar no parque,"Sem frigobar no quarto, sem facilidades para os hospedes como carregador de mala, e refeições a la cart",Mars 2022,Commentaire envoyé le 16 mars 2022
1126,Thom,9.0,Pays-Bas,,"mooi hotel, dichtbij Disneyland Parijs. Heel netjes ontvangen en heel vriendelijk personeel",,Mars 2022,Commentaire envoyé le 14 mars 2022
1127,Elisa,10.0,Belgique,,Alleen maar positieve dingen !,,Mars 2022,Commentaire envoyé le 11 mars 2022
1128,Luis,5.0,Espagne,,emplazamiento junto a Disney,"masificación, instalaciones antigüas precio desmesurado para lo que es",Mars 2022,Commentaire envoyé le 10 mars 2022
1129,Ted,5.0,Pays-Bas,,de locatie was prima,prijs/kwaliteit van het ontbijt en diner waren alles behalve in verhouding,Mars 2022,Commentaire envoyé le 9 mars 2022
1130,Deweer,4.0,Belgique,,"Zeer ouwbollig, nood aan verfrissing, ontbijt 120 euro voor 3 volw en 2 kids en is in een zeeeeer trieste donkere ruimte en ook maar een matig ontbijt. S’avonds moet je reserveren in het resto v h hotel. Wij waren hiervan niet op de hoogte met als gevolg dat wij moesten smeken om nog te kunnen eten, openbare toiletten waren ook niet zo proper","Prijs kwaliteit, te ouwbollig, nood aan verfrissing, nachtje Disney is gewoon bijna niet meer betaalbaar en dan verwacht je dan toch dat het in orde zou moeten zijn",Mars 2022,Commentaire envoyé le 4 mars 2022
1131,Meike,3.0,Pays-Bas,,Prima ontbijt.,Bij aankomst inchecken en ook boeken voor restaurant lastig  Kamer heel ver weg.,Mars 2022,Commentaire envoyé le 3 mars 2022
1132,Steffi,10.0,Belgique,,Wat een prachtig hotel! Op wandelafstand van het park! Heel vriendelijk personeel en prachtige kamers! Alles tip top in orde!,Ik heb hier echt niets die me tegenviel!,Mars 2022,Commentaire envoyé le 3 mars 2022
1133,Ming,4.0,Espagne,,距离乐园很近，比较方便,设施陈旧，中央空调在这种0度夜晚坏了，开关也掉了，吹着冷风，找的工作人员，他们送了一台电暖风，这是四星酒店吗？有点滑稽！维修人员来了只是把开关按上就走了，上面吹着冷风下面吹着热风，已经凌晨一点了也只能将就一夜了，无奈，失望,Mars 2022,Commentaire envoyé le 2 mars 2022
1134,Marc,3.0,Allemagne,,Alle sehr freundlich.  Lage war gut,Vollkommen überzogene Preise für ein abgeranztes Hotel,Février 2022,Commentaire envoyé le 1 mars 2022
1135,Abdulaziz,9.0,Arabie saoudite,,الموقع مميز والاطلاله من الغرف على البحيره جداً جميله والفطور متكامل وطاقم العمل في الفندق متعاون جداً 👌🏾,لايوجد خدمه للغرف. وينصح بالحجز لمطعم العشاء من بدري لانه بيكون زحمه جدا في الليل.,Février 2022,Commentaire envoyé le 25 février 2022
1136,Madeleine,9.0,Allemagne,,Sehr schöne Zimmer- allerdings ist das Hotel sehr sehr groß und man verliert sich schnell.,,Janvier 2022,Commentaire envoyé le 22 février 2022
1137,Stephanie,4.0,Pays-Bas,,"De locatie is prima, personeel super vriendelijk, leuk dat je Disneyfiguren kan ontmoeten, zwembad was groot, mooi gebouw.","Prijs is totaal niet in verhouding voor wat je krijgt; erg kleine kamer en in de zeer eenvoudige badkamer alleen wat flesjes shampoo (geen douchegel, conditioner of bodylotion), geen vergrootspiegel of iets van luxe wat je in een 4-sterren hotel mag verwachten. De kamer was veel te warm; temperatuur was niet te regelen en raam kon nauwelijks open. Het was ook niet super schoon. Ontbijt is schandalig duur.   Maar goed, het is van Disney dus ze kunnen vragen wat ze willen want de mensen gaan er toch wel slapen en eten.",Février 2022,Commentaire envoyé le 21 février 2022
1138,Jens,10.0,Belgique,,allles,niks,Février 2022,Commentaire envoyé le 19 février 2022
1139,Osman,3.0,Allemagne,,Sicherheit in höchster Stufe,zu teuer für zu wenig Service.,Février 2022,Commentaire envoyé le 11 février 2022
1140,Julia,9.0,Roumanie,,Amplasare foarte ok,,Février 2022,Commentaire envoyé le 11 février 2022
1141,Inês,10.0,Royaume-Uni,,"Os funcionários foram super prestáveis quando expliquei que iria ter com alguns familiares também hospedados no hotel, logo se prontificaram a colocar-me no quarto mais próximo possivel. Muito simpáticos e dispostos a ajudar com tudo. Quarto limpo e espaçoso. Hotel muito bonito no seu interior e comida excelente.",,Février 2022,Commentaire envoyé le 9 février 2022
1142,Cahevil,5.0,Espagne,,La cercanía y el acceso al parque,"La ubicación de la habitación. Para llegar a ella habia que recorrer 3 pasillos de 100 mts. Un hotel excesivamente grande. Tampoco son buenos los servicios del hotel, bares, restaurantes. Esta todo enfocado a consumir en el parque. Es un negocio redondo.",Janvier 2022,Commentaire envoyé le 31 janvier 2022
1143,Jose,9.0,Espagne,,"Nos atendió una chica valenciana que nos trató genial, como todo el personal. Habitación cómoda y perfecta para descansar.",,Janvier 2022,Commentaire envoyé le 29 janvier 2022
1144,Angelica,10.0,Colombie,,el lugar es perfecto para visitar los parqueS,Todo es perfecto,Janvier 2022,Commentaire envoyé le 20 janvier 2022
1145,Nuria,10.0,Espagne,,Me pareció un poco caro el buffet y los precios de los restaurantes,La carta de platillos del restaurante,Janvier 2022,Commentaire envoyé le 17 janvier 2022
1146,Carlos,10.0,Espagne,,La decoración y es muy amplia,Es algo cara,Janvier 2022,Commentaire envoyé le 14 janvier 2022
1147,Lynn,9.0,Pays-Bas,,"keurig nette kamer met balkon, koffie- en thee faciliteiten en dagelijks flessen water.",de douche-in-bad gaf weinig water en schommelde veel in temperatuur.,Janvier 2022,Commentaire envoyé le 9 janvier 2022
1148,Andreas,2.0,Allemagne,,Foyer und Lage,"Qualität vom Frühstück war für den Preis miserabel, einfach extrem teuer und die totale Abzocke, Silvesterfeuerwerk wurde einfach abgesagt und man hat es nicht geschafft die eigenen Hotelgäste darüber zu informieren. Insgesamt sind wir sehr enttäuscht sowie viele andere Gäste auch. Über 1000 Euro ausgegeben für 2 Nächte in einem mittelmäßigem Hotel mit schlechtem Essen. Ein Abfluss im Bad war verstopft und wir hatten Schwarzschimmel in den Fugen. Wände sind sehr dünn und man wird mehrmals pro Nacht durch die Nachbarn geweckt. Ein wirklich toller Aufenthalt... Der Hotelmanager sollte sich schämen.",Janvier 2022,Commentaire envoyé le 5 janvier 2022
1149,Zhihong,1.0,Allemagne,,因为法国的疫情，我们提前一天向酒店和booking都提出变更住宿时间，然后就是酒店和booking互相扯皮各种推托，一直到过了我们入住和退房时间才来说不能变更时间。知道恶劣，不知道有如此恶劣的行径！现在算是领教了！,,Janvier 2022,Commentaire envoyé le 4 janvier 2022
1150,Demetrio,5.0,Italie,,la posizione,albergo americano di grande confusione e caos. prezzo - pure se a disneyland - fuori da ogni logica,Janvier 2022,Commentaire envoyé le 2 janvier 2022
1151,Γεωργιοσ,4.0,Grèce,,η τοποθεσια ειναι καταπληκτικη. πολυ κοντα στο παρκο. πολυ ομορφη θεα.,"το δωματιο δεν ηταν αυτο που κλεισαμε. ειχαμε πληρωσει για θεα στη λιμνη και το δωματιο εβλεπε σε ενα παρκινγκ!. οι παροχες του δωματιου ηταν ανυπαρκτες. ουτε μινι μπαρ ,ουτε καν ενας βραστηρας να πιεις εναν καφε. στο εστιατοριο μυριζε πολυ εντονα η κουζινα με αποτελεσμα να μυρισουν τα ρουχα μας!",Décembre 2021,Commentaire envoyé le 30 décembre 2021
1152,Charalampos,3.0,Grèce,,τοποθεσία,Δεν είχε ψυγείο,Décembre 2021,Commentaire envoyé le 28 décembre 2021
1153,Pietro,5.0,Italie,,lo stile,nessuno o pochissimi parlano italiano molto difficile la comunicazione nei ristoranti e con il personale,Décembre 2021,Commentaire envoyé le 26 décembre 2021
1154,Klaus,3.0,Allemagne,,Die Parks waren o.k. allerdings kein Vergleich zu DisneyWorld in Orlando.,"Wir wollten unbedingt einmal in einem Disneyhotel übernachten und uns etwas Gutes tun. Wir hatten ein Zimmer mit Seeblick gebucht (eine Nacht: 341€!!!). Da darf man schon einmal etwas erwarten! Es befand sich im Erdgeschoss und seitlich vom See. Der See war kaum zu sehen, ein anderes Zimmer war abends um 17:00 angeblich noch nicht sauber. Die Empfangshalle hatte eine Akustik wie in einer Turnhalle. Das Hotel war absolut nichts besonderes. Im Vergleich zu anderen Hotels würde ich nicht mehr als 100€ ausgeben. Wir können nur von diesem enttäuschenden Hotel abraten.",Octobre 2021,Commentaire envoyé le 17 décembre 2021
1155,P,4.0,Émirats arabes unis,,Die Lage war gut - der Rest war brutal schlecht !,"Im Vorfeld wurde eMails nur mit Standardantworten returniert. Telefonische Kontaktaufnahme war deutschsprachig nicht möglich.. Für die Menge der Gäste die täglich Einschecken viel zu wenig Personal - Langes Schlange stehen zum Einchecken. Nach dem Check-In darf das Zimmer erst um 15:00 bezogen werden, was nach langer Anreise eine Zumutung ist. Von 7 Zimmern wurde nicht einmal eines zur Verfügung gestellt um sich Umzuziehen. Tischreservierungen waren im Vorfeld unmöglich. Die Internetseite verweist auf die App - die App lässt nur Buchungen für bis zu 10 Personen zu ! Rundum grotten Schlecht.",Décembre 2021,Commentaire envoyé le 12 décembre 2021
1156,Henk,10.0,Pays-Bas,,De gastvrijheid van het personeel,Alles was naar wens,Décembre 2021,Commentaire envoyé le 10 décembre 2021
1157,Angela,10.0,Italie,,"posizione,attenzione dal personale, struttura",,Décembre 2021,Commentaire envoyé le 10 décembre 2021
1158,Christian,5.0,Allemagne,,"+ schönes Hotel, + sauberes Zimmer, sauberes Bad, + Parks in Laufweite (ca. 20 Minuten), + schöne Poollandschaft, + tolles Ambiente / Theming,","- Unfreundliches Personal beim Check in - Security Personal extrem unfreundlich - Trotz Reservierung im Restaurant bis zur Schließung keinen Platz erhalten (Cape Cod); Restaurant völlig Überbucht - Service insgesamt mangelhaft, Personal nicht kundenorientiert - Baustelle auf dem Fußweg zu den Parks nicht vorab angekündigt, daher ca. 10 Minuten längerer Fußweg - tägliche coronaunkonforme Pulkbildung am Eingang, weil das Personal die Schlange ins Restaurant nicht in den Griff bekommt. - insgesamt: 500 Euro pro Nacht nicht gerechtfertigt, da das Hotel zwar schön ist, aber der Service extrem zu wünschen übrig lässt",Novembre 2021,Commentaire envoyé le 3 décembre 2021
1159,Antonio,5.0,Italie,,l’accoglienza,"pulizia camera scadente, cameriere molto scortesi, troppo lontano da Disneyland, ridicolo che non hanno club Sandwich e cheeseburger nel room service, non hanno adattatori per prese elettriche.",Novembre 2021,Commentaire envoyé le 25 novembre 2021
1160,Cristina,10.0,Espagne,,"el Trato con todo el personal , te hacen sentir unico y que estan solo para hacerte pasar una estància única",nada,Novembre 2021,Commentaire envoyé le 25 novembre 2021
1161,Maria,2.0,Russie,,Ничего!,"Цена и качество этого отеля не просто не совпадают,  вы за эти деньги можете снять замок по соседству! Номера старые, маленькие. Не видитесь на то что он на территории диснейленда, он ужасен!  Один раз сходили в ресторан при отеле - это столовая с уэасным персоналом! Заплатили при этом как за молекулярную кухню. Касаемо персонала- естественно все зависит от человека и нельзя сказать что абсолютно все там были не приветливы.  Но женщина, которая отказалась давать нам коннектед румс, когда мы были с 3мя детьми и в брони было указано это пожелание - работает у них на ресепшн и видимо для данного отеля это норма.",Septembre 2021,Commentaire envoyé le 23 novembre 2021
1162,Abdallah,5.0,Arabie saoudite,,,الخدمه سيئه جدا لايجدون التحدث انقليزي و خدمه المطعم للغرف سيى و صعبه,Novembre 2021,Commentaire envoyé le 19 novembre 2021
1163,Carlo,3.0,Italie,,solo le persone dell team,non vale la cifra spesa. struttura vecchia al interno delle camere posizione arredamento datato,Novembre 2021,Commentaire envoyé le 17 novembre 2021
1164,Leo,4.0,Belgique,,het weer,"het eten , als je toekomt om 19 u de eerste dag en te horen krijgt dat je pas om 22 u kan eten....met kinderen een drama!",Novembre 2021,Commentaire envoyé le 16 novembre 2021
1165,Federica,10.0,Italie,,tutto,,Novembre 2021,Commentaire envoyé le 14 novembre 2021
1166,Daniel,4.0,Allemagne,,Alles etwas alt und renovierungsbedürftig.,"Altes Bad, sehr teure Getränke und Essen.",Novembre 2021,Commentaire envoyé le 10 novembre 2021
1167,Natasha,9.0,Pays-Bas,,De sfeer,Onduidelijkheid mbt qr code voor café,Octobre 2021,Commentaire envoyé le 7 novembre 2021
1168,Adi,10.0,Israël,,"מיקום 10 דק הליכה מהפארק , מלון ענק ויפיפיה בתוכו חנות דיסני משגעת",המלון ענק וצריך לקחת בחשבון שיש מרחק מהמעלית לחדרים,Octobre 2021,Commentaire envoyé le 29 octobre 2021
1169,Tuan,1.0,Pays-Bas,,Locatie,"Kregen de verkeerde kamer, daarnaast waren de kamers niet klaar bij aankomst door personeelstekort in de schoonmaak.",Octobre 2021,Commentaire envoyé le 26 octobre 2021
1170,Irenci,1.0,Pays-Bas,,Hiç bir şeyi,"Resmen aç kaldık, herşeyde sıra var , o otel orda ne için anlamış değilim, bu kadar paraya hiç bir hizmet yok , odaya içme suyunu bile zor getirdik. Maskesiz girilmez deniyor , otelin elinde bir tane yedek maske yok. Otel önünde sürekli protesto vardı . Yani hayatım da bu kadar kötü bir otel daha göreceğimi düşünmüyorum, sadece disneyland a yakın diye tercih edilir.",Octobre 2021,Commentaire envoyé le 23 octobre 2021
1171,Dan,10.0,Chine,,很完美！！,,Octobre 2021,Commentaire envoyé le 22 octobre 2021
1172,Suhail,5.0,Émirats arabes unis,,المكان جميل جداً و المواصلات الى ديزني متوفره.,تكييف الغرفه و لا يوجد اي مطعم غير مطعم واحد بنظام البوفيه ولا يتاسب جميع الفئات,Septembre 2021,Commentaire envoyé le 20 octobre 2021
1173,Delgado,10.0,Espagne,,No desayuno,Nada,Octobre 2021,Commentaire envoyé le 19 octobre 2021
1174,Victoria,1.0,France,,Ничего (к сожалению),"Самое худший отель, в котором довелось побывать. Соотношение цены-качество =0.  Грязно, шумно, никакой «магии Диснея», поужинать невозможно, на этаже пахнет тошнотой. Завтрак заказать невозможно, в номере не прибираются, а только приносят письмо, что совершить уборку не получилось из-за непредвиденных обстоятельств. Серьезно??? Постоянная очередь в лифт, очень длинные коридоры (15 мин, чтобы спуститься Яна ресепшен). В номере сожжённый утюг, нет даже бутылки воды (про кофе или чай я молчу), нет холодильника/минибара. Вода в душе либо холодная либо кипяток. На унитазе пятна тошноты. Хуже быть не может. Тем более за почти 400 евро/ночь. Детскую кроватку не предоставили. Очереди везде : пройти в парк до открытия не получилось (очереди на контроле), трансфер до парка не существует (только если вы хотели ждать 2 часа). Если едете в Дисней, остановитесь в любом другом отеле рядом (не Дисней), будет приятней. Я бы сказала, что это катастрофа.",Octobre 2021,Commentaire envoyé le 18 octobre 2021
1175,Salvatore,4.2,Italie,,La struttura molto carina,"Personale maleducato , struttura molto sporca. Mentre soggiornavamo c’erano i lavoratori dello stesso hotel che manifestavano dalle 8 di mattina . Pessimo hotel",Octobre 2021,Commentaire envoyé le 17 octobre 2021
1176,Giovanni,5.0,Italie,,,Ristoranti affollati e troppo cari rispetto al servizio,Octobre 2021,Commentaire envoyé le 17 octobre 2021
1177,Lawrence,2.0,Allemagne,,Die Optik des Hotels.,"So ziemlich alles. Sinnlose Sicherheitskontrollen, die man über Hintereingänge easy umgehen kann. Check-In hat vorne und hinten nicht funktioniert. Wir kamen Mittags an und mussten für den Check-In ne halbe Stunde anstehen und das Zimmer war noch nicht fertig. Es hieß man könne das Gepäck abgeben und man würde eine SMS mit der Zimmernummer erhalten, sobald dieses fertig sei (Zimmerkarten gab es sofort, aber ohne Programmierung). Eine solche SMS kam weder bei uns, noch bei anderen an. Wir mussten uns also am Abend erneut zum Check-In anstellen, wobei die Schlange noch länger als Mittags war. Als wir endlich das zweite mal am Schalter waren, mussten wir an diesem noch immer 15min warten bis uns endlich ein Zimmer gegeben werden konnte. Als ich dann nach dem Gepäck fragte, verschwand die Dame an der Rezeption erneut im Hinterzimmer um den Verbleib des Gepäcks herauszufinden. Das wurde mir dann einfach in der Lobby gebracht und ich konnte alles selbst ins Zimmer bringen. Ich war jedoch froh, dass ich meinen zweiten Check-In am frühen Abend machte, denn nach Schließung des Parks bildete sich eine endlose Schlange in der Lobby, die Wartezeiten von 3 Stunden und vielleicht mehr aufwies.  Um ca. 23 Uhr waren dann sämtliche Korridore überfüllt mit Menschen, die kein Zimmer bekommen haben und auf dem Boden saßen oder sogar lagen (und das bei den Zimmerpreisen). Das Zimmer selbst war ok, aber für den Preis dennoch nicht angemessen. Insgesamt war auch zu wenig Disneyfeeling.",Octobre 2021,Commentaire envoyé le 12 octobre 2021
1178,Piet,5.0,Pays-Bas,,,Kamer zijn Verouderd .zeer slechte bedden,Octobre 2021,Commentaire envoyé le 8 octobre 2021
1179,Veronique,9.0,Pays-Bas,,Vlakbij het park. Prachtig gerenoveerd,Nog niet alles was open,Septembre 2021,Commentaire envoyé le 29 septembre 2021
1180,Ashley,9.0,Pays-Bas,,Zeer vriendelijk personeel!,,Septembre 2021,Commentaire envoyé le 25 septembre 2021
1181,Svetlana,4.0,Espagne,,el personal muy amable,solo hay 4 ascensores un lado y si te toca al otro lado te toca andar 5 min como poco,Septembre 2021,Commentaire envoyé le 24 septembre 2021
1182,Magdalena,10.0,Pologne,,"gorąco polecam, idealnie usytuowane miejsce.  obsługa, czystość, jakość",,Septembre 2021,Commentaire envoyé le 24 septembre 2021
1183,Silviu,9.0,Allemagne,,Totul satisfacator.,Camera foarte departe in hotel cam 300 de metri de mers.La receptie mi-au zis ca am un avantaj in parcul de distractii cu cardurile magic dar nu am avut nimic.,Septembre 2021,Commentaire envoyé le 21 septembre 2021
1184,Beno,4.0,Suisse,,Viel zu teuer.Kein mineral wasser im zimmer kein kaffe zum selber machen für 300 euro pro Nacht. Totaler abriess nur geld macherei!!!!!!!,Die lage.,Septembre 2021,Commentaire envoyé le 16 septembre 2021
1185,Markus,5.0,Allemagne,,"Lage war super, weniger als 10 min. bis zum Disneyland. Personal war immer sehr freundlich. Parkplätze waren direkt vor der Tür und ausreichend vorhanden.","Frühstück für 2 Erwachsene und zwei Kinder über 100 € völlig überteuert und zudem qualitativ nicht gut. Zimmer sauber, haben aber schon bessere Zeiten gesehen. Außerdem sehr klein. Wenn man in den Pool will hat man eher das Gefühl in ein öffentliches Schwimmbad zu kommen. Vorbei an der Handtuchausgabe zu den Umkleiden und Schließfächern geht es dann in die Gemeinschaftdusche. Auf dem Weg zum Schwimmbecken ist dann noch ein schon fast etwas ekliges Fußbad zu durchqueren. Leider war abends auch der Außenbereich gesperrt, so dass es wirklich sehr beengt zuging.",Septembre 2021,Commentaire envoyé le 5 septembre 2021
1186,Yvonne,5.0,Espagne,,Ubicación y camas,Hotel con instalaciones pobres para el precio que tiene. Antiguo. No hay zonas comunes agradables,Septembre 2021,Commentaire envoyé le 4 septembre 2021
1187,Joannis,10.0,Allemagne,,Die Lage und die Ausstattung,Teures Frühstück,Septembre 2021,Commentaire envoyé le 1 septembre 2021
1188,Daniel,9.0,Pays-Bas,,Zeer mooie kamers.,,Août 2021,Commentaire envoyé le 31 août 2021
1189,Natalia,4.0,Espagne,,Близкое расположение к Дисней парку.   Чисто в номерах.,"Ощущение,что находишься в детской тюрьме.  каждое передвижение  в отели нужно регистрировать,  в ресторан не пройти,без предварительной записи за сутки,еду в номер заказать нельзя,рядом ресторанов нету.  Оформить  регистрацию  в отели займет не мало времени и нервов. Любой вопрос,что мы пытались решить на ресепшене  занимал минимум 40 минут. Воды в номерах нету,если заказать ждать,тоже в где -то минут 40-60.  Явно Чувствуется, что персонал  работающий в отели устал.",Août 2021,Commentaire envoyé le 31 août 2021
1190,Reiner,4.0,Allemagne,,Das Personal war sehr freundlich.,"Im Zimmer lag Müll, ein Vorhang war auf einem Stück nicht befestigt. !!!!!! In der Toilette gab es keine Toilettenbürste und der Kot vom vorherigen Bewohner war noch in der Toilette !!!!! !!!!!!!   sehr ekelhaft    !!!!!!!! Alles ist sehr überteuert !!!",Août 2021,Commentaire envoyé le 30 août 2021
