,Prenom,Note,Pays,Titre,Positif,Négatif,Date séjour,Date commentaire
397,Stéphanie,5.0,France,Passable,"Le personnel est toujours très agréable, accueillant Les navettes sont pratiques et en cette saison, elles ne sont pas trop bondées",,Mars 2022,Commentaire envoyé le 27 mars 2022
398,Flicce,5.0,France,Passable mais sale,"La décoration extérieure, l'emplacement",,Mars 2022,Commentaire envoyé le 26 mars 2022
399,B,10.0,,Exceptionnel,Propre et tres bonne literie.,,Mars 2022,Commentaire envoyé le 26 mars 2022
400,Nathanael,5.0,France,impression de mise à l’écart par rapport à disney suite réservation sur booking,la proximité au parc disneyland et le thème cars,,Mars 2022,Commentaire envoyé le 26 mars 2022
401,Audrey,10.0,France,un séjour magique,tout ! un personnel au top de la topitude !,,Mars 2022,Commentaire envoyé le 24 mars 2022
402,Anais,6.0,France,Sympa sans plus,"Manque d insonorisation nous entendions tout de la chambre d'à côté.  Les peintures vétustes,  abîmés à certains endroits. Moisissure dans la salle de bain. Les communs auraient besoin d un peu de rafraîchissement. Même pas d'équipements tel un mini frigo ou encore une bouilloire. La déco pourrait être un peu plus fournie voire rafraîchie. Pour quasi 400euros les 2 nuits je trouve cela un peu limite",,Mars 2022,Commentaire envoyé le 24 mars 2022
403,Arthur,6.0,France,Demi-magie Disney pour 50% plus cher qu'ailleurs.,La proximité avec les parcs Disneyland.,,Mars 2022,Commentaire envoyé le 24 mars 2022
404,Coumba,6.0,France,Agréable,Propreté,,Mars 2022,Commentaire envoyé le 24 mars 2022
405,Noëllie,10.0,France,Mon séjour était au top.,L'accueil est toujours au top. Les chambres sont calmes. L'ambiance de cet hôtel est chaleureux et le personnel est formidable. Tout était super.,,Mars 2022,Commentaire envoyé le 24 mars 2022
406,François,3.0,France,Très  déçu  rapport qualité  prix ..,La literie au top et les navettes pour se rendre aux parcs appréciables.,,Mars 2022,Commentaire envoyé le 23 mars 2022
407,Jeremy,10.0,Belgique,Bel univers Cars,Belle décoration thématique,,Mars 2022,Commentaire envoyé le 23 mars 2022
408,Julien,10.0,France,Exceptionnel,super hôtel ! j’y vais depuis des années. Bon rapport qualité/prix,,Mars 2022,Commentaire envoyé le 23 mars 2022
409,Warembourg,10.0,France,Exceptionnel,Tout,,Mars 2022,Commentaire envoyé le 23 mars 2022
410,Loic,10.0,France,Moyen mais correct,L’emplacement et le service du personnel,,Mars 2022,Commentaire envoyé le 20 mars 2022
411,Laura,2.0,France,Médiocre,Rien,,Mars 2022,Commentaire envoyé le 16 mars 2022
412,Marceline,10.0,France,Exceptionnel,Tout,,Mars 2022,Commentaire envoyé le 15 mars 2022
413,Stephanie,10.0,Belgique,Exceptionnel,Navette toutes les 10 min  La propreté des chambres,,Décembre 2021,Commentaire envoyé le 14 mars 2022
414,Elodie,10.0,France,Exceptionnel,L'emplacement Le personnel très agréable,,Mars 2022,Commentaire envoyé le 14 mars 2022
415,Thomas,10.0,France,Exceptionnel,manque de prise à côté des lits,,Mars 2022,Commentaire envoyé le 14 mars 2022
416,Gil,5.0,France,"Très bien accueilli, bien dormi, mais un certain nombre de défauts ne correspondent pas à ""la magie""",accueil du personnel réception et La Cantina : TB,,Mars 2022,Commentaire envoyé le 13 mars 2022
417,Céline,10.0,France,Exceptionnel,Tout,,Mars 2022,Commentaire envoyé le 12 mars 2022
418,Ludivine,10.0,France,magique,l accueil et le lieu ainsi que le personnel de Disney,,Mars 2022,Commentaire envoyé le 9 mars 2022
419,Stephanie,5.0,France,Passable,Rien,,Mars 2022,Commentaire envoyé le 9 mars 2022
420,Gabrielle,4.0,France,Je ne recommande pas cet hôtel,Le choix dans le petit déjeuner,,Mars 2022,Commentaire envoyé le 8 mars 2022
421,Guy,5.0,France,dessus du séjour,le petit déjeuner,,Mars 2022,Commentaire envoyé le 8 mars 2022
422,Audrey,10.0,France,Exceptionnel,"Nous avons beaucoup apprécié l'accueil,les services,la magie Disney !",,Mars 2022,Commentaire envoyé le 8 mars 2022
423,Lydia,10.0,Belgique,très bonne impression en général du séjour,"la proximité du Parc Disneyland, la navette pour le Parc, le grand parking, le personnel très aimable",,Mars 2022,Commentaire envoyé le 7 mars 2022
424,Christelle,10.0,France,Exceptionnel,Personnel très accueillant et à l’écoute,,Mars 2022,Commentaire envoyé le 6 mars 2022
425,Baptiste,10.0,France,"fabuleux, magnifique cadre et personnelle plus que agréable.",le décor nous a directement plonger dans le film Cars,,Février 2022,Commentaire envoyé le 4 mars 2022
426,Agnès,10.0,France,un séjour merveilleux,génial comme d’habitude,,Mars 2022,Commentaire envoyé le 4 mars 2022
427,Valérie,10.0,Belgique,tout était parfait du début à la fin,parfait à recommender,,Février 2022,Commentaire envoyé le 3 mars 2022
428,Valérie,10.0,Belgique,A recommander vivement bon rapport qualité  prix,"tout était parfait l'accueil, la chambre, le personnel.",,Mars 2022,Commentaire envoyé le 3 mars 2022
429,Gwen,2.0,France,"Parcs et personnel au top , Hôtel décevant",le personnel est très agréable,,Février 2022,Commentaire envoyé le 28 février 2022
430,Emily,1.0,France,Mauvais,Rien,,Janvier 2022,Commentaire envoyé le 24 février 2022
431,Oliv,10.0,La Réunion,a refaire,top,,Février 2022,Commentaire envoyé le 24 février 2022
432,Guillaume,4.0,France,Pas à la hauteur de nos espérances et du prix payé.,Accueil du personnel.  Petit-déjeuner.,,Février 2022,Commentaire envoyé le 22 février 2022
433,Catherine,5.0,France,pour un hotel disney (et donc pour le prix ! ) hôtel limite ! à utiliser pour une nuit pas plus !,"navette régulière (toutes les 12 min)  pour accéder au parc Disney et à la gare TGV sont très appréciables, surtout qu'elle débute très tôt le matin  personnages Disney dans l'hôtel pour faire rêver les enfants le temps de quelques photos",,Février 2022,Commentaire envoyé le 22 février 2022
434,Jérémy,5.0,France,Passable,Le restaurant cher et pas très bon,,Janvier 2022,Commentaire envoyé le 20 février 2022
435,Morgane,10.0,France,Exceptionnel,Personnel accueillant et très sympathique La decoration de la chambre!!!,,Février 2022,Commentaire envoyé le 18 février 2022
436,Claire,5.0,France,très déçu par rapport au qualité/prix,la thématique Cars parfaite pour les enfants,,Février 2022,Commentaire envoyé le 17 février 2022
437,Sophie,6.0,France,Agréable,La personne a la bagagerie très peu aimable et qui impose de revenir dès le sms avec le numéro de chambre.. Dommage mais mal tombé !!,,Février 2022,Commentaire envoyé le 16 février 2022
438,Mihaela,10.0,France,Exceptionnel,"Très proche du parc Disneyland, 10 min à pied.",,Février 2022,Commentaire envoyé le 15 février 2022
439,Chadeau,10.0,France,Sympa et convivial,L'accueil très chaleureux de la personne a notre arrivée. Et le calme des chambres.,,Février 2022,Commentaire envoyé le 11 février 2022
440,Nadera,6.0,France,Agréable pour une petite famille,Nous avions apprécié le fait de nous proposé des chambres adjacentes!!,,Février 2022,Commentaire envoyé le 10 février 2022
441,Anne,10.0,France,"Super ambiance et nuit reposante, après un très bon repas.","Super calme, déco sympa, chambre super propre. Navette très pratique pour rejoindre le parc mais vite surchargée aux heures de pointes évidemment, rejoindre le parc à pieds est complément faisable et très agréable, même après une journée bien chargée :) Buffet le soir très bon, bien fourni même quand on arrive tard. La viande était très bonne, et le choix des légumes très satisfaisant. Mention spéciale pour le guacamole et les nachos :):)",,Février 2022,Commentaire envoyé le 10 février 2022
442,Planque,4.0,France,Décevant,L'emplacement,,Février 2022,Commentaire envoyé le 9 février 2022
443,Joan,6.0,France,Agréable,les lits supersposés,,Février 2022,Commentaire envoyé le 9 février 2022
444,Ludovic,6.0,Belgique,déçu,"l’accueil du personnel a la réception, sinon a la bagagerie zero, et au petit déjeuner une première pour nous et personne nous explique comment sa ce passe ou sa se trouve.",,Février 2022,Commentaire envoyé le 9 février 2022
445,Mohamed,1.0,France,une catastrophe,absolument rien,,Février 2022,Commentaire envoyé le 8 février 2022
446,Adeline,10.0,France,un séjour dépaysant dans le monde de cars,"La proximité du parc, la thematisation excellente, l’accueil des Cast excellent",,Février 2022,Commentaire envoyé le 7 février 2022
447,Antoine,10.0,France,très bien,"Décoration, accueil, propreté",,Février 2022,Commentaire envoyé le 7 février 2022
448,Sonia,10.0,France,Dépaysement garanti,"Très bon rapport qualité prix. Accueil très souriant à la réception et au restaurant, présence non négligeable de personnages à l'accueil pour mes photos et d'une boutique sur place. Histoire d'éviter la cohue. Nous Avons eu un magic pass pour les heures de magie en plus au parc alors que nous avions réservé la chambre sèche. Hôtel à dimension humaine avec super décor sur thème route 66 et western,comme toujours lits très confortables. Navette pour l'hôtel.",,Février 2022,Commentaire envoyé le 7 février 2022
449,Anais,5.0,France,Le manque de professionnalisme de booking,La persévérance du personnel de l'hôtel à trouver une solution a notre problème de réservation causé par booking,,Février 2022,Commentaire envoyé le 6 février 2022
450,Camille,10.0,France,exceptionnel,"accueil au top, et immersion dès notre arrivée dans la magie de disney",,Janvier 2022,Commentaire envoyé le 2 février 2022
451,Moreau,10.0,France,Exceptionnel,Les tarifs,,Janvier 2022,Commentaire envoyé le 30 janvier 2022
452,Sebastien,10.0,France,Top,Tout,,Janvier 2022,Commentaire envoyé le 26 janvier 2022
453,Sylvain,10.0,France,fantastique,ambiance disney,,Janvier 2022,Commentaire envoyé le 26 janvier 2022
454,Valentine,5.0,France,Pratique mais décevant.,"La proximité avec le parc, le personnel et l’accueil",,Janvier 2022,Commentaire envoyé le 23 janvier 2022
455,François,10.0,France,"très bon séjour , avec un prix assez élevé","propreté , emplacement , univers disney",,Décembre 2021,Commentaire envoyé le 21 janvier 2022
456,Diforti,6.0,Belgique,Agréable,très facile pour séjourner un jour de plus à Disney,,Janvier 2022,Commentaire envoyé le 17 janvier 2022
457,Richardlr,4.0,France,Très déçu de cette première expérience chez Disney,accueil check in efficace et personnel très accueillant extérieur de l'hôtel plutôt agréable à proximité du parc (à pied 15 minutes/10min par une jolie promenade),,Janvier 2022,Commentaire envoyé le 16 janvier 2022
458,Clémentine,10.0,France,merveilleux séjour,proximité avec le parc immersion dans le monde disney  propreté  boisson à volonté  accès au parc plus tôt,,Janvier 2022,Commentaire envoyé le 14 janvier 2022
459,Flavie,10.0,France,trop cool !,tout !,,Janvier 2022,Commentaire envoyé le 12 janvier 2022
460,Laetitia,4.0,France,Séjour bof,Proximité avec le parc,,Janvier 2022,Commentaire envoyé le 11 janvier 2022
461,Alison,5.0,Belgique,Magie hors de prix,"Proximité des parcs de  Disney, l'ambiance et les décors méxicain et de Cars, Starbucks dans la structure, personnages présents en soirée. Avec le Magic Pass, café offert aux distributeurs avec un quota de crédit par jour.",,Janvier 2022,Commentaire envoyé le 11 janvier 2022
462,Céline,6.0,France,séjour agréable,"hôtel bien placé par rapport au parc,  personnel très agréable",,Janvier 2022,Commentaire envoyé le 9 janvier 2022
463,Kathelyne,5.0,Belgique,"le séjour aurait pu être mieux, pas de chauffage dans la chambre, bcp de bruit des voisins , accueil très bien c est le",le cadre,,Janvier 2022,Commentaire envoyé le 9 janvier 2022
464,Karine,10.0,France,tout était parfait,la proximité du parc et accès au parc plus tôt,,Janvier 2022,Commentaire envoyé le 8 janvier 2022
465,Gerardo,10.0,Belgique,super,"la nourriture, l’emplacement",,Janvier 2022,Commentaire envoyé le 8 janvier 2022
466,Sébastien,10.0,France,Exceptionnel,La thématisation de l'hôtel immersion complète et de nuit super beau ',,Janvier 2022,Commentaire envoyé le 8 janvier 2022
467,Lebreton,10.0,France,Exceptionnel,"Le personnel est très sympathique et accueillant. La chambre très propre. Le cadre est très immersif, parfait pour une nuit avant une journée à DisneyLand.",,Janvier 2022,Commentaire envoyé le 7 janvier 2022
468,Elodie,10.0,France,Dépaysement garanti,"Calme, propre et dépaysant",,Janvier 2022,Commentaire envoyé le 5 janvier 2022
469,Axel,1.0,France,Mauvais,suite à un cas Covid 19 la veille du départ l’établissement n’a pas voulu nous reporter les date et à donc encaissé la somme,,Janvier 2022,Commentaire envoyé le 5 janvier 2022
470,Clément,3.0,France,Décevant,Le restaurant et le personnels,,Janvier 2022,Commentaire envoyé le 5 janvier 2022
471,Lorette,4.0,France,Une mauvaise coordination entre la réservation sur Booking et les informations de l'hôtel,La proximité du parc,,Janvier 2022,Commentaire envoyé le 5 janvier 2022
472,Cassandra,2.0,Belgique,Très déçue,Je n'ai que des inconvénients.,,Janvier 2022,Commentaire envoyé le 1 janvier 2022
473,Véronique,4.0,France,Trop cher pour un aspect aussi bas de gamme.,Le calme de la chambre.,,Décembre 2021,Commentaire envoyé le 1 janvier 2022
474,Mimie0708,10.0,France,Exceptionnel,"Excellent séjour. Cast members au top, propreté de la chambre, déco superbe.",,Décembre 2021,Commentaire envoyé le 28 décembre 2021
475,Celine,10.0,France,A refaire !,"L'hotel est tres bien situé, nous avons pu rejoindre le Parc Disney à pied ou en navette. Le personnel est tres accueillant et nous a donné des astuces en arrivant !",,Décembre 2021,Commentaire envoyé le 28 décembre 2021
476,Perganti,6.0,France,Agréable,Les navettes disponibles rapidement,,Novembre 2021,Commentaire envoyé le 27 décembre 2021
477,Carmen,5.0,France,Passable,Le parc et la proximité de l'hôtel,,Novembre 2021,Commentaire envoyé le 27 décembre 2021
478,Floriane,10.0,France,parfait. a refaire,"le décor parfait  mon fils est ravie  le prix était super , l’emplacement très bien. immersion garantie",,Décembre 2021,Commentaire envoyé le 22 décembre 2021
479,Morgane,10.0,France,génial,j’ai aimé la féerie de disney. Au petit déjeuner nous avons eu une hôtesse au top du nom de magali.,,Décembre 2021,Commentaire envoyé le 21 décembre 2021
480,Caroline,5.0,France,"très moyen, beaucoup d'attente à l'accueil et restauration peu adaptée aux envies",Bonne literie - sinon pas grand chose,,Novembre 2021,Commentaire envoyé le 21 décembre 2021
481,Peltzer,5.0,France,"Heureusement que le décors, l'accès au parc et l'accueil client est un gros plus, car la chambre bof","Accueil, décor, accès au park",,Décembre 2021,Commentaire envoyé le 19 décembre 2021
482,Jessica,10.0,France,Exceptionnel,Tout était bien .,,Décembre 2021,Commentaire envoyé le 19 décembre 2021
483,Julien,10.0,Djibouti,extraordinaire,Tous !,,Décembre 2021,Commentaire envoyé le 18 décembre 2021
484,Heloise,6.0,France,Agréable,Le personnel l'emplacement,,Novembre 2021,Commentaire envoyé le 18 décembre 2021
485,Mohamed,10.0,France,Exceptionnel,Toutes est bien,,Décembre 2021,Commentaire envoyé le 18 décembre 2021
486,Julien,10.0,Djibouti,extraordinaire,le décore et le personnel,,Décembre 2021,Commentaire envoyé le 16 décembre 2021
487,Peggy,4.0,France,Proche du Parc mais excessivement cher compte tenu du service,"Pas de bouilloire, verre, eau, ni sachet thé ou café. Très peux de décorations de Noël dans l'ensemble de l'hôtel",,Décembre 2021,Commentaire envoyé le 16 décembre 2021
488,Sandra,10.0,France,A refaire,Excellent,,Novembre 2021,Commentaire envoyé le 16 décembre 2021
489,Mathieu,10.0,Belgique,ON RETOURNE QUAND  ?!,l’ambiance chaleureuse et convivialité du personnel!  Repas du soir ( buffet ) très complet et très bon  Décors très immersifs,,Décembre 2021,Commentaire envoyé le 15 décembre 2021
490,Natacha,10.0,France,Exceptionnel,Le personnels très gentil et à l'écoute les chambres propres,,Décembre 2021,Commentaire envoyé le 15 décembre 2021
491,Sophie,10.0,France,Bon hôtel,On se croyait vraiment dans le dessin animé Cars. Mes enfants étaient aux anges,,Décembre 2021,Commentaire envoyé le 14 décembre 2021
492,Guillaume,4.0,France,Rapport qualité prix zero,La proximité avec les parcs,,Décembre 2021,Commentaire envoyé le 14 décembre 2021
493,Thomas,10.0,France,se croire au nouveau Mexique,tout de a a z,,Décembre 2021,Commentaire envoyé le 12 décembre 2021
494,Océane,10.0,France,sublime,l’accueil,,Novembre 2021,Commentaire envoyé le 9 décembre 2021
495,Virginie,6.0,France,Agréable,Petit déjeuner moyen,,Décembre 2021,Commentaire envoyé le 8 décembre 2021
496,Mélanie,4.0,France,Décevant,"L'ambiance de l'hôtel est géniale,  le décors superbe",,Décembre 2021,Commentaire envoyé le 6 décembre 2021
497,Marlene,6.0,France,Correct,Hotel bien situé par rapport aux parcs Disney  Restaurant avec buffet Tex Mex  Navettes régulières pour le parc  Salle de bain propre avec produits et serviettes pour chacun Présence de personnages Disney le soir,,Novembre 2021,Commentaire envoyé le 2 décembre 2021
498,Marlene,6.0,France,Correct,Bon buffet pour petit déjeuner et dîner.  Hotel bien situé par rapport aux parcs Disney.  Navettes très régulières  Personnel très gentil  Salle de bain et produits très bien et propre,,Décembre 2021,Commentaire envoyé le 2 décembre 2021
499,Nicolas,6.0,France,Pratique car à côté du parc mais c’est tout.,"l’univers et l’emplacement, chambre spacieuse et calme.",,Novembre 2021,Commentaire envoyé le 1 décembre 2021
500,Elodie,10.0,France,Exceptionnel,"Le lit est super confortable, le personnel gentil et donne des explications clairs, le personnel de ménage a fait un super boulot d'une nuit à l'autre !",,Décembre 2021,Commentaire envoyé le 1 décembre 2021
501,Jarnicotonbleu,4.0,France,Vraiment si vous n'avez pas d'autre choix...,"Parking surveillé.  L'avantage en dormant à l'hôtel, c'est que vous pouvez bénéficier d'un accès prioritaire au Parc le lendemain, avant l'ouverture des portes au grand public (1h avant).",,Novembre 2021,Commentaire envoyé le 29 novembre 2021
502,Vivi,10.0,France,séjour magique !!!,"la chambre avec vue sur la rivière, très beau 🥰",,Novembre 2021,Commentaire envoyé le 28 novembre 2021
503,Noëllie,10.0,France,Un séjour parfait et inoubliable.,Tout était parfait ! Chambre et personnel au top du top !,,Novembre 2021,Commentaire envoyé le 28 novembre 2021
504,Jean-hubert,5.0,France,Correct mais hors de prix,"Un rapport qualité/prix plutôt médiocre pour un hotel correct, mais pas transcendant non plus malgré le coût. Le côté pratique d'être au sein de Disneyland ne suffit pas à justifier tous les excès.",,Novembre 2021,Commentaire envoyé le 26 novembre 2021
505,Anais,5.0,France,cher pour ce que c est,bonne ambiance personnel sympa beau cadre,,Novembre 2021,Commentaire envoyé le 25 novembre 2021
506,Sonia,6.0,France,Moyen,L emplacement proche du Parc et la navette gratuite,,Novembre 2021,Commentaire envoyé le 25 novembre 2021
507,Emmadeno,4.0,France,Proche du parc mais vraiment pas qualitatif pour le prix payé !,L'emplacement proche du parc avec la navette gratuite  - La possibilité d'envoyer les bagages directement à la gare (moyennent finance) - Le personnel,,Novembre 2021,Commentaire envoyé le 25 novembre 2021
508,Laure,6.0,France,Agréable,personnage disney personnel tres agréable et a l ecoute,,Novembre 2021,Commentaire envoyé le 25 novembre 2021
509,Priscille,5.0,France,Hôtel juste bon pour y dormir,"La literie, la propreté",,Novembre 2021,Commentaire envoyé le 24 novembre 2021
510,Laetitia,5.0,France,Séjour a proximité du parc mais qui ne vaut pas son prix,"La proximité du parc Disney, la possibilité d'y aller a pied, le stationnement de la voiture a côté de l'accès de la chambre, chambre bien chauffée en hiver, eau bien chaude dans la douche. Aspect thématique extérieur de l'hôtel joli, surtout de nuit, intérieur type motel américain sur Cars, sympa pour les enfants",,Novembre 2021,Commentaire envoyé le 24 novembre 2021
511,Marjorie,10.0,France,un super séjour en famille,"La proximité de l’hôtel, l’accueil du personnel, le buffet à volonté, la chambre et la literie.",,Novembre 2021,Commentaire envoyé le 22 novembre 2021
512,Emmanuelle,3.0,France,Assez médiocre,Bien placé  Navette facilement accessible,,Novembre 2021,Commentaire envoyé le 22 novembre 2021
513,Hita,5.0,France,"Bon, mais.........",Emplacement par rapport au parc.,,Novembre 2021,Commentaire envoyé le 21 novembre 2021
514,Sophie,10.0,France,parfait !,tout était parfait !,,Novembre 2021,Commentaire envoyé le 20 novembre 2021
515,Gianni,4.0,France,Décevant,Les chambre était très bien .,,Novembre 2021,Commentaire envoyé le 18 novembre 2021
516,Delphine,10.0,France,Merveilleux,Parfait. Pour les enfants. Univers cars. Très confortable. Nous avons passé un très bon moment,,Novembre 2021,Commentaire envoyé le 15 novembre 2021
517,Aude,5.0,France,Le prix est attractif mais en rapport qualité prix il y a mieux en hôtel Disney,"Personnages Disney qui passe à l'hôtel, la navette pour le parc",,Novembre 2021,Commentaire envoyé le 12 novembre 2021
518,Déborah,6.0,Belgique,Bof,Personnel sympathique.,,Novembre 2021,Commentaire envoyé le 12 novembre 2021
519,Sebastien,10.0,Suède,Exceptionnel,les thèmes sur Cars,,Novembre 2021,Commentaire envoyé le 12 novembre 2021
520,Stéphane,4.0,Suisse,Beaucoup trop cher pour un hôtel 1 étoile max.,"La proximité du parc,",,Novembre 2021,Commentaire envoyé le 12 novembre 2021
521,Florianxx23,6.0,France,"Peu mieux faire: on vient chercher la féérie, on a un hôtel basique et vieillissant",Proximité du parc avec navettes régulières (attention aux heures de pointes! le matin en particulier) réactivité et amabilité du gérant suite à un problème dans notre chambre les clients de l'hôtel ne paye pas le parking du parc  la carte de la chambre donne du crédit pour des cafés offerts au distributeur,,Octobre 2021,Commentaire envoyé le 2 novembre 2021
522,Jerome,5.0,France,Trop cher pour la prestation,"L’emplacement, la navette pour le parc",,Octobre 2021,Commentaire envoyé le 28 octobre 2021
523,Caroline,6.0,France,confortable mais tes cher pour un deux étoiles,moins cher que les autres. confortable mais vraiment pas beau extérieurement et des couleurs un peu criardes et peu chaleureuses,,Octobre 2021,Commentaire envoyé le 28 octobre 2021
524,Isabelle,3.0,France,Très mauvais rapport Qualité-Prix (injustifié),"Bon emplacement par rapport au Parc (+ parking disponible tout au long de la journée) et personnel très agréable, accueillant et à l'écoute",,Octobre 2021,Commentaire envoyé le 25 octobre 2021
525,Mélany,10.0,France,1 nuit,"Très bien, nous étiez loin de la réception mais un bâtiment proche de l’accès du parc parfait pour nous. Chambre propre, tout était bien.",,Septembre 2021,Commentaire envoyé le 17 septembre 2021
526,Valérie,3.0,France,Décevant,La proximité du parc et les navettes,,Octobre 2020,Commentaire envoyé le 1 novembre 2020
527,Maxi,1.0,France,Fausse annonce !,"Lors de l’annonce sur votre site, il était indiqué petit déjeuné inclus et les billets pour le parc hors en arrivant à l’hotel la réception nous a dit que rien n’était pris en compte j’ai du donc payer 400€ en arrivant ! Un scandale ! Même pas de récap lors de la réservation et l’annonce qui change juste avant notre arrivé !",,Octobre 2020,Commentaire envoyé le 31 octobre 2020
528,Hélène,3.0,France,"En séjournant dans cet hôtel, on s'éloigne de la magie Disney.","Près du Disney Village et des parcs, même à pied!",,Octobre 2020,Commentaire envoyé le 29 octobre 2020
529,Delefosse,5.0,France,Passable,La navette. L emplacement,,Octobre 2020,Commentaire envoyé le 28 octobre 2020
530,Julie,4.0,France,Mécontente,Les figurines dans le parc,,Octobre 2020,Commentaire envoyé le 27 octobre 2020
531,Emeline,10.0,France,Super moments avec un personnel au top,La gentillesse et bienveillance du personnel Le fait d'avoir pu voir un personnage en fin de journée à l'hôtel.,,Septembre 2020,Commentaire envoyé le 24 octobre 2020
532,Coralie0602,6.0,France,Agréable,"L'extérieur de l'hôtel est très joli, surtout en pleine nuit quand tout est éclairé. Personnel de l'hôtel adorable et très accueillant, très bonne organisation pour l'enregistrement à l'arrivée.",,Octobre 2020,Commentaire envoyé le 21 octobre 2020
533,Alexandrine,10.0,France,Exceptionnel,Idéale la proximité avec le parc permet de profiter et surtout de ne pas reprendre la voiture pour rejoindre l hotel prix idéal,,Octobre 2020,Commentaire envoyé le 11 octobre 2020
534,Camille,10.0,France,Genial,Le personnel super accueillant et agréable avec de bonnes explications et de bons conseils,,Septembre 2020,Commentaire envoyé le 5 octobre 2020
535,Lukas,10.0,France,"Super séjour, la caste qui m’a accueilli était super gentille, mise en place face à te pandémie rien à dire !","L’accueille, la disponibilité des caste en ca de problème/question.",,Septembre 2020,Commentaire envoyé le 1 octobre 2020
536,Mathis,10.0,France,Heureux,Tous le personnel étais très très très gentilles tous autant qui son,,Septembre 2020,Commentaire envoyé le 28 septembre 2020
