,0,1,2,3,4,5,6,7
704,Rebecca,8.0,Royaume-Uni,,Transfers to parks were excellent. My littles ones liked the theme all around the hotel and the characters in the lobby in the morning.,"The only thing I really did not like about the hotel was the breakfast, extremely expensive and the food was not good. Check in queue was over an hour long but I think we maybe arrived at peak check in time.",Février 2020,Commentaire envoyé le 27 février 2020
705,Mm,7.9,Singapour,,Staffs are very friendly. There was a Starbucks just next to the lobby. So it was convenient to have coffee or breakfast:),Our room was a bit far from the lobby (I felt that because It was rainy day...) so had to get wet to reach our room with carrying big luggage. Although there were plenty of towels just in front our room so could use them:),Février 2020,Commentaire envoyé le 23 février 2020
706,Isabella,9.2,Brésil,,"Helpfull staff, transport avaiable to Disneyland park",,Février 2020,Commentaire envoyé le 21 février 2020
707,Danielle,7.5,Allemagne,,"Clean - no frills. Awesome location- 10 min walk to Disney on an easy, well lit, paved path. Extra magic hours were cool too. We got the rate at a great value so I would book again for that price. I did not notice an air conditioner in the room (they had a ceiling fan). That would make me not book for a late spring, summer stay.","Check in staff wasn’t “Disney” friendly-zero explanation of anything. The property is dated. Hair dryer was terrible. Otherwise, all was well.",Février 2020,Commentaire envoyé le 17 février 2020
708,Linda,7.1,Royaume-Uni,,Breakfast Staff Starbucks,Very tired in the bedrooms and needed deep cleaning and refreshing especially the bedroom carpets,Février 2020,Commentaire envoyé le 15 février 2020
709,Karen,9.0,Royaume-Uni,,Close to the park and our room was close to the river so we could walk quite easily. Prefer to walk into the park than get the bus. Close enough to nip over for Dinner in the Chuck Wagon Restaurant in Hotel Cheyenne. We would book again in the future.,Heating not easy to control and we went on a weekend when it was cold!,Février 2020,Commentaire envoyé le 13 février 2020
710,Claire,8.0,Royaume-Uni,,The car theme,"It needs better pillows, the pillows are very little and not comfy at all",Février 2020,Commentaire envoyé le 12 février 2020
711,Tom,7.0,Royaume-Uni,,"Staff were helpful, great option to stay an extra night without paying for park tickets","Despite having instructions to leave used towels in the bath the staff replaced all of them, and the bar of soap / bottles of shampoo which were hardly used.",Février 2020,Commentaire envoyé le 11 février 2020
712,Sarah,7.0,Royaume-Uni,,"Clean and tidy, friendly staff, room was smaller than expected. Ok for 1 night but wouldn't stay for whole holiday. Good theaming for cars fans.","Small room, bath didn't drain when using the shower. Quite a large layout and seemed further away from the parks than advertised. Beds not that comfy.",Février 2020,Commentaire envoyé le 9 février 2020
713,Matt,7.9,Royaume-Uni,,"Great location with a lovely, short walk to the Disney Parks. Quick and easy check-in. Friendly, approachable and helpful staff. Comfortable beds, lovely warm and powerful shower.",Overall the property is looking a little ‘tired’ and in need of refreshment. The on-site buffet restaurant is very overpriced for the quality of food on offer,Février 2020,Commentaire envoyé le 8 février 2020
714,Hannah,9.0,Royaume-Uni,,Check in was very easy and the staff were really helpful and friendly. Room was perfect and the bed so comfortable. Would highly recommend!,,Janvier 2020,Commentaire envoyé le 23 janvier 2020
715,Carla,8.0,Angola,,do hotel e do jantar,,Janvier 2020,Commentaire envoyé le 15 janvier 2020
716,Jorge,9.0,Arabie saoudite,,"Cool environment, friendly staff, location near the parks, excellent theme for rooms and common facilities, bus to park, baggage transfer service, extra Magic hours, Disney characters early morning on Lobby, cleanliness, several languages spoken by personnel, no need for check out.",Dining facilities close early at night.,Janvier 2020,Commentaire envoyé le 13 janvier 2020
717,Leanne,10.0,Royaume-Uni,,Loved the theme of this hotel,Their restaurant didn’t have great tasting food bit bland,Janvier 2023,Commentaire envoyé le 9 janvier 2023
718,Rachel,10.0,Royaume-Uni,,"Love staying at Santa Fe, have stayed a few times before. Cars themed and 15 min walk to Disney along the river. Starbucks on site now is great and everything you need.",,Janvier 2023,Commentaire envoyé le 9 janvier 2023
719,Sarva,4.0,Royaume-Uni,,nothing,it’s a old hotel need renovation,Janvier 2023,Commentaire envoyé le 7 janvier 2023
720,Michelle,1.0,Australie,,It's a good 20 min walk to Disney. The Spanish guy who checked us in was very nice..,We were locked out of our room 3 times. So expensive for the most basic room. Towels and linen was very worn. No replacement soap I had to ring and request some. Staff didn't seem happy,Décembre 2022,Commentaire envoyé le 17 décembre 2022
721,Michelle,4.0,Australie,,I liked the convenience. I'm a big Disney fan but compared to US and Hong Kong this was very disappointing. Staff were friendly,"No soap in the bathroom. It was empty. Towels and hand towels we're very worn one even with holes. Our key stoped working, not even an apology for the inconvenience of having to go to reception and queue for 20 min with little kids exhausted from a full day in Disneyland. Our room was cold. Doors to our block didn't lock. Room doors locked..",Décembre 2022,Commentaire envoyé le 14 décembre 2022
722,Tatiana,6.0,Pérou,,"The closesness to the parks, the bus to the parks.personalize room keys that can be kept as souvenirs is a nice touch. The team is very welcoming and nice","It looks like a very run down hotel, not what you see in any other Disney Resort. The baggage claim is opposite to the front desk so it's annoying having to walk outside and cross the street to drop/pick up your bags. One of the guys accused us of loosing a ticket and was so rude to us almost like kicking us out, that put a sour note to the end of our night. On the walk to the room the corridor to get to the room looks old and outdated, there was a random housekeeping car in the middle of the corridor. The walls are paper thin you can hear everything, the kids running around unsupervised and other people walking to their room later at night, not easy to have a good night sleep. The heater didn't work on one of the room so it was very cold all night. The tv didn't have many channels to choose from. There was a bad smell in the room for a few hours out of nowhere . Everything look so far that we didn't get to see the pool or the restaurant or any other area. For the price I was expecting something more a la par with Disney Orlando.",Novembre 2022,Commentaire envoyé le 2 décembre 2022
723,Leann,5.0,Royaume-Uni,,"Theming was nice, staff friendly",Beds were as hard as the road! Solid. So glad we were only staying for 1 night before moving to another hotel. Room also a bit dated. Definitely in need of an update.,Novembre 2022,Commentaire envoyé le 22 novembre 2022
724,Danielle,1.0,Irlande,,,"very basic damp musty smelling rooms, dirty carpets, filthy lifts, no vending machines working.",Novembre 2022,Commentaire envoyé le 19 novembre 2022
725,Clarissa,10.0,Australie,,"great service, convenient, close to Disneyland",bed mattress is a bit old and too soft,Novembre 2022,Commentaire envoyé le 15 novembre 2022
726,Neil,5.0,Royaume-Uni,,location,mould in the bathroom. uncomfortable beds,Novembre 2022,Commentaire envoyé le 15 novembre 2022
727,Momoka,10.0,Royaume-Uni,,"great decorations in theme with Cars, early entry into the park, frequent buses to Disneyland","snack machines were broken, luggage queue in the morning very very long",Novembre 2022,Commentaire envoyé le 12 novembre 2022
728,Roxanna,10.0,Royaume-Uni,,The staff were lovely and helpful.  The shuttle between park and hotel was great and regular.  The hotel room was big and had plenty of room for storage.,The room was too hot at night even with a ceiling fan and had to strip off the insulated mattress protector to sleep. The hotel was very expensive at just under £700 for 2 nights.,Octobre 2022,Commentaire envoyé le 30 octobre 2022
729,Jason,10.0,Nouvelle-Zélande,,We liked the theme of the room/Hotel. Our kids really enjoyed meeting Goofy.,The shower was not good.,Octobre 2022,Commentaire envoyé le 14 octobre 2022
730,Brendan,4.0,Australie,,Friendly staff and great location near Disney park.,"The hotel room did not have any standard amenities such as a kettle or fridge. The safe/security box didn't work, cobwebs in the room, dirty floor, shower leaked and bathroom needed updating. The curtain was also held together by a hair bobby pin. Price was expensive for run-down hotel.",Octobre 2022,Commentaire envoyé le 12 octobre 2022
731,Alvin,10.0,Philippines,,value for money,no slippers but not a real disappointment but should have one by request,Octobre 2022,Commentaire envoyé le 8 octobre 2022
732,Vikki,10.0,Royaume-Uni,,amazing location with fantastic staff.,"nothing, it was perfect!",Septembre 2022,Commentaire envoyé le 4 octobre 2022
733,Jade,4.0,Australie,,the location of the property was good,"That the rooms were not sound proof, when I tried to ring reception twice to advise them of the loud guests next door they did not answer.",Septembre 2022,Commentaire envoyé le 28 septembre 2022
734,Molkogirl,10.0,Royaume-Uni,,"Staff at check in amazing. Starbucks onside great for breakfast, no queue and 20 euros for 2 people with drinks, crossings etc",Vending machines didn't work- not good when came back from park after fireworks thirsty and nothing open.,Septembre 2022,Commentaire envoyé le 27 septembre 2022
735,Kathryn,3.0,Royaume-Uni,,clean and tidy,"we are a family of 3, but two are disabled and we were put in a 1st floor room. as we were only staying 1 night we managed but it caused huge difficulty getting up stairs as the lft was broken. we were both in pain by the time we got to our room.",Septembre 2022,Commentaire envoyé le 25 septembre 2022
736,Amy,3.0,Royaume-Uni,,The Cars theme of the hotel. Welcome from the staff. Location to the Disney parks.,"The facilities of the hotel. The Rooms were pretty bad. Very dated. On arrival, which was 10pm at night, there was a cleaners frilly with clean towels on in the corridor which we had to try to pass with out buggy. Corridor was a small space. On arrival into our room. The buggy touched a panel and it fell off onto the floor. Luckily my children were behind me. This would have hurt them if they had been in from of it.  We requested a cot for baby and side guards for toddle. We had the cot but not side guards, therefore they had to be requested again.  The rooms had a stale smell to them. I’m not sure wether this is because the carpets hadn’t been renewed for a very long time.  The bathroom was basic. Also had a mould smell to it. I think this was the shower curtain in there. Also when I went to have a shower. I was unable to do so as the nozzle that you pull up to change from a bath into superheat had broken. Therefore had to have a bath myself rather than a quick shower late at night.  The hairdryer was a wall fixed one in the bathroom. Which was inconvenient with young children.  There was no little supply of tea,coffee and milk in the room. A kettle had to be requested fir us to make the baby a feed. You had a limit on your key card of 1 hot drink per person per day, which you had to leave your room and locate at a different block in the hotel. Not a comfortable thing to do late at night when needing a hot drink before bed.  Also there was not breakfast tea, just herbal, therefore had a hot chocolate instead which tasted and looked like dish water. This was the same for my husbands coffee.  Breakfast was okay. Did have a school canteen feel to it though. With trays etc.  This hotel has massive potential and can be lovely with just a little refurbishment and adding the small details. Like tea and coffee in the rooms.",Septembre 2022,Commentaire envoyé le 20 septembre 2022
737,Alexandrea,5.0,États-Unis,,"The location was great, parking was free, there was dining on site that stayed open late which was nice when going to the parks.","Bed was not comfortable, room was small, no water kettle, coffee maker, or fridge.  Bathroom wasn’t super clean.",Septembre 2022,Commentaire envoyé le 12 septembre 2022
738,Laura,2.0,Royaume-Uni,,the fact we could access the park as annual pass holders,"dated, fan didn’t work, things falling off wall, no kettle in room",Août 2022,Commentaire envoyé le 28 août 2022
739,Bilkiss,10.0,Royaume-Uni,,"The four complimentary hot drinks per day and the park being so close at walking distance of 12 mins, didn’t need a shuttle",N/a,Août 2022,Commentaire envoyé le 15 août 2022
740,Yvette,2.0,États-Unis,,Close to the park,Roaches in the room no air conditioning,Juillet 2022,Commentaire envoyé le 7 juillet 2022
741,Sagar,1.0,Inde,,nothing,we hated this property such dirty property with no proper staff,Mai 2022,Commentaire envoyé le 3 juillet 2022
742,Susana,6.0,Espagne,,limpio,escaleras sin ascensor,Juin 2022,Commentaire envoyé le 30 juin 2022
743,Xiaodong,5.0,Irlande,,location,No kettle for water,Juin 2022,Commentaire envoyé le 27 juin 2022
744,Berry,1.0,États-Unis,,We liked nothing!!!!!!! There were his everywhere.  We left at 3 am beside it was so disgusting!  We moved to another hotel,Worst hotel ever!!!!,Juin 2022,Commentaire envoyé le 26 juin 2022
745,Marie-laure,10.0,France,,Tres bel hotel. personnel tres agreable,,Juin 2022,Commentaire envoyé le 16 juin 2022
746,Julie,10.0,Royaume-Uni,,"Lovely clean hotel, comfortable beds, staff members all friendly","Our room was furthest away, quite a long walk after watching fireworks, buses too busy",Juin 2022,Commentaire envoyé le 9 juin 2022
747,Sarah,5.0,Royaume-Uni,,- Easy walking distance to the Disney parks - My children loved the styling and the Disney TV channels - The occasion we did get to meet a character - Starbucks on site,"- I couldn’t believe how old and run down and simply dirty the properly is for the £250/night we paid! I’ve stayed at the older cheaper WDW hotels and they are spotless  - corridors absolutely filthy, in the midst of redecoration and should be closed - Awful smell in our room - Room is really small for 4 people - Lack of security to enter our hotel building - First night we went to see Mickey an hour before he was due to leave but line closed. At the price we paid for this opportunity, I was really angry.",Juin 2022,Commentaire envoyé le 6 juin 2022
748,Klevisa,10.0,Royaume-Uni,,Everything,,Juin 2022,Commentaire envoyé le 6 juin 2022
749,Chela,6.0,États-Unis,,close to park,limited laundry on property,Juin 2022,Commentaire envoyé le 5 juin 2022
750,Joanna,6.0,Royaume-Uni,,The hotel is a comfortable distance to the Disney Parks. The cast member at check in was friendly. The room was clean.,The lobby has no theming and the hotel theming in general is lacklustre (compared to the Cheyenne which doesn't cost much more and has an amazing lobby). Some common areas look run down (damaged doors etc). One of the beds in our room was so creaky it sounded ready to fall apart and the other bed was quite hard. Also the water pressure in the shower was painfully high! And the shower head didn't fit properly in the holder so it occasionally fell backwards and shot upwards to the ceiling during use.,Mai 2022,Commentaire envoyé le 18 mai 2022
751,Eduardo,2.0,Brésil,,Location,"Comfort, strcuture",Avril 2022,Commentaire envoyé le 18 mai 2022
752,Ashley,1.0,États-Unis,,transfer to park,hotel workers were rude and uncomfortable beds,Mai 2022,Commentaire envoyé le 17 mai 2022
753,Jade,1.0,Royaume-Uni,,location,"everything I had holes in my walls of the hotel the bath panel was coming off and it hurt my daughter I have got pictures to prove this , I have compained to disney but not had a response yet, the food was freezing and just horrible the hotel absolutely stank",Mars 2022,Commentaire envoyé le 23 avril 2022
754,Natasha,6.0,Royaume-Uni,,Nice walk into Disney. Great to have Starbucks onsite. Liked the layout/style.  Character meet in Reception was great.,"Quite basic, but clean and adequate.",Avril 2022,Commentaire envoyé le 21 avril 2022
755,Veronica,3.0,Royaume-Uni,,,"the bath tub got stuck in our room, the water didn’t go at all, which made us have to take a super fast shower, as we only stay for one night, we didn’t ask for room changing… this was such a bad experience with Disney hotel… the hotel is surely over price!",Avril 2022,Commentaire envoyé le 18 avril 2022
756,David,5.0,Royaume-Uni,,Location was ok to walk to avoid over crowded shuttles. We liked the disney characters at hotel in evening.,Very dated rooms. Nothing for kids to do in the evening. Bar was also closed.,Avril 2022,Commentaire envoyé le 1 avril 2022
757,Samantha,2.0,Royaume-Uni,,Staff were great!,Very out dated… carpets were very badly stained,Mars 2022,Commentaire envoyé le 26 mars 2022
758,Carolina,10.0,Brésil,,"Everything! Theme, staff, clean, vibe, distance from parks, looooooved it all!",,Mars 2022,Commentaire envoyé le 10 mars 2022
759,Louisa,6.0,Pays-Bas,,Close to disney land park,Dated interior Small room Bed not very comfortable,Mars 2022,Commentaire envoyé le 7 mars 2022
760,Kerry,10.0,Royaume-Uni,,Everything,,Février 2022,Commentaire envoyé le 1 mars 2022
761,George,1.0,Royaume-Uni,,,rude unhelpful staff  discrimination against disabled people  staff try to rip you off by adding things to the bill you haven’t ordered  big point if you in a electric wheelchair there will not let you board the bus,Février 2022,Commentaire envoyé le 4 février 2022
762,Agnes_who,5.0,Pays-Bas,,Location- close to parks (walking distance). General feel of the place (decor)- especially if you like Cars :),"The checkin took really long. Lady who took care of us just walked away few times, and was gone for a long time. The room was not properly cleaned. There was dust on furniture and fixings. Splatter and strange smudges on the tiles in the bathroom. Mold on the ceiling. Bath and toilet were not clean. But we couldn't use the shower even if we wanted to, since there was no hot water. After running the tap for 15 minutes it got lukewarm. Heating switched off in tge middle of tge night (in January).  Tried contacting the hotel to give feedback but got ignored.  Not worth the money- and especially concerning during pandemic.",Janvier 2022,Commentaire envoyé le 7 janvier 2022
763,Simon,10.0,Royaume-Uni,,On arrival we went to reception and one of our two rooms were ready this was 11am so we put all The luggage in the one room and awaited a text for the second . Rooms were comfy clean and had a great cars theme that the kids loved ! We had booked a further stay direct with Disney and they allowed us to keep our rooms to save moving .,Hot drinks vending machine could have been closer,Novembre 2021,Commentaire envoyé le 27 décembre 2021
764,Chloe,10.0,Royaume-Uni,,proximity to Disneyland park was excellent!,,Novembre 2021,Commentaire envoyé le 15 décembre 2021
765,Natalie,5.0,Nouvelle-Zélande,,Friendly helpful staff Easy walking distance to Disneyland,"Maintenance issues, Bath didn't drain, wifi didn't work, safe didn't work. Pretty poor.",Décembre 2021,Commentaire envoyé le 11 décembre 2021
766,Seb1980,5.0,Royaume-Uni,,Easy acces to Disney parks Friendly staff,No play ground for kids Hard to find a car park at the facility,Novembre 2021,Commentaire envoyé le 7 novembre 2021
767,Aryan,1.0,Pays-Bas,,location,rooms are dirty and very hot. There is no airco in the room. There is not even a fridge in the room. It was also a challenge to to find a spot to park my car.,Août 2020,Commentaire envoyé le 5 août 2020
768,Kloe,5.0,Royaume-Uni,,The bed was comfortable. The shuttle was handy but the queues to get on were horrific. We preferred to walk as it was nice to see the other Disney hotels.,The corridors were filthy - carpets were stained. The room smelled of cheap deodorant when we walked in and then of cigarettes as people we’re smiling outside next to the room.,Mars 2020,Commentaire envoyé le 8 mars 2020
769,Jorge,1.0,Espagne,,The bad experience suffered made impossible to me to enjoy the Hotel and be able to describe anything good.,"We suffered an incompetent employee when checking-in. We had a reservation of two rooms, for two adults (room 1) and two adults and two children of 2 and 5 years old (room 2) and agreed to have bunk beds for my kids. My wife did the check-in and they said the checking was done but the rooms would be ready later (it was around 10am), so we spent the day in Disney. We got back to the Hotel in the evening and the new receptionist said we only have one room for me and my wife with no kids (meaning they only did the check-in of room 2 without my two children. This new receptionist does the check-in of the two rooms also with my kids this time (ok). We arrive to the rooms (in different buildings because now at the evening they did not have twoo rooms in the same building), and room 2 has no bunk beds for my kids, so we go to the reception to request a room with bunk beds, and another different receptionist says to my wife ""you should have been checked-in in the morning because at the evening normarlly there is no availability for rooms with bunk beds"". I cannot believe it!!! The did the check-in WRONG in the morning and we have to sleep in one bed me with my little kid and in the other my wife with the other one, very unconfortable because are not big beds. My wife tried to complaint and the employee said to her that they did not do anything wrong and we CANNOT complain, that we can comply to Booking if we want!!!! To booking??? Why to booking if it is Hotel's fault for not doing the check-in correctly??? So, we could not complain in writting because they said they did everything wright. It was a really bad experience, a very very bad experience, and the feeling they do not care about anything because they will be fully booked no matter how they treat their clients, because the are close to Disney. Terrible experience, I am fully disappointed.",Février 2020,Commentaire envoyé le 27 février 2020
770,Sarah,10.0,Royaume-Uni,,Check in was quick and easy. The room was easy to find and very clean and comfortable.,Everything was great!,Février 2020,Commentaire envoyé le 23 février 2020
771,Nikoleta,6.0,Monaco,,,"When we enter in to the room was so strong bad smell of cigarettes, so we have to keep the window open during the rest of the evening and night to get it out. The bottle of shower gel been empty - lucky then we have bring our small travel kid.",Février 2020,Commentaire envoyé le 23 février 2020
772,Nilesh,10.0,Royaume-Uni,,No extra pillows,,Février 2020,Commentaire envoyé le 22 février 2020
773,Abdulsalam,5.0,Koweït,,The construction idea,Low budget hotel in Disneyland did not fit with other well class experience,Février 2020,Commentaire envoyé le 15 février 2020
774,Gtech,6.2,Royaume-Uni,,Spacious room for a disabled room,Had to wait till 9 pm in order to check in couldn’t check in at three because the room wasn’t ready then they put me in a completely different building to the one they were going to put me in not good when you have been on the go for 22hrs plus driving all night long arrived at stupid o’clock in the morning,Février 2020,Commentaire envoyé le 14 février 2020
775,Martha,10.0,Chili,,Very clean and the rooms are very nice,Is a good option if you like to stay in the parks for the whole day. There is nothing much to do in the hotel beside get a good night sleep.,Février 2020,Commentaire envoyé le 4 février 2020
776,Patrick,10.0,Malte,,We as a family liked the comfort of the hotel And the shuttle service to Disney at all time.,The only thing was the  mettreses are not comftible.,Décembre 2019,Commentaire envoyé le 16 janvier 2020
777,Ya-yun,10.0,Australie,,Cute,No,Décembre 2019,Commentaire envoyé le 14 janvier 2020
778,Harris,10.0,Chypre,,"Location, friendly staff and clean",,Janvier 2020,Commentaire envoyé le 13 janvier 2020
779,David,4.0,Irlande,,Not much. I wouldnt stay again.,"Over an hour of a queue to check in every day.  Comical prices for breakfast (€22, per person, per day) and dinner (€35 excluding drinks) for very average mass produced food. At 1 entrance they have a security guard there all the time with a hand held airport like scanner. He insists in scanning every person which I fully appreciate for security. However theres 3 or 4 other doors into the hotel which are totally unmanned. It makes the security pointless and comes across as Disney having it there as more of a requirement than an actual security measure. The hotel is very big, split into dozens of single buildings. It can be quite confusing if your party are not all in the same building. The staff are either excellent, or terrible. Theres no middle ground. It's a 2 star hotel for a reason.",Janvier 2020,Commentaire envoyé le 12 janvier 2020
790,Anonyme,8.0,Royaume-Uni,,clean and accessible,,Décembre 2022,Commentaire envoyé le 25 décembre 2022
791,Anonyme,7.0,Royaume-Uni,,"brilliant location, friendly staff very vlean",the mattresses were very had and uncomfortable,Novembre 2021,Commentaire envoyé le 21 novembre 2021
792,Anonyme,7.1,Portugal,,,Food extremely expensive for the limited offer,Janvier 2020,Commentaire envoyé le 24 janvier 2020
