,0,1,2,3,4,5,6,7
368,Stephanie,10.0,France,Exceptionnel,Matelas et oreiller très bonne qualité  Chambre propre  Ménage fait entre les nuits  Emplacement de notre chambre parfait Personnel plus qu adorable,Le prix des petits dej élevés,Novembre 2022,Commentaire envoyé le 10 novembre 2022
369,Sylvain,6.0,France,Agréable,La proximité avec le parc,"L'état de la chambre, les tiroirs qui se démontent quand on les tire, joints noir dans la salle de bains, état vieillissant.  Réseau WiFi hors service donc application non utilisable, paiement CB impossible etc...",Novembre 2022,Commentaire envoyé le 10 novembre 2022
370,Sylvie,10.0,France,splendide,tout l’hôtel la chambre la sympathie des cast,rien,Octobre 2022,Commentaire envoyé le 5 novembre 2022
371,Cyrille,10.0,France,Exceptionnel,Satisfait du séjour à Disneyland 👍👍👍,Rien,Octobre 2022,Commentaire envoyé le 27 octobre 2022
372,Pierrelouis,6.0,France,Agréable,accueil,tarif impossibilité de réserver les tickets pour le parc à l’hôte,Octobre 2022,Commentaire envoyé le 22 octobre 2022
373,Camille,10.0,France,Parfait,Tout,,Septembre 2022,Commentaire envoyé le 18 octobre 2022
374,Malik,10.0,France,les enfants ont aimés la chambre,"hôtel est beau, la déco du film Cars est belle",la moquette devrait être changée  il manque des annimations et des zones fun dans l’hôtel,Octobre 2022,Commentaire envoyé le 16 octobre 2022
375,Sandra,10.0,France,séjour parfait,le thème,,Octobre 2022,Commentaire envoyé le 7 octobre 2022
376,Emmanuelle,10.0,France,Exceptionnel,Chambre propre on était quatre on avait deux chambre avec chacun ses équipements vraiment parfait.,,Octobre 2022,Commentaire envoyé le 6 octobre 2022
377,Celine,10.0,France,"Excellent séjour,  jamais déçu,  parfait comme à chaque fois","Le personnel est exceptionnellement gentil , tout est fait pour vous satisfaire,  on a reçu ttes les infos nécessaires et même plus pr passer un excellent séjour . La chambre est très bien équipée literie très bien , équipement comme prévu sur la description de booking, très propre . Tt était parfait ,les navettes sont à l heure et régulières.",Les gens qui ne respectent pas l heure tardive et parlent fort ds les couloirs de l hôtel comme si ils étaient seuls .,Octobre 2022,Commentaire envoyé le 6 octobre 2022
378,Valérie,10.0,Belgique,super à recommander,le décor la gentillesse et le professionnel du personnel à recommander vivement.,,Septembre 2022,Commentaire envoyé le 6 octobre 2022
379,Caroline,4.0,France,Décevant,,"Chambre très très très simple, robinet tellement rempli de tarte qu’il y avait un petite fuite. Pommeau Baignoire qui fait beaucoup de bruit. Le prix est exorbitant pour cette chambre basique, vétuste et vieille. Vraiment déçu pour un hôtel Disney. Lit confortable. Le personnel de l’accueil très compétant et sympathique. Je ne recommande cet hôtel.",Octobre 2022,Commentaire envoyé le 3 octobre 2022
380,Alizee,10.0,Belgique,fabuleux !,"la gentillesse du personnel, toujours disponible",les toilettes publiques sont pas toujours propres,Octobre 2022,Commentaire envoyé le 3 octobre 2022
381,Tifany,2.0,Belgique,plus jamais!,rien,"la honte des hôtels Disney. les chambres sont sales, dès centaines de fils de poussières sur les murs, au plafond, les barres de rideaux, le nettoyage laisse clairement à désirer. les draps étaient sales! la taie d’oreiller de ma fille avait carrément des dizaines de taches de moisissures! une catastrophe! les joint de la baignoire, le rideau de douche à vomir.",Septembre 2022,Commentaire envoyé le 27 septembre 2022
382,Nada,10.0,France,excellent,"la propriété , le confort , la décoration",le distributeur de boissons chaudes pas assez dans les bâtiments,Septembre 2022,Commentaire envoyé le 24 septembre 2022
383,Sandrine,10.0,France,Au Santa Fé on est gâté.,"Un accueil chaleureux et convivial, du personnel très compétant, réactif et gracieux à La Cantina, sans oublier le côté entretien (chambres, les communs, les sanitaires) des personnes très professionnelles.",,Septembre 2022,Commentaire envoyé le 21 septembre 2022
384,Lapin,6.0,France,Cher,,Nous sommes partis avec une nuit d'avance. Trop chaud dans la chambre. Mauvaise insonorisation.,Septembre 2022,Commentaire envoyé le 9 septembre 2022
385,Eloïse,5.0,France,Nous espérions mieux vu le prix de la chambre,"Le décor était respecté, la chambre était confortable","La propreté de la chambre est à revoir : l’eau de la baignoire qui ne s’évacuait pas, de l’urine sur la lunette des toilette, ainsi que des cheveux sur le sol de la salle de bain et sur les taies d’oreillers",Septembre 2022,Commentaire envoyé le 9 septembre 2022
386,Mélanie,6.0,Belgique,Agréable,Le buffet du soir a velonter très bon et copieux  Chambre propre  Personnel très gentil et accueillant,Déjeuner très chère 22 euros part personne je trouve ça chère une personne ne mange pas pour ce prix là  Hôtel un peu vieillot  Prix exessif pour une 1 nuit,Août 2022,Commentaire envoyé le 8 septembre 2022
387,Freddo48,4.0,France,Beaucoup trop cher.....,La proximité avec le Parc Disney,"Pas de clim, 2 verres pour les brosses à dents dans une chambre pour 4 , 2 jeux de serviettes de toilette !!! 1 seul mini shampoing et 1 seul mini après shampoing ! Moquette propre mais hors d'âge , et trop petit pour 4 on marche sur les bagages obligé de rester au sol......",Septembre 2022,Commentaire envoyé le 7 septembre 2022
388,Héléna,4.0,France,"Trop de déceptions, dommage...","- Le personnel du buffet, souriant, disponible, aux petits soins. Notre dîner a été enchanté par leur présence. - L'ambiance Cars et l'effet Route 66 bien recréés. - Photos avec les personnages.","La chambre : - Attention pour les PMR, familles avec poussettes ou autres affaires encombrantes : aucun ascenseur ! Même s'il y a au plus 1 étage seulement. - Aération insuffisante. - Pas de clim disponible, seulement des ventilateurs au plafond plein de poussière et qui n'apportent rien. Pour le prix c'est inadmissible. - Literie trop dure.",Juillet 2022,Commentaire envoyé le 25 août 2022
389,Masurier,6.0,France,Une nuit au mexique,"La décoration, le style des bâtiments, le fait de pouvoir se déplacer à pieds","Les rideaux ne fermaient pas correctement, pas de climatisation donc quand il fait 40°C les chambres sont des fours. Et surtout les serviettes de toilette étaient tachées donc à plus de 300€ la nuit c'est inacceptable",Août 2022,Commentaire envoyé le 24 août 2022
390,Geraldine,6.0,Belgique,Agréable,"chambre spacieuse, personnel souriant et emplacements parfait",la salle de bain n’étais pas propre (poil et cheveux d’autre visiteurs,Août 2022,Commentaire envoyé le 18 août 2022
391,Pascale,10.0,France,super,très bien,,Juillet 2022,Commentaire envoyé le 17 août 2022
392,Benoit,4.0,France,Très mauvais rapport qualité prix,L’emplacement est le seule point positif de cet hôtel vu le prix payé.,"Le rapport qualité prix est désastreux, pas de Climatisation, équipement obsolète, le starbuck de l’hôtel pas professionnel (sachet croissant usager même si je ne l’ai pas commandé je trouve ça écœurant), les distributeurs boissons ne fonctionnait pas, pas de piscine vu le prix ça pourrait être bien, déçu par Disney",Août 2022,Commentaire envoyé le 6 août 2022
393,Romane,10.0,France,Exceptionnel,la proximité  le rapport qualité prix,,Juillet 2022,Commentaire envoyé le 29 juillet 2022
394,Blandine,10.0,France,très bien,l’établissement est sympathique et très accueillant. navette bien pour aller à l’hôtel ou au parc Disneyland Paris,les navettes qu’il ont eu des difficultés à avancer car à cause d’une navette j’ai rater mon train.,Juillet 2022,Commentaire envoyé le 24 juillet 2022
395,Tatiana,10.0,Luxembourg,"séjour agréable, personnel souriant et chambres propres","Les chambres sont très propres et très bien insonorisées ! la douche fonctionnait bien, les lits sont confortables et l’emplacement de l’hôtel est parfait par rapport à Disneyland.",le prix de la chambre est très élevé,Juin 2022,Commentaire envoyé le 24 juin 2022
396,Morgane,10.0,France,Exceptionnel,La magie Disney,RAS,Juin 2022,Commentaire envoyé le 13 juin 2022
397,Julie,4.0,France,- Plus jamais dans cet hôtel !,"La navette, le responsable de l’hôtel ….",Quasiment tout. déplorable en tout point.,Juin 2022,Commentaire envoyé le 12 juin 2022
398,Luc,10.0,France,génial,confort de la literie propreté navette parc,ras,Juin 2022,Commentaire envoyé le 6 juin 2022
399,Fabio,10.0,Suisse,top,"le style de l’hôtel est top, la proximité des parcs Disney.  le personnel est vraiment sympathique",rien,Juin 2022,Commentaire envoyé le 4 juin 2022
400,Catherine,6.0,France,Correct,"Bon accueil, parking gratuit, très bon petit déjeuner et geste très agréable, gratuité du repas pour la fête des mères.","Nos cartes n'étaient pas actives, nous avons été obligé de repasser à l'accueil à minuit, un peu gênant. Petit soucis de chasse d'eau qui fuyait donc bruit gênant durant la nuit.",Mai 2022,Commentaire envoyé le 2 juin 2022
401,Victoria,6.0,Belgique,Magie,,"Niveau Propreté pas top, poussière et cheveux en rentrant dans la chambre. Première fois, mais pas deux pour notre part… pas très moderne mais mignon!  Mais toujours un plaisir de découvrir les hôtels Disney. Pour une nuit c’est très bien mais sans plus",Mai 2022,Commentaire envoyé le 29 mai 2022
402,France,10.0,France,super séjour de 2 jours tout était parfait,le logement indépendant de l’accueil  le calme  le parc à proximité,,Mai 2022,Commentaire envoyé le 29 mai 2022
403,Maeva,1.0,France,"Écœuré, nous avons dû payer 2 fois 963€ notre séjour par erreur informatique et personne ne peut nou","Écœuré, nous avons dû payer 2 fois 963€ notre séjour par erreur informatique et personne ne peut nous renseigner. C’est une honte. Nous avons engagé une procédure. A croire que toute les familles peuvent se permettre de payer une somme astronomique sans jamais rien dire. C’est désastreux. Réactivité pour encaisser mais pas pour solutionner un problème!","Écœuré, nous avons dû payer 2 fois 963€ notre séjour par erreur informatique et personne ne peut nous renseigner. C’est une honte. Nous avons engagé une procédure. A croire que toute les familles peuvent se permettre de payer une somme astronomique sans jamais rien dire. C’est désastreux. Réactivité pour encaisser mais pas pour solutionner un problème!",Avril 2022,Commentaire envoyé le 21 mai 2022
404,Nadege,10.0,France,Exceptionnel,"Nous avons passé un agréable séjour. L'équipe nous à très bien accueilli, ils ont été adorable et disponible tout au long de notre séjour. L'hôtel est bien située et très propre. Merci",,Mai 2022,Commentaire envoyé le 13 mai 2022
405,Ludovic,6.0,France,dormi au calme,le personnel extra,la rénovation a été faite à l’arrache manque de soins. pas de balayette à toilette.,Mai 2022,Commentaire envoyé le 12 mai 2022
406,Philippe,10.0,France,Exceptionnel,Un personnel a l écoute et souriant. Un très bon service et une bonne ambiance.,J'ai tout apprécié un perso,Mai 2022,Commentaire envoyé le 11 mai 2022
407,Depalma,10.0,France,magique,L’ambiance Le thème de l’hôtel  Le service,,Mai 2022,Commentaire envoyé le 9 mai 2022
408,Marie,6.0,France,un hôtel 2 étoiles non justifié par manque de prestations.La magie Dysney n a pas opéré.,"emplacement proche du parc ,le parking gratuit , l amabilité du personnel.","la cafétéria la Cantina  elle porte bien son nom 😊3 jours le même menu faritas ,porc a l ananas ,pâte ,frites ,etc…Au moins il faudrait un plat nouveau.Manque de saveur . gras ++++.bref comme à la cantine.Le prix beaucoup trop cher pour ce que l on présente……",Avril 2022,Commentaire envoyé le 28 avril 2022
409,Ritchie,2.0,Belgique,décevant,la déco,"le manque de propreté, le mobilier dégradé",Avril 2022,Commentaire envoyé le 28 avril 2022
410,Laurie,10.0,France,séjour excellent personnel au top,l’ambiance et la proximité de Disney,,Mars 2022,Commentaire envoyé le 18 avril 2022
411,Marie,10.0,France,Exceptionnel,"La proximité de la chambre avec le chemin pour aller au parc, la gentillesse des cast-members, la proximité du parking.","Je trouve dommage qu'on ne puisse pas acheter un petit encas chaud le soir quand le restaurant est complet (ex: un croque-monsieur, un cornet de pâtes...)",Avril 2022,Commentaire envoyé le 13 avril 2022
412,Thierry,6.0,France,Agréable,Proximité,Équipements,Mars 2022,Commentaire envoyé le 10 avril 2022
413,Elodie,10.0,France,Exceptionnel,La navette,Le prix !,Mars 2022,Commentaire envoyé le 9 avril 2022
414,Carole,6.0,France,Agréable,Excellent rapport qualité prix Le personnel à la réception et à la boutique,.Le froid dans la chambre et impossible de mettre le chauffage. Le bruit assourdissant de la ventilation.,Avril 2022,Commentaire envoyé le 6 avril 2022
415,Rosa,10.0,Belgique,je reviendrais à cet hôtel,personnel très sympathique. petit déjeuner juste parfait à volonté et le personnel est top,,Mars 2022,Commentaire envoyé le 4 avril 2022
416,Tarik,4.0,France,Décevant,Hôtel a rénové,,Mars 2022,Commentaire envoyé le 2 avril 2022
417,Metais,10.0,France,Exceptionnel,"Le restaurant était excellent, beaucoup de choix en nourriture et en boissons et de la bonne qualité. La chambre est parfaite avec des petites décorations très mignonnes et dans le thème de Cars ce qui est le but de l'hôtel.",Tout était très bien ! Rien ne m'a interpellé.,Mars 2022,Commentaire envoyé le 1 avril 2022
418,Charlotte,6.0,France,Agréable,satisfaisant pour l’emplacement,"la literie inconfortable, matelas dur  bruit de VMC continue dans la salle de bain",Mars 2022,Commentaire envoyé le 31 mars 2022
419,Vincent,5.0,France,Passable,,Propriétaire de la chambre ménage n'ont fait. Salle,Mars 2022,Commentaire envoyé le 30 mars 2022
420,Laura,4.0,Suisse,Décevant,"L'emplacement, le restaurant de l'hôtel","Chambre d'hôtel impossible à ouvrir, lavabo qui fuit, chambre avec un gros problème d'insonorisation,",Mars 2022,Commentaire envoyé le 30 mars 2022
421,Isabelle,10.0,France,Parfait,Parfait,,Mars 2022,Commentaire envoyé le 30 mars 2022
422,Geoffrey,6.0,Belgique,univers parfait mais confort a améliorer,l’emplacement est top pour l’accès au parc et parking très facile.  le staff est aussi sur sympa,"l’insonorisation laisse cruellement à désirer.  contrairement à d’autres avis, la literie chez nous était pas terrible (usure?). Nous étions dans le bâtiment 33, plus loin des facilités de l’hôtel, la est peut-être la différence ?",Mars 2022,Commentaire envoyé le 29 mars 2022
423,Graffin,10.0,France,Exceptionnel,L'ambiance la thématique et la distance à pied du parc très pratique pour la soirée et la journée en général le personnel ménager et accueil très sympathique  l'extérieur repein ainsi que les espace vert sont très agréables,L'isolation sonore avec les chambres voisine ainsi que l'extérieur le prix un petit peu élève mes nous avons passé un bon séjour,Mars 2022,Commentaire envoyé le 28 mars 2022
424,Stéphanie,5.0,France,Passable,"Le personnel est toujours très agréable, accueillant Les navettes sont pratiques et en cette saison, elles ne sont pas trop bondées",La déco de la chambre est vieillotte,Mars 2022,Commentaire envoyé le 27 mars 2022
425,Flicce,5.0,France,Passable mais sale,"La décoration extérieure, l'emplacement",La propreté a revoir,Mars 2022,Commentaire envoyé le 26 mars 2022
426,B,10.0,,Exceptionnel,Propre et tres bonne literie.,"Le prix du petit dejeuner, buffet à volonté, c'est trop cher surtout pour les enfants!",Mars 2022,Commentaire envoyé le 26 mars 2022
427,Nathanael,5.0,France,impression de mise à l’écart par rapport à disney suite réservation sur booking,la proximité au parc disneyland et le thème cars,bâtiment le plus loin possible,Mars 2022,Commentaire envoyé le 26 mars 2022
428,Audrey,10.0,France,un séjour magique,tout ! un personnel au top de la topitude !,rien,Mars 2022,Commentaire envoyé le 24 mars 2022
429,Anais,6.0,France,Sympa sans plus,,"Manque d insonorisation nous entendions tout de la chambre d'à côté.  Les peintures vétustes,  abîmés à certains endroits. Moisissure dans la salle de bain. Les communs auraient besoin d un peu de rafraîchissement. Même pas d'équipements tel un mini frigo ou encore une bouilloire. La déco pourrait être un peu plus fournie voire rafraîchie. Pour quasi 400euros les 2 nuits je trouve cela un peu limite",Mars 2022,Commentaire envoyé le 24 mars 2022
430,Arthur,6.0,France,Demi-magie Disney pour 50% plus cher qu'ailleurs.,La proximité avec les parcs Disneyland.,"La thématisation vieillotte du lobby et du restaurant de l'hôtel, pas de tout à la hauteur de Disney.",Mars 2022,Commentaire envoyé le 24 mars 2022
431,Coumba,6.0,France,Agréable,Propreté,Chauffage dans la salle de bain. Il faisait froid dans la salle de bain. Impossible d’allumer le chauffage.,Mars 2022,Commentaire envoyé le 24 mars 2022
432,Noëllie,10.0,France,Mon séjour était au top.,L'accueil est toujours au top. Les chambres sont calmes. L'ambiance de cet hôtel est chaleureux et le personnel est formidable. Tout était super.,Rien,Mars 2022,Commentaire envoyé le 24 mars 2022
433,François,3.0,France,Très  déçu  rapport qualité  prix ..,La literie au top et les navettes pour se rendre aux parcs appréciables.,La propreté dans les chambres a revoir complètement.  L' eau de la baignoire  ne s'ecoulait pas du tout  lorsque l' on prenait la douche .,Mars 2022,Commentaire envoyé le 23 mars 2022
434,Julien,10.0,France,Exceptionnel,super hôtel ! j’y vais depuis des années. Bon rapport qualité/prix,,Mars 2022,Commentaire envoyé le 23 mars 2022
435,Warembourg,10.0,France,Exceptionnel,Tout,Ruen,Mars 2022,Commentaire envoyé le 23 mars 2022
436,Loic,10.0,France,Moyen mais correct,L’emplacement et le service du personnel,"Chambre à la température froide , bruyante par les voisin qui nous ont pourrie nos soirées",Mars 2022,Commentaire envoyé le 20 mars 2022
437,Laura,2.0,France,Médiocre,Rien,"Problème à l'arriver pour ma réservation 3/4 d'heure d'attente. L'hôtel est une usine plutôt qu'un hôtel. Pour trouver la chambre une vrai catastrophe il faut chercher son bâtiment en pleine nuit à l'extérieur. Très mal insonorisé on entend tout chez les voisins, la salle de bain et la propreté de la chambre est à revoir, des cheveux dans la baignoire, du sable dans la cuvette, de la poussière partout. Pour manger au restaurant il faut réserver avant. Et pour 32 euros c'est très cher pour ce qu'il propose. Meme a volonté. Enfin si vous voulez du familiale on repassera. Mais bon pour le prix on ne pouvez pas s'attendre à mieux. C'est le moins cher de disney.",Mars 2022,Commentaire envoyé le 16 mars 2022
438,Marceline,10.0,France,Exceptionnel,Tout,Rien,Mars 2022,Commentaire envoyé le 15 mars 2022
439,Stephanie,10.0,Belgique,Exceptionnel,Navette toutes les 10 min  La propreté des chambres,Rien,Décembre 2021,Commentaire envoyé le 14 mars 2022
440,Elodie,10.0,France,Exceptionnel,L'emplacement Le personnel très agréable,,Mars 2022,Commentaire envoyé le 14 mars 2022
441,Thomas,10.0,France,Exceptionnel,,manque de prise à côté des lits,Mars 2022,Commentaire envoyé le 14 mars 2022
442,Gil,5.0,France,"Très bien accueilli, bien dormi, mais un certain nombre de défauts ne correspondent pas à ""la magie""",accueil du personnel réception et La Cantina : TB,"Bâtiment (47) : porte coupe feu accepterait volontiers bon coup de peinture. Chambre 215 : porte de la salle de bain qui grince (manque de discrétion la nuit si plusieurs dormeurs). Eau moins que tiède à 7h00 du matin. Service : je suis parti samedi matin ; je vous écris ce dimanche am ; j'ai oublié mon chargeur téléphone dans la chambre. J'espère que le personnel de chambre et l'administration de l'établissement, ayant mes coordonnées fera le nécessaire pour me le faire parvenir.",Mars 2022,Commentaire envoyé le 13 mars 2022
443,Céline,10.0,France,Exceptionnel,Tout,Rien,Mars 2022,Commentaire envoyé le 12 mars 2022
444,Ludivine,10.0,France,magique,l accueil et le lieu ainsi que le personnel de Disney,couette pas assez grande pour deux personnes et oreiller trop petit,Mars 2022,Commentaire envoyé le 9 mars 2022
445,Stephanie,5.0,France,Passable,Rien,La salle de bain salle trop petite lit pas confortable hôtel très défraîchis,Mars 2022,Commentaire envoyé le 9 mars 2022
446,Gabrielle,4.0,France,Je ne recommande pas cet hôtel,Le choix dans le petit déjeuner,"La chambre n’était pas propre , pas d’insonorisation , literie pas confortable … La chambre mériterait d’une bonne remise en état !",Mars 2022,Commentaire envoyé le 8 mars 2022
447,Guy,5.0,France,dessus du séjour,le petit déjeuner,les chambres de Monde être rénové il y a que l’accueil de la réception qui est moderne les chambres la propreté de Satie Siri toile d’araignée araignée au plafond saleté sur la moquette salle de bain qui fuit,Mars 2022,Commentaire envoyé le 8 mars 2022
448,Audrey,10.0,France,Exceptionnel,"Nous avons beaucoup apprécié l'accueil,les services,la magie Disney !",Je n'ai rien a reprocher à cet établissement,Mars 2022,Commentaire envoyé le 8 mars 2022
449,Lydia,10.0,Belgique,très bonne impression en général du séjour,"la proximité du Parc Disneyland, la navette pour le Parc, le grand parking, le personnel très aimable","La literie, les poubelles non vidées",Mars 2022,Commentaire envoyé le 7 mars 2022
450,Christelle,10.0,France,Exceptionnel,Personnel très accueillant et à l’écoute,,Mars 2022,Commentaire envoyé le 6 mars 2022
451,Baptiste,10.0,France,"fabuleux, magnifique cadre et personnelle plus que agréable.",le décor nous a directement plonger dans le film Cars,j’ai du payer en double les petits déjeuner qui était déjà payer avec la réservation.,Février 2022,Commentaire envoyé le 4 mars 2022
452,Agnès,10.0,France,un séjour merveilleux,génial comme d’habitude,tout est bien chez Disney,Mars 2022,Commentaire envoyé le 4 mars 2022
453,Valérie,10.0,Belgique,tout était parfait du début à la fin,parfait à recommender,,Février 2022,Commentaire envoyé le 3 mars 2022
454,Valérie,10.0,Belgique,A recommander vivement bon rapport qualité  prix,"tout était parfait l'accueil, la chambre, le personnel.",rien,Mars 2022,Commentaire envoyé le 3 mars 2022
455,Gwen,2.0,France,"Parcs et personnel au top , Hôtel décevant",le personnel est très agréable,"Les chambres sont très mal insonorisées, nous entendions nos voisins de pallier parler au téléphone comme s’ils étaient dans la pièce d’à coté (nous avons entendu des ébats sexuels jusque 3h du matin , et je tiens à préciser que je voyageais avec mon petit garçon pour son anniversaire. ) je reste quand même déçue quand au bruit, et la qualité des locaux que je n’ai trouvé jusqu’à présent qu’au Newport bay. la température de la chambre était très froide  et Les oreillers en plumes horribles ! Je suis allée plusieurs fois au Séquoia et au Newport , je n’en garde que de bons souvenirs, j’essaie d’aller aux parcs Disney au moins une fois par an, car il me faut économiser un sacré budget pour pouvoir offrir ce séjour à mes enfants et moi (n’étant que conseillère de vente)  C’est pour cela que je reste quand même déçue de mon séjour dans cet établissement , par rapport au fait que nous ayons mal dormis, un hôtel est fait pour dormir , mais si nous ne le pouvons pas cela reste quand même décevant, surtout pour une seule nuit  L’ensemble du personnel est adorable, et nous avons bien mangé, ce sont les deux seuls points positifs de notre séjour d’une nuit. cordialement  Mme Fonseca Gwendoline",Février 2022,Commentaire envoyé le 28 février 2022
456,Emily,1.0,France,Mauvais,Rien,"Loin, En fait c'est plein de bâtiments Petites chambres",Janvier 2022,Commentaire envoyé le 24 février 2022
457,Oliv,10.0,La Réunion,a refaire,top,rien,Février 2022,Commentaire envoyé le 24 février 2022
458,Guillaume,4.0,France,Pas à la hauteur de nos espérances et du prix payé.,Accueil du personnel.  Petit-déjeuner.,"Chambre vieillissante, mauvaise qualité de réception de la télévision, qui fait qu’il était impossible de la regarder.  Des claquements intempestifs, certainement dus au vent, nous ont empêchés de dormir une partie de la première nuit. La personne à l’accueil semblait peu intéressée par le problème le lendemain...",Février 2022,Commentaire envoyé le 22 février 2022
